336320,"Motor Vehicle Electrical and Electronic Equipment Manufacturing",0,0,0,0,0
336330,"Motor Vehicle Steering and Suspension Components (except Spring) Manufacturing",0,0,0,0,0
336340,"Motor Vehicle Brake System Manufacturing",0,0,0,0,0
336350,"Motor Vehicle Transmission and Power Train Parts Manufacturing",0,0,0,0,0
336360,"Motor Vehicle Seating and Interior Trim Manufacturing",0,0,0,0,0
336370,"Motor Vehicle Metal Stamping",0,0,0,0,0
336390,"Other Motor Vehicle Parts Manufacturing",0,0,0,0,0
336411,"Aircraft Manufacturing",0,0,0,0,0
336412,"Aircraft Engine and Engine Parts Manufacturing",0,0,0,0,0
336413,"Other Aircraft Parts and Auxiliary Equipment Manufacturing",0,0,0,0,0
336414,"Guided Missile and Space Vehicle Manufacturing",0,0,0,0,0
336415,"Guided Missile and Space Vehicle Propulsion Unit and Propulsion Unit Parts Manufacturing",0,0,0,0,0
336419,"Other Guided Missile and Space Vehicle Parts and Auxiliary Equipment Manufacturing",0,0,0,0,0
336510,"Railroad Rolling Stock Manufacturing",0,0,0,0,0
336611,"Ship Building and Repairing",0,0,0,0,0
336612,"Boat Building",0,0,0,0,0
336991,"Motorcycle, Bicycle, and Parts Manufacturing",0,0,0,0,0
336992,"Military Armored Vehicle, Tank, and Tank Component Manufacturing",0,0,0,0,0
336999,"All Other Transportation Equipment Manufacturing",0,0,0,0,0
337110,"Wood Kitchen Cabinet and Countertop Manufacturing",0,0,0,0,0
337121,"Upholstered Household Furniture Manufacturing",0,0,0,0,0
337122,"Nonupholstered Wood Household Furniture Manufacturing",0,0,0,0,0
337126,"Household Furniture (except Wood and Upholstered) Manufacturing",0,0,0,0,0
337127,"Institutional Furniture Manufacturing",0,0,0,0,0
337211,"Wood Office Furniture Manufacturing",0,0,0,0,0
337212,"Custom Architectural Woodwork and Millwork Manufacturing",0,0,0,0,0
337214,"Office Furniture (except Wood) Manufacturing",0,0,0,0,0
337215,"Showcase, Partition, Shelving, and Locker Manufacturing",0,0,0,0,0
337910,"Mattress Manufacturing",0,0,0,0,0
337920,"Blind and Shade Manufacturing",0,0,0,0,0
339112,"Surgical and Medical Instrument Manufacturing",0,0,0,0,0
339113,"Surgical Appliance and Supplies Manufacturing",0,0,0,0,0
339114,"Dental Equipment and Supplies Manufacturing",0,0,0,0,0
339115,"Ophthalmic Goods Manufacturing",0,0,0,0,0
339116,"Dental Laboratories",0,0,0,0,0
339910,"Jewelry and Silverware Manufacturing",0,0,0,0,0
339920,"Sporting and Athletic Goods Manufacturing",0,0,0,0,0
339930,"Doll, Toy, and Game Manufacturing",0,0,0,0,0
339940,"Office Supplies (except Paper) Manufacturing",0,0,0,0,0
339950,"Sign Manufacturing",0,0,0,0,0
339991,"Gasket, Packing, and Sealing Device Manufacturing",0,0,0,0,0
339992,"Musical Instrument Manufacturing",0,0,0,0,0
339993,"Fastener, Button, Needle, and Pin Manufacturing",0,0,0,0,0
339994,"Broom, Brush, and Mop Manufacturing",0,0,0,0,0
339995,"Burial Casket Manufacturing",0,0,0,0,0
339999,"All Other Miscellaneous Manufacturing",0,0,0,0,0
423110,"Automobile and Other Motor Vehicle Merchant Wholesalers",0,0,0,0,0
423120,"Motor Vehicle Supplies and New Parts Merchant Wholesalers",0,0,0,0,0
423130,"Tire and Tube Merchant Wholesalers",0,0,0,0,0
423140,"Motor Vehicle Parts (Used) Merchant Wholesalers",0,0,0,0,0
423210,"Furniture Merchant Wholesalers",0,0,0,0,0
423220,"Home Furnishing Merchant Wholesalers",0,0,0,0,0
423310,"Lumber, Plywood, Millwork, and Wood Panel Merchant Wholesalers",0,0,0,0,0
423320,"Brick, Stone, and Related Construction Material Merchant Wholesalers",0,0,0,0,0
423330,"Roofing, Siding, and Insulation Material Merchant Wholesalers",0,0,0,0,0
423390,"Other Construction Material Merchant Wholesalers",0,0,0,0,0
423410,"Photographic Equipment and Supplies Merchant Wholesalers",0,0,0,0,0
423420,"Office Equipment Merchant Wholesalers",0,0,0,0,0
423430,"Computer and Computer Peripheral Equipment and Software Merchant Wholesalers",0,0,0,0,0
423440,"Other Commercial Equipment Merchant Wholesalers",0,0,0,0,0
423450,"Medical, Dental, and Hospital Equipment and Supplies Merchant Wholesalers",0,0,0,0,0
423460,"Ophthalmic Goods Merchant Wholesalers",0,0,0,0,0
423490,"Other Professional Equipment and Supplies Merchant Wholesalers",0,0,0,0,0
423510,"Metal Service Centers and Other Metal Merchant Wholesalers",0,0,0,0,0
423520,"Coal and Other Mineral and Ore Merchant Wholesalers",0,0,0,0,0
423610,"Electrical Apparatus and Equipment, Wiring Supplies, and Related Equipment Merchant Wholesalers",0,0,0,0,0
423620,"Household Appliances, Electric Housewares, and Consumer Electronics Merchant Wholesalers",0,0,0,0,0
423690,"Other Electronic Parts and Equipment Merchant Wholesalers",0,0,0,0,0
423710,"Hardware Merchant Wholesalers",0,0,0,0,0
423720,"Plumbing and Heating Equipment and Supplies (Hydronics) Merchant Wholesalers",0,0,0,0,0
423730,"Warm Air Heating and Air-Conditioning Equipment and Supplies Merchant Wholesalers",0,0,0,0,0
423740,"Refrigeration Equipment and Supplies Merchant Wholesalers",0,0,0,0,0
423810,"Construction and Mining (except Oil Well) Machinery and Equipment Merchant Wholesalers",0,0,0,0,0
423820,"Farm and Garden Machinery and Equipment Merchant Wholesalers",0,0,0,0,0
423830,"Industrial Machinery and Equipment Merchant Wholesalers",0,0,0,0,0
423840,"Industrial Supplies Merchant Wholesalers",0,0,0,0,0
423850,"Service Establishment Equipment and Supplies Merchant Wholesalers",0,0,0,0,0
423860,"Transportation Equipment and Supplies (except Motor Vehicle) Merchant Wholesalers",0,0,0,0,0
423910,"Sporting and Recreational Goods and Supplies Merchant Wholesalers",0,0,0,0,0
423920,"Toy and Hobby Goods and Supplies Merchant Wholesalers",0,0,0,0,0
423930,"Recyclable Material Merchant Wholesalers",0,0,0,0,0
423940,"Jewelry, Watch, Precious Stone, and Precious Metal Merchant Wholesalers",0,0,0,0,0
423990,"Other Miscellaneous Durable Goods Merchant Wholesalers",0,0,0,0,0
424110,"Printing and Writing Paper Merchant Wholesalers",0,0,0,0,0
424120,"Stationery and Office Supplies Merchant Wholesalers",0,0,0,0,0
424130,"Industrial and Personal Service Paper Merchant Wholesalers",0,0,0,0,0
424210,"Drugs and Druggists' Sundries Merchant Wholesalers",0,0,0,0,0
424310,"Piece Goods, Notions, and Other Dry Goods Merchant Wholesalers",0,0,0,0,0
424340,"Footwear Merchant Wholesalers",0,0,0,0,0
424350,"Clothing and Clothing Accessories Merchant Wholesalers",0,0,0,0,0
424410,"General Line Grocery Merchant Wholesalers",0,0,0,0,0
424420,"Packaged Frozen Food Merchant Wholesalers",0,0,0,0,0
424430,"Dairy Product (except Dried or Canned) Merchant Wholesalers",0,0,0,0,0
424440,"Poultry and Poultry Product Merchant Wholesalers",0,0,0,0,0
424450,"Confectionery Merchant Wholesalers",0,0,0,0,0
424460,"Fish and Seafood Merchant Wholesalers",0,0,0,0,0
424470,"Meat and Meat Product Merchant Wholesalers",0,0,0,0,0
424480,"Fresh Fruit and Vegetable Merchant Wholesalers",0,0,0,0,0
424490,"Other Grocery and Related Products Merchant Wholesalers",0,0,0,0,0
424510,"Grain and Field Bean Merchant Wholesalers",0,0,0,0,0
424520,"Livestock Merchant Wholesalers",0,0,0,0,0
424590,"Other Farm Product Raw Material Merchant Wholesalers",0,0,0,0,0
424610,"Plastics Materials and Basic Forms and Shapes Merchant Wholesalers",0,0,0,0,0
424690,"Other Chemical and Allied Products Merchant Wholesalers",0,0,0,0,0
424710,"Petroleum Bulk Stations and Terminals",0,0,0,0,0
424720,"Petroleum and Petroleum Products Merchant Wholesalers (except Bulk Stations and Terminals)",0,0,0,0,0
424810,"Beer and Ale Merchant Wholesalers",0,0,0,0,0
424820,"Wine and Distilled Alcoholic Beverage Merchant Wholesalers",0,0,0,0,0
424910,"Farm Supplies Merchant Wholesalers",0,0,0,0,0
424920,"Book, Periodical, and Newspaper Merchant Wholesalers",0,0,0,0,0
424930,"Flower, Nursery Stock, and Florists' Supplies Merchant Wholesalers",0,0,0,0,0
424940,"Tobacco and Tobacco Product Merchant Wholesalers",0,0,0,0,0
424950,"Paint, Varnish, and Supplies Merchant Wholesalers",0,0,0,0,0
424990,"Other Miscellaneous Nondurable Goods Merchant Wholesalers",0,0,0,0,0
425120,"Wholesale Trade Agents and Brokers",0,0,0,0,0
441110,"New Car Dealers",0.763984843043,0.0383175267813,0.0528031591373,93596.7000972,67982.0948005
441120,"Used Car Dealers",0.322218790805,0.0120807237578,0.0389527279667,78880.2806221,24632.2671517
441210,"Recreational Vehicle Dealers",0.0217825195401,-0.00134248593349,-0.0580534320315,91114.8012209,2109.02687167
441222,"Boat Dealers",0.0131565309042,-0.00145929009944,-0.099843183567,82324.2532251,1204.17661096
441227,"Motorcycle, ATV, and All Other Motor Vehicle Dealers",0.00741434563253,-6.40072449462E-5,-0.00855900303114,63037.157995,472.799886328
441330,"Automotive Parts and Accessories Retailers",0.00666659582658,0.000632010141569,0.104731322838,46307.2165901,284.249553417
441340,"Tire Dealers",0.00594863147187,0.000519057054667,0.0955981104196,60168.9541749,332.991977444
444110,"Home Centers",0.00522850662262,0.00041201447557,0.0855424369003,50170.546295,242.766365182
444120,"Paint and Wallpaper Stores",0.00466588037384,0.000325368050233,0.0749607479429,61993.9562034,280.383963779
444140,"Hardware Retailers",0.00430912362782,0.000263407505661,0.0651077578622,40293.0083784,165.852616229
444180,"Other Building Material Dealers",0.00596675201167,0.000855824534736,0.167449946922,74139.2950906,384.645348887
444230,"Outdoor Power Equipment Retailers",0,0,0,0,0
444240,"Nursery, Garden Center, and Farm Supply Retailers",0.00832036915645,-0.000952454755888,-0.102714638485,30219.5206542,285.78064325
445110,"Supermarkets and Other Grocery (except Convenience) Stores",0.0100594062885,0.0010789398039,0.120142957579,36416.0142729,333.755474143
445131,"Convenience Retailers",0.0298707729389,0.00151563549958,0.053451883378,34632.6503083,7156.92610849
445132,"Vending Machine Operators",0.00921793541744,0.000910373506569,0.109583716178,38392.3986418,328.101254171
445230,"Fruit and Vegetable Markets",0,0,0,0,0
445240,"Meat Retailers",0.00901058407464,0.000644813791927,0.0770776354282,37456.4959144,327.737301042
445250,"Fish and Seafood Retailers",0.0281930646116,-0.0196809949646,-0.411099353989,31636.9030057,1514.5869793
445291,"Baked Goods Stores",0.0636670823273,-0.0123896732761,-0.162900365363,22890.1951591,1743.42353597
445292,"Confectionery and Nut Stores",0,0,0,0,0
445298,"All Other Specialty Food Retailers",0.0743113616159,-0.00762358545204,-0.0930443690373,35933.0389025,3068.08383302
445320,"Beer, Wine, and Liquor Retailers",0.0768779488486,-0.00427312985618,-0.0526564763449,20945.8159217,1775.35923762
449110,"Furniture Retailers",0.0924455080781,0.00265362584061,0.0295530706617,57606.7840097,5202.60301703
449121,"Floor Covering Retailers",0.105450437862,0.00399944938423,0.0394224782256,83434.9044769,8495.38745908
449122,"Window Treatment Retailers",0.113303489793,0.00453930267451,0.0417352696212,80449.1670093,9412.63406246
449129,"All Other Home Furnishings Retailers",0.116813129924,0.00446109058552,0.0397063605769,36292.3167993,4189.25208976
449210,"Electronics and Appliance Retailers",0.116147271225,0.003873714254,0.0345024630779,57499.2979058,6727.61163892
455110,"Department Stores",0.108407322095,0.00262092570748,0.0247756403185,29668.5013227,3198.12289764
455211,"Warehouse Clubs and Supercenters",0.0960815213554,0.00140052124952,0.0147919989011,46375.9928564,4390.92538455
455219,"All Other General Merchandise Retailers",0.0732682087725,-0.000362037810796,-0.00491697132084,31436.7498631,2316.7769971
456110,"Pharmacies and Drug Retailers",0.0454285938031,0.00221587358586,0.0512782711831,63527.3496474,2807.90341763
456120,"Cosmetics, Beauty Supplies, and Perfume Retailers",0.0523291629994,0.00214970032147,0.0428402419385,23983.5562727,1273.53209864
456130,"Optical Goods Retailers",0.0588920989741,0.00206418431028,0.0363234217284,43008.4308263,2598.39961677
456191,"Food (Health) Supplement Retailers",0.0637215489943,0.00187157119645,0.030259852357,37406.8929673,2715.63813907
456199,"All Other Health and Personal Care Retailers",0.0632988728848,0.00131400090051,0.0211987354082,56866.2347656,3715.42623166
457110,"Gasoline Stations with Convenience Stores",0.0589830097285,0.000666935557383,0.0114365647356,29881.9746215,1778.33599524
457120,"Other Gasoline Stations",0.0507125699069,5.32083045641E-5,0.00105031533918,52473.2107125,2953.68860585
457210,"Fuel Dealers",0.03297306375,-0.00148604819776,-0.0431249708354,66969.3329111,2384.99610757
458110,"Clothing and Clothing Accessories Retailers",0.0270280382731,0.00191604070668,0.0762998125346,27395.9523315,723.068566122
458210,"Shoe Retailers",0.0311238216124,0.00191195388868,0.0654512716121,23162.6377885,678.041793048
458310,"Jewelry Retailers",0.034802583057,0.00184800858526,0.05607745252,72839.036327,2448.54974354
458320,"Luggage and Leather Goods Retailers",0.0377712364427,0.00171264227601,0.0474960911701,19123.3757536,709.725139861
459110,"Sporting Goods Retailers",0.0396938131259,0.00148979161276,0.0389956751608,31240.5550277,1220.9527837
459120,"Hobby, Toy, and Game Retailers",0.0401132633532,0.00112163501069,0.0287660469277,24340.7600973,962.673746356
459130,"Sewing, Needlework, and Piece Goods Retailers",0.0379826480959,0.000515340790657,0.0137544122522,35598.1496505,1342.14880719
459140,"Musical Instrument and Supplies Retailers",0.0328556032991,-0.000155097223935,-0.0046983923842,44921.2434481,1489.14907907
459210,"Book Retailers and News Dealers",0.0218729288115,-0.00152878215737,-0.0653277941688,30917.0422253,741.679693779
459310,Florists,0.0175231174697,0.00158286403334,0.0992998034607,25369.570996,410.244734954
459410,"Office Supplies and Stationery Retailers",0.0201049810938,0.00156489382837,0.0844059580719,55891.9056322,1047.69215877
459420,"Gift, Novelty, and Souvenir Retailers",0.0223885301056,0.00149900327466,0.0717586035716,37048.153547,782.801698856
459510,"Used Merchandise Retailers",0.0240854105752,0.00135354157886,0.0595437875823,28229.5598091,697.461289376
459910,"Pet and Pet Supplies Retailers",0.0248137329857,0.00109955098661,0.046366810656,36755.6297116,880.813869569
459920,"Art Dealers",0.0236342266697,0.000649687426079,0.0282662801805,37616.3091959,948.820642748
459930,"Manufactured (Mobile) Home Dealers",0.0199840095886,9.82991791608E-5,0.00494320681216,121978.39534,2434.83126974
459991,"Tobacco, Electronic Cigarette, and Other Smoking Supplies Retailers",0.0112934208871,-0.00110811921735,-0.0893533551495,34119.8243576,435.143960585
459999,"All Other Miscellaneous Retailers",0.00925489612311,0.00121201122023,0.150693592519,32167.3788694,341.905268032
481111,"Scheduled Passenger Air Transportation",0,0,0,0,0
481112,"Scheduled Freight Air Transportation",0,0,0,0,0
481211,"Nonscheduled Chartered Passenger Air Transportation",0,0,0,0,0
481212,"Nonscheduled Chartered Freight Air Transportation",0,0,0,0,0
481219,"Other Nonscheduled Air Transportation",0,0,0,0,0
482110,"Rail transportation",0,0,0,0,0
483111,"Deep Sea Freight Transportation",0,0,0,0,0
483112,"Deep Sea Passenger Transportation",0,0,0,0,0
483113,"Coastal and Great Lakes Freight Transportation",0,0,0,0,0
483114,"Coastal and Great Lakes Passenger Transportation",0,0,0,0,0
483211,"Inland Water Freight Transportation",0,0,0,0,0
483212,"Inland Water Passenger Transportation",0,0,0,0,0
484110,"General Freight Trucking, Local",0,0,0,0,0
484121,"General Freight Trucking, Long-Distance, Truckload",0,0,0,0,0
484122,"General Freight Trucking, Long-Distance, Less Than Truckload",0,0,0,0,0
484210,"Used Household and Office Goods Moving",0,0,0,0,0
484220,"Specialized Freight (except Used Goods) Trucking, Local",0,0,0,0,0
484230,"Specialized Freight (except Used Goods) Trucking, Long-Distance",0,0,0,0,0
485111,"Mixed Mode Transit Systems",0,0,0,0,0
485112,"Commuter Rail Systems",0,0,0,0,0
485113,"Bus and Other Motor Vehicle Transit Systems",0,0,0,0,0
485119,"Other Urban Transit Systems",0,0,0,0,0
485210,"Interurban and Rural Bus Transportation",0,0,0,0,0
485310,"Taxi Service",0,0,0,0,0
485320,"Limousine Service",0,0,0,0,0
485410,"School and Employee Bus Transportation",0,0,0,0,0
485510,"Charter Bus Industry",0,0,0,0,0
485991,"Special Needs Transportation",0,0,0,0,0
485999,"All Other Transit and Ground Passenger Transportation",0,0,0,0,0
486110,"Pipeline Transportation of Crude Oil",0,0,0,0,0
486210,"Pipeline Transportation of Natural Gas",0,0,0,0,0
486910,"Pipeline Transportation of Refined Petroleum Products",0,0,0,0,0
486990,"All Other Pipeline Transportation",0,0,0,0,0
487110,"Scenic and Sightseeing Transportation, Land",0,0,0,0,0
487210,"Scenic and Sightseeing Transportation, Water",0,0,0,0,0
487990,"Scenic and Sightseeing Transportation, Other",0,0,0,0,0
488111,"Air Traffic Control",0,0,0,0,0
488119,"Other Airport Operations",0,0,0,0,0
488190,"Other Support Activities for Air Transportation",0,0,0,0,0
488210,"Support Activities for Rail Transportation",0,0,0,0,0
488310,"Port and Harbor Operations",0,0,0,0,0
488320,"Marine Cargo Handling",0,0,0,0,0
488330,"Navigational Services to Shipping",0,0,0,0,0
488390,"Other Support Activities for Water Transportation",0,0,0,0,0
488410,"Motor Vehicle Towing",0,0,0,0,0
488490,"Other Support Activities for Road Transportation",0,0,0,0,0
488510,"Freight Transportation Arrangement",0,0,0,0,0
488991,"Packing and Crating",0,0,0,0,0
488999,"All Other Support Activities for Transportation",0,0,0,0,0
491110,"Postal Service",0,0,0,0,0
492110,"Couriers and Express Delivery Services",0,0,0,0,0
492210,"Local Messengers and Local Delivery",0,0,0,0,0
493110,"General Warehousing and Storage",0,0,0,0,0
493120,"Refrigerated Warehousing and Storage",0,0,0,0,0
493130,"Farm Product Warehousing and Storage",0,0,0,0,0
493190,"Other Warehousing and Storage",0,0,0,0,0
512110,"Motion Picture and Video Production",0,0,0,0,0
512120,"Motion Picture and Video Distribution",0,0,0,0,0
512131,"Motion Picture Theaters (except Drive-Ins)",0,0,0,0,0
512132,"Drive-In Motion Picture Theaters",0,0,0,0,0
512191,"Teleproduction and Other Postproduction Services",0,0,0,0,0
512199,"Other Motion Picture and Video Industries",0,0,0,0,0
512230,"Music Publishers",0,0,0,0,0
512240,"Sound Recording Studios",0,0,0,0,0
512250,"Record Production and Distribution",0,0,0,0,0
512290,"Other Sound Recording Industries",0,0,0,0,0
513110,"Newspaper Publishers",0,0,0,0,0
513120,"Periodical Publishers",0,0,0,0,0
513130,"Book Publishers",0,0,0,0,0
513140,"Directory and Mailing List Publishers",0,0,0,0,0
513191,"Greeting Card Publishers",0,0,0,0,0
513199,"All Other Publishers",0,0,0,0,0
513210,"Software Publishers",0,0,0,0,0
516110,"Radio Broadcasting Stations",0,0,0,0,0
516120,"Television Broadcasting Stations",0,0,0,0,0
516210,"Media Streaming Distribution Services, Social Networks, and Other Media Networks and Content Providers",0,0,0,0,0
517111,"Wired Telecommunications Carriers",0,0,0,0,0
517112,"Wireless Telecommunications Carriers (except Satellite)",0,0,0,0,0
517121,"Telecommunications Resellers",0,0,0,0,0
517410,"Satellite Telecommunications",0,0,0,0,0
517810,"All Other Telecommunications",0,0,0,0,0
518210,"Data Processing, Hosting, and Related Services",0,0,0,0,0
519210,"Libraries and Archives",0,0,0,0,0
519290,"Web Search Portals and All Other Information Services",0,0,0,0,0
521110,"Monetary Authorities-Central Bank",0,0,0,0,0
522110,"Commercial Banking",0,0,0,0,0
522130,"Credit Unions",0,0,0,0,0
522180,"Savings Institutions and Other Depository Credit Intermediation",0,0,0,0,0
522210,"Credit Card Issuing",0,0,0,0,0
522220,"Sales Financing",0,0,0,0,0
522291,"Consumer Lending",0,0,0,0,0
522292,"Real Estate Credit",0,0,0,0,0
522299,"International, Secondary Market, and All Other Nondepository Credit Intermediation",0,0,0,0,0
522310,"Mortgage and Nonmortgage Loan Brokers",0,0,0,0,0
522320,"Financial Transactions Processing, Reserve, and Clearinghouse Activities",0,0,0,0,0
522390,"Other Activities Related to Credit Intermediation",0,0,0,0,0
523150,"Investment Banking and Securities Intermediation",0,0,0,0,0
523160,"Commodity Contracts Intermediation",0,0,0,0,0
523210,"Securities and Commodity Exchanges",0,0,0,0,0
523910,"Miscellaneous Intermediation",0,0,0,0,0
523940,"Portfolio Management and Investment Advice",0,0,0,0,0
523991,"Trust, Fiduciary, and Custody Activities",0,0,0,0,0
523999,"Miscellaneous Financial Investment Activities",0,0,0,0,0
524113,"Direct Life Insurance Carriers",0,0,0,0,0
524114,"Direct Health and Medical Insurance Carriers",0,0,0,0,0
524126,"Direct Property and Casualty Insurance Carriers",0,0,0,0,0
524127,"Direct Title Insurance Carriers",0,0,0,0,0
524128,"Other Direct Insurance (except Life, Health, and Medical) Carriers",0,0,0,0,0
524130,"Reinsurance Carriers",0,0,0,0,734.619421654
524210,"Insurance Agencies and Brokerages",0,0,0,0,0
524291,"Claims Adjusting",0,0,0,0,0
524292,"Pharmacy Benefit Management and Other Third Party Administration of Insurance and Pension Funds",0,0,0,0,0
524298,"All Other Insurance Related Activities",0,0,0,0,0
525110,"Pension Funds",0,0,0,0,0
525120,"Health and Welfare Funds",0,0,0,0,0
525190,"Other Insurance Funds",0,0,0,0,0
525910,"Open-End Investment Funds",0,0,0,0,0
525920,"Trusts, Estates, and Agency Accounts",0,0,0,0,0
525990,"Other Financial Vehicles",0,0,0,0,0
531110,"Lessors of Residential Buildings and Dwellings",0,0,0,0,0
531120,"Lessors of Nonresidential Buildings (except Miniwarehouses)",0,0,0,0,0
531130,"Lessors of Miniwarehouses and Self-Storage Units",0,0,0,0,0
531190,"Lessors of Other Real Estate Property",0,0,0,0,0
531210,"Offices of Real Estate Agents and Brokers",0,0,0,0,0
531311,"Residential Property Managers",0,0,0,0,0
531312,"Nonresidential Property Managers",0,0,0,0,0
531320,"Offices of Real Estate Appraisers",0,0,0,0,0
531390,"Other Activities Related to Real Estate",0,0,0,0,0
532111,"Passenger Car Rental",0,0,0,0,0
532112,"Passenger Car Leasing",0,0,0,0,0
532120,"Truck, Utility Trailer, and RV (Recreational Vehicle) Rental and Leasing",0,0,0,0,0
532210,"Consumer Electronics and Appliances Rental",0,0,0,0,0
532281,"Formal Wear and Costume Rental",0,0,0,0,0
532282,"Video Tape and Disc Rental",0,0,0,0,0
532283,"Home Health Equipment Rental",0,0,0,0,0
532284,"Recreational Goods Rental",0,0,0,0,0
532289,"All Other Consumer Goods Rental",0,0,0,0,0
532310,"General Rental Centers",0,0,0,0,0
532411,"Commercial Air, Rail, and Water Transportation Equipment Rental and Leasing",0,0,0,0,0
532412,"Construction, Mining, and Forestry Machinery and Equipment Rental and Leasing",0,0,0,0,0
532420,"Office Machinery and Equipment Rental and Leasing",0,0,0,0,0
532490,"Other Commercial and Industrial Machinery and Equipment Rental and Leasing",0,0,0,0,0
533110,"Lessors of Nonfinancial Intangible Assets (except Copyrighted Works)",0,0,0,0,0
541110,"Offices of Lawyers",0,0,0,0,0
541191,"Title Abstract and Settlement Offices",0,0,0,0,0
541199,"All Other Legal Services",0,0,0,0,0
541211,"Offices of Certified Public Accountants",0,0,0,0,0
541213,"Tax Preparation Services",0,0,0,0,0
541214,"Payroll Services",0,0,0,0,0
541219,"Other Accounting Services",0,0,0,0,0
541310,"Architectural Services",0,0,0,0,0
541320,"Landscape Architectural Services",0,0,0,0,0
541330,"Engineering Services",0,0,0,0,0
541340,"Drafting Services",0,0,0,0,0
541350,"Building Inspection Services",0,0,0,0,0
541360,"Geophysical Surveying and Mapping Services",0,0,0,0,0
541370,"Surveying and Mapping (except Geophysical) Services",0,0,0,0,0
541380,"Testing Laboratories",0,0,0,0,0
541410,"Interior Design Services",0,0,0,0,0
541420,"Industrial Design Services",0,0,0,0,0
541430,"Graphic Design Services",0,0,0,0,0
541490,"Other Specialized Design Services",0,0,0,0,0
541511,"Custom Computer Programming Services",0,0,0,0,0
541512,"Computer Systems Design Services",0,0,0,0,0
541513,"Computer Facilities Management Services",0,0,0,0,0
541519,"Other Computer Related Services",0,0,0,0,0
541611,"Administrative Management and General Management Consulting Services",0,0,0,0,0
541612,"Human Resources Consulting Services",0,0,0,0,0
541613,"Marketing Consulting Services",0,0,0,0,0
541614,"Process, Physical Distribution, and Logistics Consulting Services",0,0,0,0,0
541618,"Other Management Consulting Services",0,0,0,0,0
541620,"Environmental Consulting Services",0,0,0,0,0
541690,"Other Scientific and Technical Consulting Services",0,0,0,0,0
541713,"Research and Development in Nanotechnology",0,0,0,0,0
541714,"Research and Development in Biotechnology (except Nanobiotechnology)",0,0,0,0,0
541715,"Research and Development in the Physical, Engineering, and Life Sciences (except Nanotechnology and Biotechnology)",0,0,0,0,0
541720,"Research and Development in the Social Sciences and Humanities",0,0,0,0,0
541810,"Advertising Agencies",0,0,0,0,0
541820,"Public Relations Agencies",0,0,0,0,0
541830,"Media Buying Agencies",0,0,0,0,0
541840,"Media Representatives",0,0,0,0,0
541850,"Outdoor Advertising",0,0,0,0,0
541860,"Direct Mail Advertising",0,0,0,0,0
541870,"Advertising Material Distribution Services",0,0,0,0,0
541890,"Other Services Related to Advertising",0,0,0,0,0
541910,"Marketing Research and Public Opinion Polling",0,0,0,0,0
541921,"Photography Studios, Portrait",0,0,0,0,0
541922,"Commercial Photography",0,0,0,0,0
541930,"Translation and Interpretation Services",0,0,0,0,0
541940,"Veterinary Services",0,0,0,0,0
541990,"All Other Professional, Scientific, and Technical Services",0,0,0,0,0
551111,"Offices of Bank Holding Companies",0,0,0,0,0
551112,"Offices of Other Holding Companies",0,0,0,0,0
551114,"Corporate, Subsidiary, and Regional Managing Offices",0,0,0,0,0
561110,"Office Administrative Services",0,0,0,0,0
561210,"Facilities Support Services",0,0,0,0,0
561311,"Employment Placement Agencies",0,0,0,0,0
561312,"Executive Search Services",0,0,0,0,0
561320,"Temporary Help Services",0,0,0,0,0
561330,"Professional Employer Organizations",0,0,0,0,0
561410,"Document Preparation Services",0,0,0,0,0
561421,"Telephone Answering Services",0,0,0,0,0
561422,"Telemarketing Bureaus and Other Contact Centers",0,0,0,0,0
561431,"Private Mail Centers",0,0,0,0,0
561439,"Other Business Service Centers (including Copy Shops)",0,0,0,0,0
