NAICS,Description,"2023 Jobs","2022 - 2023 Change","2022 - 2023 % Change","Avg. Earnings Per Job","2022 GRP Earnings"
111000,"Crop Production",0.844340844717,0.078812495893,0.102951766599,57080.657434,70422.1816966
112000,"Animal Production",0.00806148665435,0.00123950124169,0.181692156566,41008.4827011,280.032436753
113110,"Timber Tract Operations",2.18758212288E-5,-6.28327557542E-6,-0.223134840549,125479.188449,3.564070822
113210,"Forest Nurseries and Gathering of Forest Products",1.07346082484E-5,-1.42885430625E-6,-0.117471016154,41815.3790177,0.510115557963
113310,Logging,0.696422437875,0.0201581141924,0.0298080402684,63384.2002041,43233.4299611
114111,"Finfish Fishing",1.84414308903E-5,7.74838599852E-6,0.724619233989,131571.880178,1.40697106758
114112,"Shellfish Fishing",0,0,0,0,0
114119,"Other Marine Fishing",1.93612118059E-5,5.98313004206E-6,0.447233777433,49408.9257243,0.700617265069
114210,"Hunting and Trapping",1.84625427637E-5,3.30949145683E-6,0.218404292958,60837.5551694,0.922198578331
115111,"Cotton Ginning",0,0,0,0,0
115112,"Soil Preparation, Planting, and Cultivating",0.417634660478,0.0766239213708,0.22469650537,65574.1958836,22809.1722136
115113,"Crop Harvesting, Primarily by Machine",0,0,0,0,0
115114,"Postharvest Crop Activities (except Cotton Ginning)",0,0,0,0,0
115115,"Farm Labor Contractors and Crew Leaders",0.506834775716,0.0664897794165,0.150994742702,47114.2920683,20800.5415252
115116,"Farm Management Services",0,0,0,0,0
115210,"Support Activities for Animal Production",0.80570924504,0.0776174373656,0.106603915258,51490.6732708,40427.0858051
115310,"Support Activities for Forestry",0.796948524852,0.0728452860681,0.10060069085,58895.4563265,44478.7322266
211120,"Crude Petroleum Extraction",0,0,0,0,0
211130,"Natural Gas Extraction",0,0,0,0,0
212114,"Surface Coal Mining",0,0,0,0,0
212115,"Underground Coal Mining",0,0,0,0,0
212210,"Iron Ore Mining",0,0,0,0,0
212220,"Gold Ore and Silver Ore Mining",0,0,0,0,0
212230,"Copper, Nickel, Lead, and Zinc Mining",0,0,0,0,0
212290,"Other Metal Ore Mining",0,0,0,0,0
212311,"Dimension Stone Mining and Quarrying",0,0,0,0,0
212312,"Crushed and Broken Limestone Mining and Quarrying",0,0,0,0,0
212313,"Crushed and Broken Granite Mining and Quarrying",0,0,0,0,0
212319,"Other Crushed and Broken Stone Mining and Quarrying",0,0,0,0,0
212321,"Construction Sand and Gravel Mining",0,0,0,0,0
212322,"Industrial Sand Mining",0,0,0,0,0
212323,"Kaolin, Clay, and Ceramic and Refractory Minerals Mining",0,0,0,0,0
212390,"Other Nonmetallic Mineral Mining and Quarrying",0,0,0,0,0
213111,"Drilling Oil and Gas Wells",0,0,0,0,0
213112,"Support Activities for Oil and Gas Operations",0,0,0,0,0
213113,"Support Activities for Coal Mining",0,0,0,0,0
213114,"Support Activities for Metal Mining",0,0,0,0,0
213115,"Support Activities for Nonmetallic Minerals (except Fuels) Mining",0,0,0,0,0
221111,"Hydroelectric Power Generation",0,0,0,0,0
221112,"Fossil Fuel Electric Power Generation",0,0,0,0,0
221113,"Nuclear Electric Power Generation",0,0,0,0,0
221114,"Solar Electric Power Generation",0,0,0,0,0
221115,"Wind Electric Power Generation",0,0,0,0,0
221116,"Geothermal Electric Power Generation",0,0,0,0,0
221117,"Biomass Electric Power Generation",0,0,0,0,0
221118,"Other Electric Power Generation",0,0,0,0,0
221121,"Electric Bulk Power Transmission and Control",0,0,0,0,0
221122,"Electric Power Distribution",0,0,0,0,0
221210,"Natural Gas Distribution",0,0,0,0,0
221310,"Water Supply and Irrigation Systems",0,0,0,0,0
221320,"Sewage Treatment Facilities",0,0,0,0,0
221330,"Steam and Air-Conditioning Supply",0,0,0,0,0
236115,"New Single-Family Housing Construction (except For-Sale Builders)",2.53800160582,0.0227658748484,0.00905118934504,74771.594416,210835.645418
236116,"New Multifamily Housing Construction (except For-Sale Builders)",2.96185566793,0.118855760275,0.0418064594216,43038.2015838,129640.501523
236117,"New Housing For-Sale Builders",2.39652021663,0.129566564398,0.0571544831851,63265.1321987,150964.064567
236118,"Residential Remodelers",6.29800810827,0.410155977728,0.0696613924119,53919.8628469,419561.090684
236210,"Industrial Building Construction",0.000883394398595,3.83559740186E-5,0.0453896212327,97446.8524086,85.8811128453
236220,"Commercial and Institutional Building Construction",0.000789618264617,2.58293938729E-5,0.0338174525216,79917.7179668,64.1090578832
237110,"Water and Sewer Line and Related Structures Construction",0.000943435131039,1.37333181034E-5,0.0147717449965,84360.4009045,80.4026892858
237120,"Oil and Gas Pipeline and Related Structures Construction",0.00111906284154,3.39342390292E-5,0.0312720897327,110579.658798,132.363949908
237130,"Power and Communication Line and Related Structures Construction",0.00119627840557,2.98648760211E-5,0.0256040205849,120633.895176,149.484240339
237210,"Land Subdivision",0.00129788501427,2.67700189841E-5,0.0210602652658,92214.6837006,122.431945012
237310,"Highway, Street, and Bridge Construction",0.00142088623641,3.05849548926E-5,0.0219987964473,82139.4050434,115.182123534
237990,"Other Heavy and Civil Engineering Construction",0.00403077791471,-5.16254029529E-5,-0.0126458360274,59676.5866425,265.14456981
238110,"Poured Concrete Foundation and Structure Contractors",0.00385150200668,1.70189730306E-5,0.00443840092165,61644.1079408,237.822610498
238120,"Structural Steel and Precast Concrete Contractors",0.00394243737036,0.000118857246476,0.0310853290961,80972.8015012,316.334486044
238130,"Framing Contractors",0.00375109706982,0.000130394179703,0.0360134989422,61634.1498324,225.455015296
238140,"Masonry Contractors",0.00358575624471,0.000126698819104,0.0366281340594,45928.1199004,159.737562961
238150,"Glass and Glazing Contractors",0.00338768310508,0.000121290256815,0.0371327829964,73671.7842039,246.313649982
238160,"Roofing Contractors",0.00312477973444,0.000113653702681,0.0377445850764,60863.8205686,184.650670862
238170,"Siding Contractors",0.00280407963892,0.000102691816949,0.0380144665324,53798.6111985,145.947004868
238190,"Other Foundation, Structure, and Building Exterior Contractors",0.00245420391556,8.90976491388E-5,0.0376717318811,60009.727273,146.810274231
238210,"Electrical Contractors and Other Wiring Installation Contractors",0.00221296212635,-0.000613212907852,-0.216976266661,65897.4430037,193.152027886
238220,"Plumbing, Heating, and Air-Conditioning Contractors",4.67922435976,0.162713900097,0.0360264636937,69722.9829483,372582.676524
238290,"Other Building Equipment Contractors",0.0351631459315,-0.0128474932328,-0.267596796385,64456.9619934,3233.46938508
238310,"Drywall and Insulation Contractors",0.0505002491483,-0.00657039835405,-0.115127454157,56544.3713807,3285.37768094
238320,"Painting and Wall Covering Contractors",0.0463131070123,-0.00322752762787,-0.0651490973282,47763.9863835,2391.97672733
238330,"Flooring Contractors",0.032577171056,-0.00131414240727,-0.038775198509,54706.8868583,1905.27960314
238340,"Tile and Terrazzo Contractors",0.0344052858172,0.00260626173194,0.0819604313939,58751.0874285,1887.01055481
238350,"Finish Carpentry Contractors",0.0443699378502,0.00390330913534,0.0964574826048,57117.0405122,2357.12981525
238390,"Other Building Finishing Contractors",0.0512731139954,0.00450677299162,0.0963678768722,73177.3006449,3627.96890907
238910,"Site Preparation Contractors",0.0556532366702,0.00459167091993,0.0899242091866,73795.3873842,3795.88796552
238990,"All Other Specialty Trade Contractors",0.0578048884236,0.00431018738664,0.0805722305777,58249.962157,3283.32295617
311111,"Dog and Cat Food Manufacturing",0,0,0,0,0
311119,"Other Animal Food Manufacturing",0,0,0,0,0
311211,"Flour Milling",0,0,0,0,0
311212,"Rice Milling",0,0,0,0,0
311213,"Malt Manufacturing",0,0,0,0,0
311221,"Wet Corn Milling",0,0,0,0,0
311224,"Soybean and Other Oilseed Processing",0,0,0,0,0
311225,"Fats and Oils Refining and Blending",0,0,0,0,0
311230,"Breakfast Cereal Manufacturing",0,0,0,0,0
311313,"Beet Sugar Manufacturing",0,0,0,0,0
311314,"Cane Sugar Manufacturing",0,0,0,0,0
311340,"Nonchocolate Confectionery Manufacturing",0,0,0,0,0
311351,"Chocolate and Confectionery Manufacturing from Cacao Beans",0,0,0,0,0
311352,"Confectionery Manufacturing from Purchased Chocolate",0,0,0,0,0
311411,"Frozen Fruit, Juice, and Vegetable Manufacturing",0,0,0,0,0
311412,"Frozen Specialty Food Manufacturing",0,0,0,0,0
311421,"Fruit and Vegetable Canning",0,0,0,0,0
311422,"Specialty Canning",0,0,0,0,44.7672166768
311423,"Dried and Dehydrated Food Manufacturing",0,0,0,0,0
311511,"Fluid Milk Manufacturing",0,0,0,0,0
311512,"Creamery Butter Manufacturing",0,0,0,0,0
311513,"Cheese Manufacturing",0,0,0,0,0
311514,"Dry, Condensed, and Evaporated Dairy Product Manufacturing",0,0,0,0,0
311520,"Ice Cream and Frozen Dessert Manufacturing",0,0,0,0,0
311611,"Animal (except Poultry) Slaughtering",0,0,0,0,0
311612,"Meat Processed from Carcasses",0,0,0,0,0
311613,"Rendering and Meat Byproduct Processing",0,0,0,0,0
311615,"Poultry Processing",0,0,0,0,0
311710,"Seafood Product Preparation and Packaging",0,0,0,0,0
311811,"Retail Bakeries",0,0,0,0,0
311812,"Commercial Bakeries",0,0,0,0,0
311813,"Frozen Cakes, Pies, and Other Pastries Manufacturing",0,0,0,0,0
311821,"Cookie and Cracker Manufacturing",0,0,0,0,0
311824,"Dry Pasta, Dough, and Flour Mixes Manufacturing from Purchased Flour",0,0,0,0,0
311830,"Tortilla Manufacturing",0,0,0,0,0
311911,"Roasted Nuts and Peanut Butter Manufacturing",0,0,0,0,0
311919,"Other Snack Food Manufacturing",0,0,0,0,0
311920,"Coffee and Tea Manufacturing",0,0,0,0,0
311930,"Flavoring Syrup and Concentrate Manufacturing",0,0,0,0,0
311941,"Mayonnaise, Dressing, and Other Prepared Sauce Manufacturing",0,0,0,0,0
311942,"Spice and Extract Manufacturing",0,0,0,0,0
311991,"Perishable Prepared Food Manufacturing",0,0,0,0,0
311999,"All Other Miscellaneous Food Manufacturing",0,0,0,0,0
312111,"Soft Drink Manufacturing",0,0,0,0,0
312112,"Bottled Water Manufacturing",0,0,0,0,0
312113,"Ice Manufacturing",0,0,0,0,0
312120,Breweries,0,0,0,0,0
312130,Wineries,0,0,0,0,0
312140,Distilleries,0,0,0,0,0
312230,"Tobacco Manufacturing",0,0,0,0,0
313110,"Fiber, Yarn, and Thread Mills",0,0,0,0,0
313210,"Broadwoven Fabric Mills",0,0,0,0,0
313220,"Narrow Fabric Mills and Schiffli Machine Embroidery",0,0,0,0,0
313230,"Nonwoven Fabric Mills",0,0,0,0,0
313240,"Knit Fabric Mills",0,0,0,0,0
313310,"Textile and Fabric Finishing Mills",0,0,0,0,0
313320,"Fabric Coating Mills",0,0,0,0,0
314110,"Carpet and Rug Mills",0,0,0,0,0
314120,"Curtain and Linen Mills",0,0,0,0,0
314910,"Textile Bag and Canvas Mills",0,0,0,0,0
314994,"Rope, Cordage, Twine, Tire Cord, and Tire Fabric Mills",0,0,0,0,0
314999,"All Other Miscellaneous Textile Product Mills",0,0,0,0,0
315120,"Apparel Knitting Mills",0,0,0,0,0
315210,"Cut and Sew Apparel Contractors",0,0,0,0,0
315250,"Cut and Sew Apparel Manufacturing (except Contractors)",0,0,0,0,0
315990,"Apparel Accessories and Other Apparel Manufacturing",0,0,0,0,0
316110,"Leather and Hide Tanning and Finishing",0,0,0,0,0
316210,"Footwear Manufacturing",0,0,0,0,0
316990,"Other Leather and Allied Product Manufacturing",0,0,0,0,0
321113,Sawmills,0,0,0,0,0
321114,"Wood Preservation",0,0,0,0,0
321211,"Hardwood Veneer and Plywood Manufacturing",0,0,0,0,0
321212,"Softwood Veneer and Plywood Manufacturing",0,0,0,0,0
321215,"Engineered Wood Member Manufacturing",0,0,0,0,0
321219,"Reconstituted Wood Product Manufacturing",0,0,0,0,0
321911,"Wood Window and Door Manufacturing",0,0,0,0,0
321912,"Cut Stock, Resawing Lumber, and Planing",0,0,0,0,0
321918,"Other Millwork (including Flooring)",0,0,0,0,0
321920,"Wood Container and Pallet Manufacturing",0,0,0,0,0
321991,"Manufactured Home (Mobile Home) Manufacturing",0,0,0,0,0
321992,"Prefabricated Wood Building Manufacturing",0,0,0,0,0
321999,"All Other Miscellaneous Wood Product Manufacturing",0,0,0,0,0
322110,"Pulp Mills",0,0,0,0,0
322120,"Paper Mills",0,0,0,0,0
322130,"Paperboard Mills",0,0,0,0,0
322211,"Corrugated and Solid Fiber Box Manufacturing",0,0,0,0,0
322212,"Folding Paperboard Box Manufacturing",0,0,0,0,0
322219,"Other Paperboard Container Manufacturing",0,0,0,0,0
322220,"Paper Bag and Coated and Treated Paper Manufacturing",0,0,0,0,0
322230,"Stationery Product Manufacturing",0,0,0,0,0
322291,"Sanitary Paper Product Manufacturing",0,0,0,0,0
322299,"All Other Converted Paper Product Manufacturing",0,0,0,0,0
323111,"Commercial Printing (except Screen and Books)",0,0,0,0,0
323113,"Commercial Screen Printing",0,0,0,0,0
323117,"Books Printing",0,0,0,0,0
323120,"Support Activities for Printing",0,0,0,0,0
324110,"Petroleum Refineries",0,0,0,0,0
324121,"Asphalt Paving Mixture and Block Manufacturing",0,0,0,0,0
324122,"Asphalt Shingle and Coating Materials Manufacturing",0,0,0,0,0
324191,"Petroleum Lubricating Oil and Grease Manufacturing",0,0,0,0,0
324199,"All Other Petroleum and Coal Products Manufacturing",0,0,0,0,0
325110,"Petrochemical Manufacturing",0,0,0,0,8935.00793535
325120,"Industrial Gas Manufacturing",0,0,0,0,0
325130,"Synthetic Dye and Pigment Manufacturing",0,0,0,0,0
325180,"Other Basic Inorganic Chemical Manufacturing",0,0,0,0,0
325193,"Ethyl Alcohol Manufacturing",0,0,0,0,0
325194,"Cyclic Crude, Intermediate, and Gum and Wood Chemical Manufacturing",0,0,0,0,0
325199,"All Other Basic Organic Chemical Manufacturing",0,0,0,0,0
325211,"Plastics Material and Resin Manufacturing",0,0,0,0,0
325212,"Synthetic Rubber Manufacturing",0,0,0,0,0
325220,"Artificial and Synthetic Fibers and Filaments Manufacturing",0,0,0,0,0
325311,"Nitrogenous Fertilizer Manufacturing",0,0,0,0,0
325312,"Phosphatic Fertilizer Manufacturing",0,0,0,0,0
325314,"Fertilizer (Mixing Only) Manufacturing",0,0,0,0,0
325315,"Compost Manufacturing",0,0,0,0,0
325320,"Pesticide and Other Agricultural Chemical Manufacturing",0,0,0,0,0
325411,"Medicinal and Botanical Manufacturing",0,0,0,0,0
325412,"Pharmaceutical Preparation Manufacturing",0,0,0,0,0
325413,"In-Vitro Diagnostic Substance Manufacturing",0,0,0,0,0
325414,"Biological Product (except Diagnostic) Manufacturing",0,0,0,0,0
325510,"Paint and Coating Manufacturing",0,0,0,0,0
325520,"Adhesive Manufacturing",0,0,0,0,0
325611,"Soap and Other Detergent Manufacturing",0,0,0,0,0
325612,"Polish and Other Sanitation Good Manufacturing",0,0,0,0,0
325613,"Surface Active Agent Manufacturing",0,0,0,0,184.03767835
325620,"Toilet Preparation Manufacturing",0,0,0,0,0
325910,"Printing Ink Manufacturing",0,0,0,0,0
325920,"Explosives Manufacturing",0,0,0,0,0
325991,"Custom Compounding of Purchased Resins",0,0,0,0,0
325992,"Photographic Film, Paper, Plate, and Chemical Manufacturing",0,0,0,0,0
325998,"All Other Miscellaneous Chemical Product and Preparation Manufacturing",0,0,0,0,0
326111,"Plastics Bag and Pouch Manufacturing",0,0,0,0,0
326112,"Plastics Packaging Film and Sheet (including Laminated) Manufacturing",0,0,0,0,0
326113,"Unlaminated Plastics Film and Sheet (except Packaging) Manufacturing",0,0,0,0,0
326121,"Unlaminated Plastics Profile Shape Manufacturing",0,0,0,0,0
326122,"Plastics Pipe and Pipe Fitting Manufacturing",0,0,0,0,0
326130,"Laminated Plastics Plate, Sheet (except Packaging), and Shape Manufacturing",0,0,0,0,0
326140,"Polystyrene Foam Product Manufacturing",0,0,0,0,0
326150,"Urethane and Other Foam Product (except Polystyrene) Manufacturing",0,0,0,0,0
326160,"Plastics Bottle Manufacturing",0,0,0,0,0
326191,"Plastics Plumbing Fixture Manufacturing",0,0,0,0,0
326199,"All Other Plastics Product Manufacturing",0,0,0,0,0
326211,"Tire Manufacturing (except Retreading)",0,0,0,0,0
326212,"Tire Retreading",0,0,0,0,0
326220,"Rubber and Plastics Hoses and Belting Manufacturing",0,0,0,0,0
326291,"Rubber Product Manufacturing for Mechanical Use",0,0,0,0,0
326299,"All Other Rubber Product Manufacturing",0,0,0,0,0
327110,"Pottery, Ceramics, and Plumbing Fixture Manufacturing",0,0,0,0,0
327120,"Clay Building Material and Refractories Manufacturing",0,0,0,0,0
327211,"Flat Glass Manufacturing",0,0,0,0,0
327212,"Other Pressed and Blown Glass and Glassware Manufacturing",0,0,0,0,0
327213,"Glass Container Manufacturing",0,0,0,0,0
327215,"Glass Product Manufacturing Made of Purchased Glass",0,0,0,0,0
327310,"Cement Manufacturing",0,0,0,0,0
327320,"Ready-Mix Concrete Manufacturing",0,0,0,0,0
327331,"Concrete Block and Brick Manufacturing",0,0,0,0,0
327332,"Concrete Pipe Manufacturing",0,0,0,0,0
327390,"Other Concrete Product Manufacturing",0,0,0,0,0
327410,"Lime Manufacturing",0,0,0,0,0
327420,"Gypsum Product Manufacturing",0,0,0,0,0
327910,"Abrasive Product Manufacturing",0,0,0,0,0
327991,"Cut Stone and Stone Product Manufacturing",0,0,0,0,0
327992,"Ground or Treated Mineral and Earth Manufacturing",0,0,0,0,0
327993,"Mineral Wool Manufacturing",0,0,0,0,0
327999,"All Other Miscellaneous Nonmetallic Mineral Product Manufacturing",0,0,0,0,0
331110,"Iron and Steel Mills and Ferroalloy Manufacturing",0,0,0,0,0
331210,"Iron and Steel Pipe and Tube Manufacturing from Purchased Steel",0,0,0,0,0
331221,"Rolled Steel Shape Manufacturing",0,0,0,0,0
331222,"Steel Wire Drawing",0,0,0,0,0
331313,"Alumina Refining and Primary Aluminum Production",0,0,0,0,0
331314,"Secondary Smelting and Alloying of Aluminum",0,0,0,0,0
331315,"Aluminum Sheet, Plate, and Foil Manufacturing",0,0,0,0,0
331318,"Other Aluminum Rolling, Drawing, and Extruding",0,0,0,0,0
331410,"Nonferrous Metal (except Aluminum) Smelting and Refining",0,0,0,0,0
331420,"Copper Rolling, Drawing, Extruding, and Alloying",0,0,0,0,0
331491,"Nonferrous Metal (except Copper and Aluminum) Rolling, Drawing, and Extruding",0,0,0,0,0
331492,"Secondary Smelting, Refining, and Alloying of Nonferrous Metal (except Copper and Aluminum)",0,0,0,0,0
331511,"Iron Foundries",0,0,0,0,0
331512,"Steel Investment Foundries",0,0,0,0,0
331513,"Steel Foundries (except Investment)",0,0,0,0,0
331523,"Nonferrous Metal Die-Casting Foundries",0,0,0,0,0
331524,"Aluminum Foundries (except Die-Casting)",0,0,0,0,0
331529,"Other Nonferrous Metal Foundries (except Die-Casting)",0,0,0,0,0
332111,"Iron and Steel Forging",0,0,0,0,0
332112,"Nonferrous Forging",0,0,0,0,0
332114,"Custom Roll Forming",0,0,0,0,0
332117,"Powder Metallurgy Part Manufacturing",0,0,0,0,0
332119,"Metal Crown, Closure, and Other Metal Stamping (except Automotive)",0,0,0,0,0
332215,"Metal Kitchen Cookware, Utensil, Cutlery, and Flatware (except Precious) Manufacturing",0,0,0,0,0
332216,"Saw Blade and Handtool Manufacturing",0,0,0,0,0
332311,"Prefabricated Metal Building and Component Manufacturing",0,0,0,0,0
332312,"Fabricated Structural Metal Manufacturing",0,0,0,0,0
332313,"Plate Work Manufacturing",0,0,0,0,0
332321,"Metal Window and Door Manufacturing",0,0,0,0,0
332322,"Sheet Metal Work Manufacturing",0,0,0,0,0
332323,"Ornamental and Architectural Metal Work Manufacturing",0,0,0,0,0
332410,"Power Boiler and Heat Exchanger Manufacturing",0,0,0,0,0
332420,"Metal Tank (Heavy Gauge) Manufacturing",0,0,0,0,0
332431,"Metal Can Manufacturing",0,0,0,0,0
332439,"Other Metal Container Manufacturing",0,0,0,0,0
332510,"Hardware Manufacturing",0,0,0,0,0
332613,"Spring Manufacturing",0,0,0,0,0
332618,"Other Fabricated Wire Product Manufacturing",0,0,0,0,0
332710,"Machine Shops",0,0,0,0,0
332721,"Precision Turned Product Manufacturing",0,0,0,0,0
332722,"Bolt, Nut, Screw, Rivet, and Washer Manufacturing",0,0,0,0,0
332811,"Metal Heat Treating",0,0,0,0,0
332812,"Metal Coating, Engraving (except Jewelry and Silverware), and Allied Services to Manufacturers",0,0,0,0,0
332813,"Electroplating, Plating, Polishing, Anodizing, and Coloring",0,0,0,0,0
332911,"Industrial Valve Manufacturing",0,0,0,0,0
332912,"Fluid Power Valve and Hose Fitting Manufacturing",0,0,0,0,0
332913,"Plumbing Fixture Fitting and Trim Manufacturing",0,0,0,0,0
332919,"Other Metal Valve and Pipe Fitting Manufacturing",0,0,0,0,0
332991,"Ball and Roller Bearing Manufacturing",0,0,0,0,0
332992,"Small Arms Ammunition Manufacturing",0,0,0,0,0
332993,"Ammunition (except Small Arms) Manufacturing",0,0,0,0,0
332994,"Small Arms, Ordnance, and Ordnance Accessories Manufacturing",0,0,0,0,0
332996,"Fabricated Pipe and Pipe Fitting Manufacturing",0,0,0,0,0
332999,"All Other Miscellaneous Fabricated Metal Product Manufacturing",0,0,0,0,0
333111,"Farm Machinery and Equipment Manufacturing",0,0,0,0,0
333112,"Lawn and Garden Tractor and Home Lawn and Garden Equipment Manufacturing",0,0,0,0,0
333120,"Construction Machinery Manufacturing",0,0,0,0,0
333131,"Mining Machinery and Equipment Manufacturing",0,0,0,0,0
333132,"Oil and Gas Field Machinery and Equipment Manufacturing",0,0,0,0,0
333241,"Food Product Machinery Manufacturing",0,0,0,0,0
333242,"Semiconductor Machinery Manufacturing",0,0,0,0,0
333243,"Sawmill, Woodworking, and Paper Machinery Manufacturing",0,0,0,0,0
333248,"All Other Industrial Machinery Manufacturing",0,0,0,0,0
333310,"Commercial and Service Industry Machinery Manufacturing",0,0,0,0,0
333413,"Industrial and Commercial Fan and Blower and Air Purification Equipment Manufacturing",0,0,0,0,0
333414,"Heating Equipment (except Warm Air Furnaces) Manufacturing",0,0,0,0,0
333415,"Air-Conditioning and Warm Air Heating Equipment and Commercial and Industrial Refrigeration Equipment Manufacturing",0,0,0,0,0
333511,"Industrial Mold Manufacturing",0,0,0,0,0
333514,"Special Die and Tool, Die Set, Jig, and Fixture Manufacturing",0,0,0,0,0
333515,"Cutting Tool and Machine Tool Accessory Manufacturing",0,0,0,0,0
333517,"Machine Tool Manufacturing",0,0,0,0,0
333519,"Rolling Mill and Other Metalworking Machinery Manufacturing",0,0,0,0,0
333611,"Turbine and Turbine Generator Set Units Manufacturing",0,0,0,0,0
333612,"Speed Changer, Industrial High-Speed Drive, and Gear Manufacturing",0,0,0,0,6374.24041202
333613,"Mechanical Power Transmission Equipment Manufacturing",0,0,0,0,0
333618,"Other Engine Equipment Manufacturing",0,0,0,0,0
333912,"Air and Gas Compressor Manufacturing",0,0,0,0,0
333914,"Measuring, Dispensing, and Other Pumping Equipment Manufacturing",0,0,0,0,0
333921,"Elevator and Moving Stairway Manufacturing",0,0,0,0,61.2172399518
333922,"Conveyor and Conveying Equipment Manufacturing",0,0,0,0,0
333923,"Overhead Traveling Crane, Hoist, and Monorail System Manufacturing",0,0,0,0,0
333924,"Industrial Truck, Tractor, Trailer, and Stacker Machinery Manufacturing",0,0,0,0,0
333991,"Power-Driven Handtool Manufacturing",0,0,0,0,0
333992,"Welding and Soldering Equipment Manufacturing",0,0,0,0,0
333993,"Packaging Machinery Manufacturing",0,0,0,0,4824.25791616
333994,"Industrial Process Furnace and Oven Manufacturing",0,0,0,0,0
333995,"Fluid Power Cylinder and Actuator Manufacturing",0,0,0,0,0
333996,"Fluid Power Pump and Motor Manufacturing",0,0,0,0,0
333998,"All Other Miscellaneous General Purpose Machinery Manufacturing",0,0,0,0,0
334111,"Electronic Computer Manufacturing",0,0,0,0,0
334112,"Computer Storage Device Manufacturing",0,0,0,0,0
334118,"Computer Terminal and Other Computer Peripheral Equipment Manufacturing",0,0,0,0,0
334210,"Telephone Apparatus Manufacturing",0,0,0,0,0
334220,"Radio and Television Broadcasting and Wireless Communications Equipment Manufacturing",0,0,0,0,0
334290,"Other Communications Equipment Manufacturing",0,0,0,0,0
334310,"Audio and Video Equipment Manufacturing",0,0,0,0,0
334412,"Bare Printed Circuit Board Manufacturing",0,0,0,0,0
334413,"Semiconductor and Related Device Manufacturing",0,0,0,0,0
334416,"Capacitor, Resistor, Coil, Transformer, and Other Inductor Manufacturing",0,0,0,0,0
334417,"Electronic Connector Manufacturing",0,0,0,0,0
334418,"Printed Circuit Assembly (Electronic Assembly) Manufacturing",0,0,0,0,0
334419,"Other Electronic Component Manufacturing",0,0,0,0,0
334510,"Electromedical and Electrotherapeutic Apparatus Manufacturing",0,0,0,0,0
334511,"Search, Detection, Navigation, Guidance, Aeronautical, and Nautical System and Instrument Manufacturing",0,0,0,0,0
334512,"Automatic Environmental Control Manufacturing for Residential, Commercial, and Appliance Use",0,0,0,0,0
334513,"Instruments and Related Products Manufacturing for Measuring, Displaying, and Controlling Industrial Process Variables",0,0,0,0,0
334514,"Totalizing Fluid Meter and Counting Device Manufacturing",0,0,0,0,0
334515,"Instrument Manufacturing for Measuring and Testing Electricity and Electrical Signals",0,0,0,0,0
334516,"Analytical Laboratory Instrument Manufacturing",0,0,0,0,0
334517,"Irradiation Apparatus Manufacturing",0,0,0,0,0
334519,"Other Measuring and Controlling Device Manufacturing",0,0,0,0,0
334610,"Manufacturing and Reproducing Magnetic and Optical Media",0,0,0,0,0
335131,"Residential Electric Lighting Fixture Manufacturing",0,0,0,0,0
335132,"Commercial, Industrial, and Institutional Electric Lighting Fixture Manufacturing",0,0,0,0,0
335139,"Electric Lamp Bulb and Other Lighting Equipment Manufacturing",0,0,0,0,0
335210,"Small Electrical Appliance Manufacturing",0,0,0,0,0
335220,"Major Household Appliance Manufacturing",0,0,0,0,0
335311,"Power, Distribution, and Specialty Transformer Manufacturing",0,0,0,0,0
335312,"Motor and Generator Manufacturing",0,0,0,0,0
335313,"Switchgear and Switchboard Apparatus Manufacturing",0,0,0,0,0
335314,"Relay and Industrial Control Manufacturing",0,0,0,0,0
335910,"Battery Manufacturing",0,0,0,0,0
335921,"Fiber Optic Cable Manufacturing",0,0,0,0,0
335929,"Other Communication and Energy Wire Manufacturing",0,0,0,0,0
335931,"Current-Carrying Wiring Device Manufacturing",0,0,0,0,0
335932,"Noncurrent-Carrying Wiring Device Manufacturing",0,0,0,0,0
335991,"Carbon and Graphite Product Manufacturing",0,0,0,0,0
335999,"All Other Miscellaneous Electrical Equipment and Component Manufacturing",0,0,0,0,0
336110,"Automobile and Light Duty Motor Vehicle Manufacturing",0,0,0,0,0
336120,"Heavy Duty Truck Manufacturing",0,0,0,0,0
336211,"Motor Vehicle Body Manufacturing",0,0,0,0,0
336212,"Truck Trailer Manufacturing",0,0,0,0,0
336213,"Motor Home Manufacturing",0,0,0,0,0
336214,"Travel Trailer and Camper Manufacturing",0,0,0,0,0
336310,"Motor Vehicle Gasoline Engine and Engine Parts Manufacturing",0,0,0,0,0
