444120,"Paint and Wallpaper Stores",0.00926641338414,-0.00038812621149,-0.0402014210669,63075.3961463,609.53375001
444140,"Hardware Retailers",0.102418762827,-0.0938836587732,-0.47826031899,43681.9804895,8650.54021652
444180,"Other Building Material Dealers",0.260087696507,-0.0725635387883,-0.218136988801,80276.5298326,26802.6634041
444230,"Outdoor Power Equipment Retailers",0.133845310181,0.00402904114848,0.0310364885582,58040.6602715,11697.169447
444240,"Nursery, Garden Center, and Farm Supply Retailers",4.24406762417,-0.0465768450868,-0.0108554426778,48201.8047926,219328.041679
445110,"Supermarkets and Other Grocery (except Convenience) Stores",2.14443470152,-0.0444074596824,-0.02028810504,42037.6535606,92049.4168002
445131,"Convenience Retailers",0.905574148727,-0.00294195340042,-0.00323819621197,31984.5201142,29107.1471699
445132,"Vending Machine Operators",0.426186471275,-0.0148407712094,-0.0336504636897,48366.73466,21580.5003266
445230,"Fruit and Vegetable Markets",0.292531798411,-0.00355367768867,-0.012002201984,33745.6111731,9991.59760139
445240,"Meat Retailers",0.338991506065,-0.00198921369566,-0.00583380109307,44466.357804,16034.746638
445250,"Fish and Seafood Retailers",0,0,0,0,0
445291,"Baked Goods Stores",0.394153563468,0.0018570228225,0.00473372214663,25485.3527107,9997.82796412
445292,"Confectionery and Nut Stores",0.442806689646,0.00910502905642,0.0209937611123,19545.8474777,8477.07690264
445298,"All Other Specialty Food Retailers",0.478107950108,0.016062386962,0.0347636429027,24953.2472307,11596.4891673
445320,"Beer, Wine, and Liquor Retailers",0.496969383682,-0.0010110895861,-0.00203037998551,32333.1261702,16101.2852147
449110,"Furniture Retailers",0.679035103511,-0.00983207172831,-0.0142728120626,63420.3965243,43843.8377385
449121,"Floor Covering Retailers",0.839983408995,0.0234868049904,0.0287653431444,70807.0363566,57813.7756118
449122,"Window Treatment Retailers",0.426098552179,0.0212705089225,0.0525420836742,40411.5813104,16387.4053318
449129,"All Other Home Furnishings Retailers",0.601412401355,0.000210335312754,0.000349857934019,27644.9775577,16998.0621314
449210,"Electronics and Appliance Retailers",4.58702269088,-0.0133006694476,-0.00289124663764,70491.9213486,341101.963559
455110,"Department Stores",0.777128228864,0.041314070067,0.0561474246902,33831.0236213,24995.6805092
455211,"Warehouse Clubs and Supercenters",8.57681018161,0.219468151806,0.0262605205128,47427.9011455,403907.022052
455219,"All Other General Merchandise Retailers",2.67339072515,0.0914890700565,0.0354347617679,38918.5059058,127405.137924
456110,"Pharmacies and Drug Retailers",1.03226981747,0.0714366800907,0.0743486848148,58265.9643597,57452.7380976
456120,"Cosmetics, Beauty Supplies, and Perfume Retailers",0.0305806285539,-0.00246007050604,-0.0744557644369,24176.3573949,805.407419756
456130,"Optical Goods Retailers",0.0272860867817,-0.0021770155381,-0.073889555637,47146.2224241,1410.32828565
456191,"Food (Health) Supplement Retailers",0.0246051757816,-0.00188343346939,-0.0711035242184,40280.6341358,1078.86918063
456199,"All Other Health and Personal Care Retailers",0.0226686609591,-0.0016109128417,-0.0663484810284,65459.1733082,1604.03453037
457110,"Gasoline Stations with Convenience Stores",0.233650725,-0.00540065564274,-0.0225920286602,39433.3120895,9498.28409494
457120,"Other Gasoline Stations",0.114643565242,0.0130623929805,0.128590689491,50588.5375921,5138.8492525
457210,"Fuel Dealers",0.0220991903927,-0.00111264758963,-0.047934488879,62277.2832673,1456.66918343
458110,"Clothing and Clothing Accessories Retailers",0.15277693127,-0.00392282153078,-0.0250339994841,31579.8551314,5171.776246
458210,"Shoe Retailers",0.045641221653,0.00452773149052,0.110127636273,29582.0035959,1226.78353745
458310,"Jewelry Retailers",0.0598179054687,0.00526225930318,0.0964567313017,56611.5790408,3113.04065629
458320,"Luggage and Leather Goods Retailers",0,0,0,0,0
459110,"Sporting Goods Retailers",0.0746161182137,0.00631449405316,0.0924501302973,35431.3236056,2432.99495107
459120,"Hobby, Toy, and Game Retailers",0.0888717881724,0.00740716486316,0.0909249262105,31464.0484028,2576.65667353
459130,"Sewing, Needlework, and Piece Goods Retailers",0.101549375607,0.00836217944569,0.0897352832814,22384.1260456,2091.27778774
459140,"Musical Instrument and Supplies Retailers",0.111859167671,0.00906210572353,0.0881552989145,32506.0118389,3352.8759594
459210,"Book Retailers and News Dealers",0.119281142754,0.00943611736252,0.0859039117059,29279.1582826,3218.20979244
459310,Florists,0.123551137926,0.00945325430009,0.0828521441388,36014.6916869,4109.20513931
459410,"Office Supplies and Stationery Retailers",0.124628254653,0.00911720722975,0.0789293096473,50822.4911862,5880.90032981
459420,"Gift, Novelty, and Souvenir Retailers",0.226222153945,0.00831820746515,0.0381737348016,24907.5600525,15582.7422804
459510,"Used Merchandise Retailers",0.117885507766,0.00753638527107,0.0682958332671,29919.0019709,3313.16624864
459910,"Pet and Pet Supplies Retailers",0.110676377825,0.00641307433566,0.0615084514015,35689.0232293,3721.24611625
459920,"Art Dealers",0.101397298497,0.00516341239411,0.0536548257917,42058.2884743,4167.64036449
459930,"Manufactured (Mobile) Home Dealers",0.0904147472389,0.00386620888852,0.0446709899695,88200.7903938,7633.65884975
459991,"Tobacco, Electronic Cigarette, and Other Smoking Supplies Retailers",0.0899857465186,-0.08458649737,-0.484535774335,32787.1109826,5755.10150994
459999,"All Other Miscellaneous Retailers",0.297099770167,-0.0386227565011,-0.115043684689,48049.4005937,16348.5991216
481111,"Scheduled Passenger Air Transportation",7.077370487E-5,1.22808979079E-5,0.209955694482,67698.8109378,3.95989856979
481112,"Scheduled Freight Air Transportation",0,0,0,0,0
481211,"Nonscheduled Chartered Passenger Air Transportation",9.52548775643E-5,1.66126379242E-5,0.211243194499,107157.788056,9.83319963406
481212,"Nonscheduled Chartered Freight Air Transportation",3.29870193898E-5,-4.0773193347E-5,-0.552780311148,111148.600476,8.19836262428
481219,"Other Nonscheduled Air Transportation",9.51806794234E-5,7.36963406553E-5,3.430235459,232512.889918,8.56067390457
482110,"Rail transportation",12.7135078126,0.256821398973,0.0206171521419,82278.4099961,1024916.35193
483111,"Deep Sea Freight Transportation",0,0,0,0,0
483112,"Deep Sea Passenger Transportation",0,0,0,0,0
483113,"Coastal and Great Lakes Freight Transportation",0,0,0,0,0
483114,"Coastal and Great Lakes Passenger Transportation",0,0,0,0,0
483211,"Inland Water Freight Transportation",0,0,0,0,0
483212,"Inland Water Passenger Transportation",0,0,0,0,0
484110,"General Freight Trucking, Local",11.6785029131,0.783477374053,0.0719114765946,80041.1437362,893331.945238
484121,"General Freight Trucking, Long-Distance, Truckload",1.72530505135,0.0462602486374,0.0275515272509,90821.4271664,153740.236218
484122,"General Freight Trucking, Long-Distance, Less Than Truckload",2.00646671218,0.205996938099,0.114412883273,93995.5513514,169578.582857
484210,"Used Household and Office Goods Moving",3.20814217713,0.42610726392,0.153163880833,52876.9702456,147654.25637
484220,"Specialized Freight (except Used Goods) Trucking, Local",3.20895745712,0.360532332582,0.126572515274,66001.2149163,188694.871511
484230,"Specialized Freight (except Used Goods) Trucking, Long-Distance",1.79550354347,0.171195132689,0.105395706599,85055.7735367,139080.196323
485111,"Mixed Mode Transit Systems",0,0,0,0,0
485112,"Commuter Rail Systems",0,0,0,0,0
485113,"Bus and Other Motor Vehicle Transit Systems",0,0,0,0,0
485119,"Other Urban Transit Systems",0,0,0,0,0
485210,"Interurban and Rural Bus Transportation",1.68241202988,-0.0205090055341,-0.0120434272098,43122.007351,73433.5284574
485310,"Taxi Service",0.797901296172,0.0614127565377,0.083385895683,51599.201597,38200.8733762
485320,"Limousine Service",0.197396350261,0.00643487268159,0.0336972292168,19124.1012267,3653.09981947
485410,"School and Employee Bus Transportation",6.33437266526,-0.122621524605,-0.0189904963516,41606.553357,271616.222506
485510,"Charter Bus Industry",0.130942017769,-0.117065885683,-0.472024818781,32335.1406453,8019.45325909
485991,"Special Needs Transportation",1.00361806838,0.115867914619,0.130518608336,34525.8395996,30650.4005741
485999,"All Other Transit and Ground Passenger Transportation",0.133038635441,-0.0110651188111,-0.0767857775013,49373.9546521,7185.00605491
486110,"Pipeline Transportation of Crude Oil",2.70319594323,0.402519794894,0.174957172996,157008.943713,361227.361619
486210,"Pipeline Transportation of Natural Gas",1.62015855106,-0.295998029447,-0.154474865185,199163.929601,381629.937345
486910,"Pipeline Transportation of Refined Petroleum Products",0.239365898006,-0.015321478857,-0.0601579828795,150966.443871,38449.4296881
486990,"All Other Pipeline Transportation",0,0,0,0,0
487110,"Scenic and Sightseeing Transportation, Land",0.0294832198041,0.00863814268392,0.414397252363,34542.6998488,831.276454171
487210,"Scenic and Sightseeing Transportation, Water",0.00124437149336,-2.80329393063E-5,-0.022031469387,38263.7574891,179.677628416
487990,"Scenic and Sightseeing Transportation, Other",0,0,0,0,0
488111,"Air Traffic Control",0,0,0,0,0
488119,"Other Airport Operations",1.60511549299,0.11463303585,0.0769100201757,32118.1021323,47882.7232545
488190,"Other Support Activities for Air Transportation",1.28571793473,0.18911117651,0.172451222914,61496.5174265,71626.6177401
488210,"Support Activities for Rail Transportation",0.00914007395315,-0.00566295086391,-0.382553628998,37703.5627395,558.567658136
488310,"Port and Harbor Operations",0,0,0,0,0
488320,"Marine Cargo Handling",0.155893478176,-0.0137692363127,-0.0811565248983,67977.0501433,11533.209665
488330,"Navigational Services to Shipping",0,0,0,0,0
488390,"Other Support Activities for Water Transportation",0,0,0,0,0
488410,"Motor Vehicle Towing",1.09540185721,0.0807065485138,0.0795377172065,53903.3582376,54740.7806619
488490,"Other Support Activities for Road Transportation",2.04009518552,-0.0846863377959,-0.0398564920047,39631.4853932,84208.3631935
488510,"Freight Transportation Arrangement",1.57534575375,0.12956300492,0.0896144355198,68733.1677851,99858.6792827
488991,"Packing and Crating",0,0,0,0,0
488999,"All Other Support Activities for Transportation",0,0,0,0,0
491110,"Postal Service",0.358991577919,0.0477015654523,0.153238342195,39374.0725351,12256.7626151
492110,"Couriers and Express Delivery Services",6.51102044488,0.657905863552,0.112402696788,53070.7134976,311955.561117
492210,"Local Messengers and Local Delivery",4.75685985507,0.355462365726,0.0807612506225,50978.1435609,226041.077359
493110,"General Warehousing and Storage",3.60364135263,0.428837948644,0.135075434311,57235.2690768,181804.949355
493120,"Refrigerated Warehousing and Storage",1.81064928463,0.187342162754,0.115407713198,59996.4150459,97710.9478538
493130,"Farm Product Warehousing and Storage",0.0533541535977,-0.00307593941449,-0.054508848919,79291.8594482,4474.47836495
493190,"Other Warehousing and Storage",0.0540748918572,-0.00290292683807,-0.0509483673568,81826.3600894,4666.71703989
512110,"Motion Picture and Video Production",0.137474480133,-0.00677912687995,-0.0469945051656,58458.5749424,8615.57051868
512120,"Motion Picture and Video Distribution",0,0,0,0,0
512131,"Motion Picture Theaters (except Drive-Ins)",0.102581737322,-0.00521940010651,-0.0484169298305,21771.1621623,2487.85596136
512132,"Drive-In Motion Picture Theaters",0,0,0,0,0
512191,"Teleproduction and Other Postproduction Services",0.000882598626461,-0.000100071377071,-0.101836198023,43614.2369904,42.9544461705
512199,"Other Motion Picture and Video Industries",0,0,0,0,0
512230,"Music Publishers",0,0,0,0,0
512240,"Sound Recording Studios",0.00134798909229,-0.000233648571274,-0.147725725465,30638.3155617,48.4587732571
512250,"Record Production and Distribution",0.00189478312063,-0.000340298073687,-0.152253114809,35485.178668,79.3123527647
512290,"Other Sound Recording Industries",0,0,0,0,0
513110,"Newspaper Publishers",0.424237285261,-0.0929378827585,-0.179702910165,34656.6584598,21976.7315071
513120,"Periodical Publishers",0.054540322332,0.00613422478493,0.126724216489,63922.3631503,3286.06255573
513130,"Book Publishers",0.0141262109333,0.0119250713216,5.41768057695,33932.5473175,74.9881902897
513140,"Directory and Mailing List Publishers",0.0178554507797,-0.000796093892812,-0.0426824644709,41042.4731934,1213.13024007
513191,"Greeting Card Publishers",0,0,0,0,0
513199,"All Other Publishers",0.0120828496398,0.0102006871534,5.41966340688,99147.7250779,196.29837341
513210,"Software Publishers",0.399346060893,0.0494697578572,0.1413921361,120335.542976,118688.410764
516110,"Radio Broadcasting Stations",0.00650899382079,0.000598890515829,0.101333341386,61458.8431186,376.374330667
516120,"Television Broadcasting Stations",0.0368459882157,-0.00159382109818,-0.0414627732714,71772.9003401,2758.93998578
516210,"Media Streaming Distribution Services, Social Networks, and Other Media Networks and Content Providers",0.0291794710083,0.00168405124746,0.0612484283602,85280.1868129,2347.99804156
517111,"Wired Telecommunications Carriers",0.0546559788065,0.0062641373672,0.129446145898,100197.550293,6082.38027903
517112,"Wireless Telecommunications Carriers (except Satellite)",0.0778830605586,0.0151757826282,0.242009909042,140438.069277,8858.00926583
517121,"Telecommunications Resellers",0.0279190004793,0.0022818883937,0.0890072324091,250986.436455,6852.81338519
517410,"Satellite Telecommunications",0.0714868285298,0.00247342517356,0.0358397797134,189869.216003,13103.5368555
517810,"All Other Telecommunications",0,0,0,0,0
518210,"Data Processing, Hosting, and Related Services",0.0945811410961,-0.0279853169963,-0.228327696107,111149.668135,13686.1299713
519210,"Libraries and Archives",0,0,0,0,0
519290,"Web Search Portals and All Other Information Services",0.149841568915,-0.0110891313551,-0.0689062517997,92532.68436,14960.5066742
521110,"Monetary Authorities-Central Bank",0,0,0,0,0
522110,"Commercial Banking",17.3994053177,1.02157510296,0.0623754850042,114180.796276,1989724.60112
522130,"Credit Unions",8.923608913,0.542073683193,0.0646747485193,89507.5853454,762692.404093
522180,"Savings Institutions and Other Depository Credit Intermediation",2.14119087716,0.304337652892,0.165684252215,84069.7095388,157247.699071
522210,"Credit Card Issuing",0.233444524563,0.0430597579169,0.226172286131,124372.76882,31842.6764889
522220,"Sales Financing",0.39858257708,0.0299984393451,0.081388308052,137160.907196,53270.7892519
522291,"Consumer Lending",0.211321484216,0.0137652112927,0.0696774194461,104282.638184,20768.9511325
522292,"Real Estate Credit",0.177235589822,-0.0343854735458,-0.162486063526,149317.214634,32462.5082641
522299,"International, Secondary Market, and All Other Nondepository Credit Intermediation",0.16744794769,0.00643930831844,0.0399935577593,85435.3495185,13759.2019581
522310,"Mortgage and Nonmortgage Loan Brokers",0.191519317839,0.00120995663638,0.00635784087935,167289.96525,34310.1120375
522320,"Financial Transactions Processing, Reserve, and Clearinghouse Activities",0.216721558175,-0.00199482665846,-0.00912060913945,115007.729331,26661.5042421
522390,"Other Activities Related to Credit Intermediation",0.217860837067,-0.00731029931315,-0.0324655256917,48535.6671653,11339.4325169
523150,"Investment Banking and Securities Intermediation",1.75284616506,0.0210425391038,0.0121506496397,266583.313246,466474.07754
523160,"Commodity Contracts Intermediation",0.169230627339,0.0354014806647,0.264527433256,214785.143362,28764.9846455
523210,"Securities and Commodity Exchanges",0,0,0,0,0
523910,"Miscellaneous Intermediation",0.128856601769,0.00762481152492,0.0628944892225,43083.2471023,5307.25379551
523940,"Portfolio Management and Investment Advice",0.688249079807,0.0504736242133,0.0791401170594,120316.424266,77576.6604143
523991,"Trust, Fiduciary, and Custody Activities",0.10694317758,-0.00260967124721,-0.0238211171609,78944.2726392,8657.53448914
523999,"Miscellaneous Financial Investment Activities",0.101963172858,-0.0109947609979,-0.0973350044801,83378.0239647,9953.44216061
524113,"Direct Life Insurance Carriers",0.154541954765,-0.0252113787232,-0.140255416876,100457.727267,18857.3351707
524114,"Direct Health and Medical Insurance Carriers",0.281544274272,-0.0109644254992,-0.0374841004995,145170.497815,44226.3860933
524126,"Direct Property and Casualty Insurance Carriers",0.392053956763,-0.00567941052832,-0.0142794419462,92816.0970897,43788.1089922
524127,"Direct Title Insurance Carriers",0.10782657686,-0.00941107076548,-0.0802734527353,93554.5107187,11167.1076348
524128,"Other Direct Insurance (except Life, Health, and Medical) Carriers",0.0320595189896,-0.00465439239455,-0.126774626268,70165.1846804,2576.04153116
524130,"Reinsurance Carriers",0,0,0,0,0
524210,"Insurance Agencies and Brokerages",3.21239357738,0.0912069871867,0.0292218951194,104285.75506,379361.297981
524291,"Claims Adjusting",0.0641158375175,-0.00512209052213,-0.0739781022795,80655.0838683,6482.34968937
524292,"Pharmacy Benefit Management and Other Third Party Administration of Insurance and Pension Funds",0.0400407104816,-0.000816125064597,-0.0199752392393,66622.9259368,2783.51563893
524298,"All Other Insurance Related Activities",0.0258773134127,-0.00106619050265,-0.0395713380857,95567.5219964,2599.05226802
525110,"Pension Funds",0,0,0,0,0
525120,"Health and Welfare Funds",0,0,0,0,0
525190,"Other Insurance Funds",0,0,0,0,0
525910,"Open-End Investment Funds",0,0,0,0,0
525920,"Trusts, Estates, and Agency Accounts",0.0310157107703,0.00432726300959,0.162139928421,24650.7971996,660.004785252
525990,"Other Financial Vehicles",0,0,0,0,0
531110,"Lessors of Residential Buildings and Dwellings",4.116872686,0.179914335942,0.0456988161786,45695.4844867,181375.855609
531120,"Lessors of Nonresidential Buildings (except Miniwarehouses)",2.09858391135,0.090271367487,0.0449488640416,54948.2263588,111646.612732
531130,"Lessors of Miniwarehouses and Self-Storage Units",1.10769972002,0.0146303074623,0.0133846097001,40223.0256186,44277.9516985
531190,"Lessors of Other Real Estate Property",0.570385142396,0.0249210548045,0.0456878012164,58202.177273,224032.456998
531210,"Offices of Real Estate Agents and Brokers",0.467723015762,0.00488490954525,0.0105542509997,79285.868379,56762.6408775
531311,"Residential Property Managers",0.363507834033,0.0350320326617,0.10665026926,55189.7883895,18227.8298474
531312,"Nonresidential Property Managers",0.338035346632,0.0448445710855,0.152953553883,62591.2421319,18418.5545206
531320,"Offices of Real Estate Appraisers",0.0422517254166,0.00358969478553,0.092848066357,76936.4991845,3075.19134479
531390,"Other Activities Related to Real Estate",0.0396494195032,0.00454959849722,0.129618851801,83826.2737842,2954.92803955
532111,"Passenger Car Rental",0.037305652176,0.00254341371058,0.0731659934131,57239.2631468,2013.42529462
532112,"Passenger Car Leasing",0,0,0,0,0
532120,"Truck, Utility Trailer, and RV (Recreational Vehicle) Rental and Leasing",0.387205903827,0.0365891487548,0.104356532383,46485.9698909,60645.6966438
532210,"Consumer Electronics and Appliances Rental",0.0119667349222,0.000760250901007,0.0678402699339,21248.6316376,265.442711542
532281,"Formal Wear and Costume Rental",0.0500709049891,0.00915594849581,0.223779988555,28071.4337882,1148.5429004
532282,"Video Tape and Disc Rental",0,0,0,0,0
532283,"Home Health Equipment Rental",0.108046684989,0.00728016719929,0.0722478791466,52398.6728607,5280.03827496
532284,"Recreational Goods Rental",0.168844478046,0.00874851667234,0.0546454551213,23837.2700649,3816.25534677
532289,"All Other Consumer Goods Rental",0.22217904761,0.01048522104,0.0495301219213,46984.5869596,10746.5705248
532310,"General Rental Centers",0.264654810572,0.0117958487363,0.0466499136539,50863.7343051,12861.3668211
532411,"Commercial Air, Rail, and Water Transportation Equipment Rental and Leasing",0,0,0,0,0
532412,"Construction, Mining, and Forestry Machinery and Equipment Rental and Leasing",0.293819421313,0.0125386922647,0.044577146494,102048.678192,29127.8993457
532420,"Office Machinery and Equipment Rental and Leasing",0.00758502073795,0.00184566261115,0.321579969461,1702325.94935,20210.1106063
532490,"Other Commercial and Industrial Machinery and Equipment Rental and Leasing",0.40993970876,0.0059660829173,0.0147684960989,77632.779539,258631.436647
533110,"Lessors of Nonfinancial Intangible Assets (except Copyrighted Works)",0.305684350268,0.0121680924596,0.0414562809925,64286.2740363,19848.7600562
541110,"Offices of Lawyers",0.00159650243299,0.000296548785145,0.228122583938,93904.8994277,122.593145016
541191,"Title Abstract and Settlement Offices",0.000802761381569,0.000312426933016,0.637171085852,64654.051874,31.7616333251
541199,"All Other Legal Services",0.000248080664088,0.000103852724522,0.720059683546,47879.4013963,7.16990753089
541211,"Offices of Certified Public Accountants",0.160584390615,0.000228513028527,0.00142503681166,72712.8742972,24218.3636926
541213,"Tax Preparation Services",0.000497352611692,0.000350145794159,2.37859767656,33591.9000632,5.00057914922
541214,"Payroll Services",0.000919165957303,0.000487443792876,1.12906825973,81995.6284601,37.6156823279
541219,"Other Accounting Services",1.52878466527,0.0442155560037,0.0297834272097,64303.0555023,96291.2177354
541310,"Architectural Services",0.0538687132797,0.014135504046,0.355760441169,88642.0633158,3554.90095823
541320,"Landscape Architectural Services",0.00116412723919,0.000177931186883,0.180421718853,66421.3780832,66.8651899631
541330,"Engineering Services",0.0396690695332,0.00816349535898,0.259112730777,99215.2701499,3162.13740465
541340,"Drafting Services",0.00849841080433,0.00258739431025,0.437724089052,78044.0437062,462.444758675
541350,"Building Inspection Services",0.178527767446,0.0505300800548,0.394773382901,55867.8613901,7473.12474785
541360,"Geophysical Surveying and Mapping Services",0,0,0,0,0
541370,"Surveying and Mapping (except Geophysical) Services",0.0690008930373,0.00489415875192,0.0763439099882,75323.0474206,4949.97568666
541380,"Testing Laboratories",0.00989197217709,0.000682068314805,0.0740581362198,59580.9449856,554.971939224
541410,"Interior Design Services",0.00985509824961,0.000324536981508,0.034052242295,43356.729763,414.452852359
541420,"Industrial Design Services",0,0,0,0,0
541430,"Graphic Design Services",0.0125794314012,0.0020579670464,0.195597017392,57796.1998498,633.761836419
541490,"Other Specialized Design Services",0.0158693143094,0.0016730773996,0.117853584033,60571.6970224,889.859580541
541511,"Custom Computer Programming Services",2.57829694386,0.0248212586074,0.00972057762318,112805.361107,298737.968606
541512,"Computer Systems Design Services",0.257370248374,0.0147036307239,0.0605918970901,150629.762046,37698.7444166
541513,"Computer Facilities Management Services",0.141531896808,-0.0309338778505,-0.179362415017,81044.6976005,14823.8125528
541519,"Other Computer Related Services",0.061836720196,-0.0121900405365,-0.164670727395,98012.6020046,7501.25818892
541611,"Administrative Management and General Management Consulting Services",0.312163745287,0.0231884974538,0.0802438881104,87938.7714097,25780.7658429
541612,"Human Resources Consulting Services",0.182116937402,0.00955542992003,0.0553740521827,73489.3409732,12982.335823
541613,"Marketing Consulting Services",0.20068191588,0.00451653746347,0.0230241314748,91722.6363139,18488.4330469
541614,"Process, Physical Distribution, and Logistics Consulting Services",0.12546453554,-0.00531788764745,-0.0406620975346,100792.471041,13425.8622979
541618,"Other Management Consulting Services",0.177578149854,-0.00353832364429,-0.0195361778857,123445.85501,22873.7376187
541620,"Environmental Consulting Services",0.150902654728,-0.00375406704069,-0.0242735459394,66836.6247085,10448.4662487
541690,"Other Scientific and Technical Consulting Services",0.159922452878,-0.00251253290093,-0.0154679294543,91274.2381837,15256.3756577
541713,"Research and Development in Nanotechnology",0.166047697263,-0.000986684347036,-0.00590707336732,107248.612541,18333.5564526
541714,"Research and Development in Biotechnology (except Nanobiotechnology)",0.169227202755,0.000792999930001,0.00470806948173,166665.077451,28111.3162056
541715,"Research and Development in the Physical, Engineering, and Life Sciences (except Nanotechnology and Biotechnology)",0.16927712731,0.00275057848067,0.0165173571422,134053.890267,23083.0758321
541720,"Research and Development in the Social Sciences and Humanities",0.166075851648,0.00478644247993,0.0296761114361,63782.7881294,10877.3925721
541810,"Advertising Agencies",0.159787002979,0.00680263270538,0.0444661941165,80306.5983386,12421.6426155
541820,"Public Relations Agencies",0.150851391168,0.0087125757151,0.0612962454155,72543.4234652,10399.3920847
541830,"Media Buying Agencies",0.139827088939,0.0104366337498,0.0806599971732,89692.8839982,11605.4173175
541840,"Media Representatives",0.127191931827,0.0118940201823,0.103159025282,118014.649198,14442.1518089
541850,"Outdoor Advertising",0.113317080859,0.0130201077576,0.129815560281,114043.016384,11828.6130526
541860,"Direct Mail Advertising",0.0984681706228,0.0138213162663,0.163282101519,58041.7775493,4913.05991483
541870,"Advertising Material Distribution Services",0,0,0,0,0
541890,"Other Services Related to Advertising",0.0828909163371,0.014278923895,0.208111197281,33098.931058,2832.73286833
541910,"Marketing Research and Public Opinion Polling",0.0669885479396,0.014909331521,0.28628179428,28621.5665366,1504.12910277
541921,"Photography Studios, Portrait",0.050251346426,0.014986411785,0.42496638481,52328.3967631,1861.02609473
541922,"Commercial Photography",0.0129968429891,0.00995557391052,3.27349328627,88649.9537401,324.722287687
541930,"Translation and Interpretation Services",3.52066365252,0.215816014657,0.0653028636431,41543.2030871,299407.802417
