441227,"Motorcycle, ATV, and All Other Motor Vehicle Dealers",0.0230919109701,0.000318542608697,0.0139875052141,72668.5745719,1685.56363526
441330,"Automotive Parts and Accessories Retailers",0.248407987359,0.00172892358814,0.00700879742981,37939.6370819,35714.606868
441340,"Tire Dealers",0.020045454178,5.14780815245E-5,0.00257467955729,63944.9008107,1293.58837784
444110,"Home Centers",33.3658090352,-0.438403285833,-0.0129688951681,47289.0023136,1619697.23776
444120,"Paint and Wallpaper Stores",0.0158751445631,-0.000197970308461,-0.0123168601757,63075.3961463,1014.76677214
444140,"Hardware Retailers",0.0140857760559,-0.000277926408214,-0.0193492178572,43681.9804895,632.971232912
444180,"Other Building Material Dealers",0.201841446874,0.00580864094738,0.0296309636539,48073.9794073,29094.3414083
444230,"Outdoor Power Equipment Retailers",0.0939990301018,0.00245868524652,0.0268590341276,58218.8323341,8104.40401673
444240,"Nursery, Garden Center, and Farm Supply Retailers",0.751881950742,-0.296158358163,-0.282582984306,50977.0678264,57821.6734035
445110,"Supermarkets and Other Grocery (except Convenience) Stores",77.4285831137,-0.462432302869,-0.00593691455165,41996.1700538,3272386.57609
445131,"Convenience Retailers",0.934115422101,-0.0234747585433,-0.0245144102537,34852.5118522,72982.0205119
445132,"Vending Machine Operators",0.145016763905,-0.0304552452675,-0.173561842775,48366.73466,8586.25814118
445230,"Fruit and Vegetable Markets",0.0755374732251,0.00389968302934,0.0544361156127,28993.6525617,19987.0048137
445240,"Meat Retailers",0.209542864784,-0.0479962737055,-0.186364969561,44466.357804,12110.8748845
445250,"Fish and Seafood Retailers",0,0,0,0,0
445291,"Baked Goods Stores",0.319588050563,-0.0344572974094,-0.0973245309018,25485.3527107,9022.98163195
445292,"Confectionery and Nut Stores",0.315891754868,-0.0255239337784,-0.074759112212,19545.8474777,6673.26715902
445298,"All Other Specialty Food Retailers",0.467553779013,-0.0137446962807,-0.0285575313164,24953.2472307,12079.7016575
445320,"Beer, Wine, and Liquor Retailers",2.63739341085,0.0671629546391,0.0261311021651,42582.5035241,135392.623371
449110,"Furniture Retailers",55.3048460327,-0.338054676117,-0.00607543229794,59173.2846305,3692456.67445
449121,"Floor Covering Retailers",0.506115031853,0.017172236747,0.0351211571554,70807.0363566,34620.6327186
449122,"Window Treatment Retailers",0.316136555746,-0.00149119999427,-0.00469480379884,40411.5813104,12857.5449864
449129,"All Other Home Furnishings Retailers",1.7452949264,-0.0613606523307,-0.0339636691425,29720.6479975,64970.259679
449210,"Electronics and Appliance Retailers",2.08143671666,0.0147711798272,0.0071473489851,70551.5961575,152722.904519
455110,"Department Stores",0.60161053199,0.00631709911316,0.010611739966,33831.0236213,20222.1774065
455211,"Warehouse Clubs and Supercenters",102.081030419,4.02284715453,0.0410251038784,47427.9287266,4739387.43668
455219,"All Other General Merchandise Retailers",23.5234656336,0.635407486324,0.027761528839,38982.990127,1208773.47994
456110,"Pharmacies and Drug Retailers",15.9708368482,-0.113820872102,-0.00707636271043,56563.9610953,1098819.74602
456120,"Cosmetics, Beauty Supplies, and Perfume Retailers",7.06427781691,0.320156976683,0.0474720106991,24500.1473915,198921.128222
456130,"Optical Goods Retailers",6.49780918386,-0.127171552777,-0.0191957618946,44760.247605,320528.686104
456191,"Food (Health) Supplement Retailers",3.07962635683,-0.0469873694403,-0.0150281977737,33129.0195052,110508.173561
456199,"All Other Health and Personal Care Retailers",0.0546658029223,-0.0198323881849,-0.266213016586,65459.1733082,4921.73676386
457110,"Gasoline Stations with Convenience Stores",0.354283333458,0.0204894914063,0.0613836710719,39433.3120895,13262.7083451
457120,"Other Gasoline Stations",0.434337058019,0.0336395522255,0.0839524871984,50588.5375921,20270.7256893
457210,"Fuel Dealers",0.0824637994163,-0.0238390967924,-0.224256324547,62277.2832673,6671.08538041
458110,"Clothing and Clothing Accessories Retailers",12.5915658932,-0.375333512403,-0.0289455096907,33392.9535571,524425.891062
458210,"Shoe Retailers",0.281882113641,0.0221825503757,0.0854162020787,29582.0035959,7749.16329502
458310,"Jewelry Retailers",1.92880991854,0.0243395318942,0.0127802102174,46756.4548506,103134.194234
458320,"Luggage and Leather Goods Retailers",0.023305480693,-0.000860663217807,-0.0356144207775,26861.3021998,823.362808072
459110,"Sporting Goods Retailers",1.68582110007,0.0210803766413,0.0126628587531,35016.7637851,67790.2175708
459120,"Hobby, Toy, and Game Retailers",0.173757299424,0.012956164834,0.0805725958778,31464.0484028,5086.00297556
459130,"Sewing, Needlework, and Piece Goods Retailers",2.08658119229,-0.0837343131442,-0.0385816315345,24915.2385952,65095.8629188
459140,"Musical Instrument and Supplies Retailers",0.0654251072159,0.00537935200298,0.089587548427,32506.0118389,1958.47979799
459210,"Book Retailers and News Dealers",0.0764326036086,0.00630676287782,0.0899349342851,29279.1582826,2054.5278818
459310,Florists,3.87984831696,-0.197075233263,-0.048339202547,31249.4876222,216499.200836
459410,"Office Supplies and Stationery Retailers",0.0964377243336,0.00775581100699,0.087456514142,50822.4911862,4514.97501724
459420,"Gift, Novelty, and Souvenir Retailers",1.51146878809,-0.0982420030136,-0.0610308407924,26237.5407718,87949.1079778
459510,"Used Merchandise Retailers",1.06114558689,0.0335142564649,0.0326131127698,26881.0997854,69252.5692293
459910,"Pet and Pet Supplies Retailers",1.28775354057,0.0223397109682,0.0176540752484,34798.6709467,74521.7271264
459920,"Art Dealers",0.113703647219,0.00655116974127,0.0611387612821,42058.2884743,4640.49627812
459930,"Manufactured (Mobile) Home Dealers",0.114243454789,0.00968990975098,0.0926789210972,88200.7903938,9221.71661777
459991,"Tobacco, Electronic Cigarette, and Other Smoking Supplies Retailers",0.174614199659,0.00405824055084,0.0237941879725,32787.1109826,5622.69714777
459999,"All Other Miscellaneous Retailers",0.288184385164,0.0205953894887,0.0769665039354,48049.4005937,13030.7169526
481111,"Scheduled Passenger Air Transportation",0.000155053348731,-4.64213899123E-5,-0.230407991716,67698.8109378,13.6396177724
481112,"Scheduled Freight Air Transportation",0,0,0,0,0
481211,"Nonscheduled Chartered Passenger Air Transportation",0.228504240659,-0.0236091269784,-0.0936448836475,74448.7551973,62592.0087077
481212,"Nonscheduled Chartered Freight Air Transportation",0.0921930774598,0.0100954026153,0.122968191662,196839.00519,16160.0246576
481219,"Other Nonscheduled Air Transportation",1.14849846146,0.0293847691983,0.0262571795892,74440.5901385,217894.946705
482110,"Rail transportation",13.7729667969,0.278223182221,0.0206171521419,82278.4099961,1110326.04792
483111,"Deep Sea Freight Transportation",0,0,0,0,0
483112,"Deep Sea Passenger Transportation",0,0,0,0,0
483113,"Coastal and Great Lakes Freight Transportation",0,0,0,0,0
483114,"Coastal and Great Lakes Passenger Transportation",0,0,0,0,0
483211,"Inland Water Freight Transportation",0,0,0,0,0
483212,"Inland Water Passenger Transportation",0,0,0,0,0
484110,"General Freight Trucking, Local",1.25737338065,0.0159869046405,0.0128782655116,62235.148369,107457.680602
484121,"General Freight Trucking, Long-Distance, Truckload",1.24067425064E-5,-3.57128930335E-6,-0.223512466734,90821.4271664,1.46301419757
484122,"General Freight Trucking, Long-Distance, Less Than Truckload",1.28980215884E-5,-2.59478786158E-6,-0.167483365103,93995.5513514,1.45920176435
484210,"Used Household and Office Goods Moving",1.09511414332E-5,-2.05256395852E-6,-0.157844544819,52876.9702456,0.690161162451
484220,"Specialized Freight (except Used Goods) Trucking, Local",0,0,0,0,0
484230,"Specialized Freight (except Used Goods) Trucking, Long-Distance",0,0,0,0,0
485111,"Mixed Mode Transit Systems",0,0,0,0,0
485112,"Commuter Rail Systems",0,0,0,0,0
485113,"Bus and Other Motor Vehicle Transit Systems",0,0,0,0,0
485119,"Other Urban Transit Systems",0,0,0,0,0
485210,"Interurban and Rural Bus Transportation",0,0,0,0,0
485310,"Taxi Service",0,0,0,0,0
485320,"Limousine Service",0,0,0,0,0
485410,"School and Employee Bus Transportation",0,0,0,0,0
485510,"Charter Bus Industry",0,0,0,0,0
485991,"Special Needs Transportation",0,0,0,0,0
485999,"All Other Transit and Ground Passenger Transportation",0,0,0,0,0
486110,"Pipeline Transportation of Crude Oil",0,0,0,0,0
486210,"Pipeline Transportation of Natural Gas",0,0,0,0,0
486910,"Pipeline Transportation of Refined Petroleum Products",0,0,0,0,0
486990,"All Other Pipeline Transportation",0,0,0,0,0
487110,"Scenic and Sightseeing Transportation, Land",0.0174805300689,0.000972159765457,0.0588888998484,36079.856713,1135.87158346
487210,"Scenic and Sightseeing Transportation, Water",0.00604409011062,-0.000136159990916,-0.022031469387,38263.7574891,872.719909448
487990,"Scenic and Sightseeing Transportation, Other",0,0,0,0,0
488111,"Air Traffic Control",0,0,0,0,0
488119,"Other Airport Operations",0,0,0,0,0
488190,"Other Support Activities for Air Transportation",0,0,0,0,0
488210,"Support Activities for Rail Transportation",1.38042979853E-5,2.47145383589E-6,0.218078869108,37703.5627395,0.427626130119
488310,"Port and Harbor Operations",0,0,0,0,0
488320,"Marine Cargo Handling",1.627445139E-5,1.30810508405E-6,0.0874031014192,67977.0501433,1.01737149724
488330,"Navigational Services to Shipping",0,0,0,0,0
488390,"Other Support Activities for Water Transportation",0,0,0,0,0
488410,"Motor Vehicle Towing",1.71753855099E-5,2.68277771657E-7,0.0158677507596,53903.3582376,0.912104617412
488490,"Other Support Activities for Road Transportation",1.70771348938E-5,-4.92343576538E-7,-0.0280226631297,39631.4853932,0.696305482664
488510,"Freight Transportation Arrangement",1.83021984433,0.00561534974575,0.00307757092697,55146.9806283,230574.035474
488991,"Packing and Crating",0,0,0,0,0
488999,"All Other Support Activities for Transportation",0,0,0,0,0
491110,"Postal Service",0.573788710568,0.0390411205589,0.0730085021201,39239.8277899,20983.4033445
492110,"Couriers and Express Delivery Services",4.07074542901,0.26252881989,0.068937470432,41303.0733186,1063693.75936
492210,"Local Messengers and Local Delivery",4.30235491329,0.333905324622,0.0841399940106,25959.6574434,854957.727528
493110,"General Warehousing and Storage",0.232858257548,0.0173391130315,0.0804527740236,62422.0799474,38155.7096012
493120,"Refrigerated Warehousing and Storage",0,-1.04856718328E-5,-1,59996.4150459,0.631159020904
493130,"Farm Product Warehousing and Storage",0,-1.03424463849E-5,-1,79291.8594482,0.820077552941
493190,"Other Warehousing and Storage",0,-1.00766869777E-5,-1,81826.3600894,0.825321991983
512110,"Motion Picture and Video Production",4.58992070981,0.197133755033,0.0448766937852,53891.6101911,241850.001676
512120,"Motion Picture and Video Distribution",0,0,0,0,0
512131,"Motion Picture Theaters (except Drive-Ins)",2.29840617774,0.174104383095,0.0819584032428,21771.1621623,49025.0567814
512132,"Drive-In Motion Picture Theaters",0,0,0,0,0
512191,"Teleproduction and Other Postproduction Services",0.0500843269556,0.0475045422334,18.4141497635,43614.2369904,112.767484085
512199,"Other Motion Picture and Video Industries",0,0,0,0,0
512230,"Music Publishers",0,0,0,0,0
512240,"Sound Recording Studios",0.00647948834792,0.000611381600089,0.10418719808,30638.3155617,179.789126734
512250,"Record Production and Distribution",0.00752981208123,-0.00366771283333,-0.327546744599,35485.178668,397.346659429
512290,"Other Sound Recording Industries",0,0,0,0,0
513110,"Newspaper Publishers",9.17310820395,-0.0685799295113,-0.00742071454056,60395.3032031,578623.422638
513120,"Periodical Publishers",0.578820451473,-0.0410596469403,-0.0662380467535,63922.3631503,42080.7477499
513130,"Book Publishers",1.47499642609,-0.122675763335,-0.0767840638068,31709.7896472,80669.5481783
513140,"Directory and Mailing List Publishers",0.162791587184,0.00898811703087,0.0584389742439,37987.6356704,9735.13115341
513191,"Greeting Card Publishers",0,0,0,0,0
513199,"All Other Publishers",12.4847141926,1.3609649354,0.122347681877,95537.3813498,1120221.84551
513210,"Software Publishers",124.592854577,18.7837501784,0.177524895282,139595.713053,16128532.5496
516110,"Radio Broadcasting Stations",3.97991443278,-0.2491020618,-0.0589030716999,60151.2980458,293040.027521
516120,"Television Broadcasting Stations",0.889084709557,0.0619516225529,0.0748992193957,71772.9003401,59365.8134114
516210,"Media Streaming Distribution Services, Social Networks, and Other Media Networks and Content Providers",1.01002258385,0.0713069965205,0.0759623015567,85280.1868129,80162.5281517
517111,"Wired Telecommunications Carriers",267.136782125,-47.3977182568,-0.150691635414,100082.067556,40378281.798
517112,"Wireless Telecommunications Carriers (except Satellite)",1.9820705671,0.167738748443,0.0924520788968,140438.069277,256291.910466
517121,"Telecommunications Resellers",0.0438017838336,0.00928049880856,0.268834106316,250986.436455,11828.818927
517410,"Satellite Telecommunications",8.70337414674,1.87379395906,0.27436444226,189869.216003,1311984.84674
517810,"All Other Telecommunications",0.0599731181338,-0.0011338512783,-0.0185551875541,26155.2195978,10715.2768303
518210,"Data Processing, Hosting, and Related Services",219.678237305,24.1667641133,0.123607907602,110400.565914,22202017.3479
519210,"Libraries and Archives",0.0134299923596,0.000913800739472,0.0730094878064,6545.77872093,81.9282207742
519290,"Web Search Portals and All Other Information Services",0.657678214314,0.051490360315,0.0849412603294,84072.429343,56966.968234
521110,"Monetary Authorities-Central Bank",0,0,0,0,0
522110,"Commercial Banking",34.9150421564,-8.02927673023,-0.186969474389,114003.881907,5208789.63003
522130,"Credit Unions",626.664269738,-0.123771801974,-0.000197469948006,89455.258846,57002972.8781
522180,"Savings Institutions and Other Depository Credit Intermediation",752.572580003,48.7202515671,0.0692194223118,84035.5438825,60232304.7646
522210,"Credit Card Issuing",0.122338508923,0.0400943055538,0.487503117683,124372.76882,13755.6990883
522220,"Sales Financing",0.287322638772,0.036675721508,0.146324247305,140657.051577,40784.8456317
522291,"Consumer Lending",0.244625150922,0.0236062955273,0.106806704275,106575.381208,24875.2507195
522292,"Real Estate Credit",3.81016842104,0.947097355406,0.330797711162,149317.214634,439192.898145
522299,"International, Secondary Market, and All Other Nondepository Credit Intermediation",0.167712419867,-0.204257967915,-0.549124270705,85435.3495185,31787.2115926
522310,"Mortgage and Nonmortgage Loan Brokers",0.0851507299444,-0.0329087402479,-0.278747144928,167289.96525,21284.4687397
522320,"Financial Transactions Processing, Reserve, and Clearinghouse Activities",0.0200756814119,-0.00708409615574,-0.260830418736,115007.729331,3310.77402082
522390,"Other Activities Related to Credit Intermediation",0.108719065772,-0.000341626794929,-0.00313244659361,151363.706529,27340.5877162
523150,"Investment Banking and Securities Intermediation",12.4263104068,-2.19746514418,-0.150266607726,267590.38344,5322067.99616
523160,"Commodity Contracts Intermediation",0.0481105254495,-0.170911191718,-0.780339018104,222106.784366,48678.5034681
523210,"Securities and Commodity Exchanges",0,0,0,0,0
523910,"Miscellaneous Intermediation",0.903744026009,-0.327339061794,-0.265895182086,87920.7224554,521024.179104
523940,"Portfolio Management and Investment Advice",13.9971942542,-0.596218720884,-0.0408553312308,127069.738313,4266163.76691
523991,"Trust, Fiduciary, and Custody Activities",5.23240811413,-0.212409468089,-0.0390113102747,85394.5871956,728281.168206
523999,"Miscellaneous Financial Investment Activities",0.739063656554,-0.0373156525361,-0.0480636875548,83378.0239647,68411.7200442
524113,"Direct Life Insurance Carriers",150.192050096,-14.3644264491,-0.0872917721058,99889.2448921,17117210.5422
524114,"Direct Health and Medical Insurance Carriers",189.051167225,-10.5360359221,-0.0527891355558,142771.699716,29657361.4726
524126,"Direct Property and Casualty Insurance Carriers",25.0897248247,-3.52760745022,-0.123268214393,93176.7800498,3121595.13751
524127,"Direct Title Insurance Carriers",0.811847848137,-0.114036294264,-0.123164755763,93554.5107187,88192.2154266
524128,"Other Direct Insurance (except Life, Health, and Medical) Carriers",0.0972324646319,0.00835703891076,0.0940309297306,89788.6695169,7980.0096635
524130,"Reinsurance Carriers",0,0,0,0,0
524210,"Insurance Agencies and Brokerages",135.740456421,-6.57009899735,-0.0461673343768,112818.555466,17098697.7899
524291,"Claims Adjusting",0.0997538106035,-0.0838612276467,-0.456723090036,80655.0838683,17190.8218496
524292,"Pharmacy Benefit Management and Other Third Party Administration of Insurance and Pension Funds",1.00480575627,-0.134344505148,-0.117933963321,66622.9259368,77608.6186158
524298,"All Other Insurance Related Activities",0.634697358254,-0.0952206376865,-0.130453884157,95567.5219964,70410.1080831
525110,"Pension Funds",0,0,0,0,0
525120,"Health and Welfare Funds",0,0,0,0,0
525190,"Other Insurance Funds",0,0,0,0,0
525910,"Open-End Investment Funds",0,0,0,0,0
525920,"Trusts, Estates, and Agency Accounts",0.276923791379,-0.0319763792637,-0.103516871477,24650.7971996,7639.09511026
525990,"Other Financial Vehicles",0,0,0,0,0
531110,"Lessors of Residential Buildings and Dwellings",32.4839846196,-0.752166513895,-0.0226309752556,68016.73119,7023211.4183
531120,"Lessors of Nonresidential Buildings (except Miniwarehouses)",11.4405851325,0.014532636588,0.00127188603354,72095.4577214,3905863.65345
531130,"Lessors of Miniwarehouses and Self-Storage Units",2.99801666061,-0.336792868506,-0.10099313486,92419.0550412,1223395.55891
531190,"Lessors of Other Real Estate Property",0.607964326277,0.00473387559159,0.0078475408299,87199.4560796,500936.189808
531210,"Offices of Real Estate Agents and Brokers",21.651152474,-0.0459835664709,-0.00211933807232,85833.489249,3444917.18948
531311,"Residential Property Managers",68.3243986079,3.33565114177,0.0513265953235,56403.9233516,4284652.06109
531312,"Nonresidential Property Managers",26.4864422551,2.14075230732,0.0879314700843,63170.9246239,1730498.80518
531320,"Offices of Real Estate Appraisers",1.54247413233,-0.043346876595,-0.0273340284629,76561.3177007,276037.494359
531390,"Other Activities Related to Real Estate",0.945600054612,0.00264889550153,0.00280915451022,83826.2737842,79383.6760452
532111,"Passenger Car Rental",0.288992726232,-0.0138880228535,-0.0458531052085,57239.2631468,17542.8219926
532112,"Passenger Car Leasing",0,0,0,0,0
532120,"Truck, Utility Trailer, and RV (Recreational Vehicle) Rental and Leasing",7.08635527263,0.0623180467234,0.008872112251,59203.0732901,463603.318584
532210,"Consumer Electronics and Appliances Rental",0.0138692858126,0.0026715440376,0.23857882163,21248.6316376,265.235638073
532281,"Formal Wear and Costume Rental",0.254780922922,-0.0343218521617,-0.118718515074,28071.4337882,8115.53935941
532282,"Video Tape and Disc Rental",0,0,0,0,0
532283,"Home Health Equipment Rental",1.29249689718,0.017645499272,0.0138412204756,52398.6728607,66800.6032509
532284,"Recreational Goods Rental",0.689345755624,0.0376136851815,0.0577134176563,23837.2700649,15535.5324216
532289,"All Other Consumer Goods Rental",0.291873080599,-0.018834967526,-0.0606195032271,46984.5869596,15772.9963405
532310,"General Rental Centers",0.47723054274,-0.0309938868143,-0.0609846457823,50863.7343051,25850.2240478
532411,"Commercial Air, Rail, and Water Transportation Equipment Rental and Leasing",0,0,0,0,0
532412,"Construction, Mining, and Forestry Machinery and Equipment Rental and Leasing",0.255393711579,-0.0069535837826,-0.0265052619392,102048.678192,27167.2561387
532420,"Office Machinery and Equipment Rental and Leasing",0,0,0,0,0
532490,"Other Commercial and Industrial Machinery and Equipment Rental and Leasing",0.299199837964,-0.0246745945299,-0.0761856820248,81358.7578823,26809.4455054
533110,"Lessors of Nonfinancial Intangible Assets (except Copyrighted Works)",0.48537910585,0.010461724304,0.0220285142438,64286.2740363,32115.8399307
541110,"Offices of Lawyers",9.45756150568,-0.457607735899,-0.0461522869403,98104.3185448,1011720.76163
541191,"Title Abstract and Settlement Offices",0.278754725816,0.00174521763979,0.00630020843431,108957.362858,32232.8554693
541199,"All Other Legal Services",0.00583316749371,0.00432366109152,2.86428801181,47879.4013963,75.0410867237
541211,"Offices of Certified Public Accountants",27.0951382581,0.616240962328,0.0232729088166,76892.7529596,2149324.30712
541213,"Tax Preparation Services",2.13220406575,0.0555268057534,0.0267382933415,39626.4966919,85996.5308637
541214,"Payroll Services",0.020026531953,0.0102646930659,1.0515122391,81995.6284601,850.542920354
541219,"Other Accounting Services",60.6605438036,1.1382723619,0.0191234698262,66058.4535706,3958036.212
541310,"Architectural Services",2.39547177582,-0.27175922697,-0.101888147928,85927.2935309,254564.768105
541320,"Landscape Architectural Services",0.564229450321,0.00682109748581,0.0122371641026,68217.4285374,46643.9256613
541330,"Engineering Services",82.2812408311,1.247749228,0.0153979447672,97348.857445,8174755.20165
541340,"Drafting Services",0.00365975603697,-0.0762775386668,-0.954217164209,78044.0437062,6253.84534038
541350,"Building Inspection Services",0.733290964157,0.02228570168,0.0313439335208,55867.8613901,41511.9298729
541360,"Geophysical Surveying and Mapping Services",0.223299928115,0.00123051545247,0.00554112985538,68223.586927,18308.6094715
541370,"Surveying and Mapping (except Geophysical) Services",13.8212547467,0.697627598994,0.0531581392204,74529.1096572,1004822.66584
541380,"Testing Laboratories",0.611220439465,-0.0503316975283,-0.0760812258231,59580.9449856,39863.9201727
541410,"Interior Design Services",0.594364563111,-0.0232725491606,-0.0376799721037,43356.729763,26859.0123606
541420,"Industrial Design Services",0.0298066541932,0.000944511255029,0.0327249177947,47503.9433942,2278.7208084
541430,"Graphic Design Services",1.24423974251,-0.179929378155,-0.126339895694,50217.4654659,73285.5332431
541490,"Other Specialized Design Services",0.112275037664,0.00510547047867,0.0476391816518,50126.956309,7451.65271168
541511,"Custom Computer Programming Services",208.690554774,0.98544989376,0.00474446641227,139869.092292,29850769.9141
541512,"Computer Systems Design Services",83.2356212173,6.78703272191,0.0887790455716,147645.135332,11634692.6333
541513,"Computer Facilities Management Services",8.23104122194,0.208243229092,0.025956434311,80229.2362194,683383.393228
541519,"Other Computer Related Services",0.446737521474,-0.023635911376,-0.0502492482044,98012.6020046,47663.7438962
541611,"Administrative Management and General Management Consulting Services",94.9905193039,5.80592005976,0.065100029702,87902.3484496,8554355.85645
541612,"Human Resources Consulting Services",0.685780777101,-0.000113306665771,-0.000165195572396,73489.3409732,51601.9329247
541613,"Marketing Consulting Services",12.2582709167,0.913321029157,0.0805046331816,88824.031432,1127427.21895
541614,"Process, Physical Distribution, and Logistics Consulting Services",0.673826307697,0.0255373083456,0.0393918582162,100792.471041,66552.0535746
541618,"Other Management Consulting Services",2.77825826054,0.273183036568,0.109051829643,120930.078305,310504.367615
541620,"Environmental Consulting Services",0.473767559702,-0.000957137557433,-0.00201619499251,66836.6247085,32071.9650591
541690,"Other Scientific and Technical Consulting Services",23.4503963474,2.45321471776,0.116835428727,90648.2843733,1999848.93839
541713,"Research and Development in Nanotechnology",0.693495919788,0.0254588208523,0.0381098907423,107248.612541,73323.2029699
541714,"Research and Development in Biotechnology (except Nanobiotechnology)",0.51224594432,-0.0111044716243,-0.02121804299,166665.077451,87346.0899401
541715,"Research and Development in the Physical, Engineering, and Life Sciences (except Nanotechnology and Biotechnology)",0.841548302249,0.00810916937477,0.00972976796374,134053.890267,115527.156726
541720,"Research and Development in the Social Sciences and Humanities",0.78515943839,0.0301204445027,0.0398925681276,63782.7881294,50919.9927392
541810,"Advertising Agencies",10.3506448586,0.251093817606,0.0248618791653,84088.7081729,1007194.8349
541820,"Public Relations Agencies",13.1910346714,0.993415017673,0.081443350906,75200.8280713,1601085.14018
541830,"Media Buying Agencies",0.288891650141,0.00293878853278,0.0102771782603,101213.696383,35852.2183159
541840,"Media Representatives",0.416836729348,-0.0611594703231,-0.127949699946,118014.649198,59873.5361401
541850,"Outdoor Advertising",0.957985889183,0.00787591873383,0.00828948119564,114043.016384,112052.067479
541860,"Direct Mail Advertising",0.562701185082,-0.0394920822083,-0.0655804113951,58041.7775493,34952.4105178
541870,"Advertising Material Distribution Services",0.0681383292798,0.00239804185277,0.0364775078818,72156.2568964,6188.24460765
541890,"Other Services Related to Advertising",3.77347713764,-0.254320490644,-0.0631413278707,46416.0854432,220448.198427
541910,"Marketing Research and Public Opinion Polling",1.73440818593,-0.425011464316,-0.196817447812,33925.8146247,85004.2874208
541921,"Photography Studios, Portrait",0.86529695638,0.000609926367093,0.000705372401716,52328.3967631,45631.8760552
541922,"Commercial Photography",0.185470974427,-0.0137245364717,-0.0688998281626,88649.9537401,21268.4969086
541930,"Translation and Interpretation Services",0.375791984974,0.00200165967883,0.00535503340607,66358.9482219,25514.8538281
541940,"Veterinary Services",65.5497991833,3.43715695762,0.0553374777574,51385.359155,3230799.58899
541990,"All Other Professional, Scientific, and Technical Services",9.4659393407,0.272567761444,0.0296482916082,42287.2968292,1594717.29127
551111,"Offices of Bank Holding Companies",0.000691937750978,-0.000808757219707,-0.538921789908,196267.43206,294.537909342
