333131,"Mining Machinery and Equipment Manufacturing",0,0,0,0,0
333132,"Oil and Gas Field Machinery and Equipment Manufacturing",0,0,0,0,0
333241,"Food Product Machinery Manufacturing",0.000515104832398,-9.49599436647E-5,-0.155655509694,89688.338489,54.7157632241
333242,"Semiconductor Machinery Manufacturing",0,0,0,0,0
333243,"Sawmill, Woodworking, and Paper Machinery Manufacturing",0.000526950469214,-9.72081468563E-5,-0.155742698015,76344.183193,47.6509381528
333248,"All Other Industrial Machinery Manufacturing",0.000538103534202,-9.94098686301E-5,-0.155933770472,109916.584012,70.1061078842
333310,"Commercial and Service Industry Machinery Manufacturing",0.00054854251703,-0.000101517892699,-0.156166859541,69370.5862102,45.221055628
333413,"Industrial and Commercial Fan and Blower and Air Purification Equipment Manufacturing",0,0,0,0,0
333414,"Heating Equipment (except Warm Air Furnaces) Manufacturing",0.000558247069053,-0.000103472825331,-0.156369524642,66013.5877771,43.6825578921
333415,"Air-Conditioning and Warm Air Heating Equipment and Commercial and Industrial Refrigeration Equipment Manufacturing",0.000567198181088,-0.000105291851706,-0.156570129773,51236.0412503,34.8054217987
333511,"Industrial Mold Manufacturing",0.000575378336793,-0.000107027709962,-0.156838747943,88565.458479,60.4376785038
333514,"Special Die and Tool, Die Set, Jig, and Fixture Manufacturing",0.000582771652895,-0.000108621992934,-0.157105859433,67894.3250955,46.9417625154
333515,"Cutting Tool and Machine Tool Accessory Manufacturing",0.000589364043613,-0.000110088421194,-0.157392284299,97837.1747138,68.9862728083
333517,"Machine Tool Manufacturing",0.000595143319661,-0.00011142969738,-0.157704433502,94797.6692009,67.0702548786
333519,"Rolling Mill and Other Metalworking Machinery Manufacturing",0.000600099275095,-0.000112687291388,-0.15809401676,111728.93438,79.638981161
333611,"Turbine and Turbine Generator Set Units Manufacturing",0,0,0,0,0
333612,"Speed Changer, Industrial High-Speed Drive, and Gear Manufacturing",0,0,0,0,0
333613,"Mechanical Power Transmission Equipment Manufacturing",0,0,0,0,0
333618,"Other Engine Equipment Manufacturing",0.000604223747419,-0.000113778925095,-0.158465879656,96156.8742958,97.0622566106
333912,"Air and Gas Compressor Manufacturing",0,0,0,0,0
333914,"Measuring, Dispensing, and Other Pumping Equipment Manufacturing",0.000607510621618,-0.000114671053388,-0.158784219202,122343.91671,88.35464303
333921,"Elevator and Moving Stairway Manufacturing",0,0,0,0,0
333922,"Conveyor and Conveying Equipment Manufacturing",0.000609955778518,-0.000115475300968,-0.159181629012,91017.9752633,66.0273490057
333923,"Overhead Traveling Crane, Hoist, and Monorail System Manufacturing",0.000611557052083,-0.00011069535476,-0.153264085673,124855.131681,90.1770299313
333924,"Industrial Truck, Tractor, Trailer, and Stacker Machinery Manufacturing",0.000612314174552,-0.000111076153464,-0.153549403637,109410.305826,79.1464540635
333991,"Power-Driven Handtool Manufacturing",0,0,0,0,0
333992,"Welding and Soldering Equipment Manufacturing",0.000612228736254,-0.000117601680134,-0.161135624788,86536.2377031,63.1568558337
333993,"Packaging Machinery Manufacturing",0.000611304230406,-0.000118030583743,-0.161833195747,91918.7790063,67.0396478024
333994,"Industrial Process Furnace and Oven Manufacturing",0,0,0,0,0
333995,"Fluid Power Cylinder and Actuator Manufacturing",0.000609546209116,-0.000118084569873,-0.162286386561,70246.4760897,51.11356079
333996,"Fluid Power Pump and Motor Manufacturing",0,0,0,0,0
333998,"All Other Miscellaneous General Purpose Machinery Manufacturing",0.000606962540508,-0.000117591246309,-0.162294709446,87839.9630614,63.6448559066
334111,"Electronic Computer Manufacturing",0,0,0,0,0
334112,"Computer Storage Device Manufacturing",0,0,0,0,0
334118,"Computer Terminal and Other Computer Peripheral Equipment Manufacturing",0.000603563800212,-0.000118440405387,-0.164043927263,206500.76613,149.094604414
334210,"Telephone Apparatus Manufacturing",0.000599363803051,-0.000118632322682,-0.16522696771,134429.824067,96.5202112091
334220,"Radio and Television Broadcasting and Wireless Communications Equipment Manufacturing",0,0,0,0,0
334290,"Other Communications Equipment Manufacturing",0.000594380212196,-0.000118530861455,-0.166263179007,78138.9851872,55.7062161266
334310,"Audio and Video Equipment Manufacturing",0.000588635179812,-0.000118191737204,-0.167214539173,83457.3670583,58.9899857892
334412,"Bare Printed Circuit Board Manufacturing",0,0,0,0,0
334413,"Semiconductor and Related Device Manufacturing",0,0,0,0,0
334416,"Capacitor, Resistor, Coil, Transformer, and Other Inductor Manufacturing",0,0,0,0,0
334417,"Electronic Connector Manufacturing",0.000582156024442,-0.0001180914551,-0.168642456489,74365.3505981,52.0742131711
334418,"Printed Circuit Assembly (Electronic Assembly) Manufacturing",0.000574975836431,-0.000117742691974,-0.169971910878,46476.9788091,32.195503841
334419,"Other Electronic Component Manufacturing",0.00056713404835,-0.000114489769939,-0.167966210786,130875.145028,102.224008214
334510,"Electromedical and Electrotherapeutic Apparatus Manufacturing",0.000558676902449,-0.000116723887303,-0.172821662447,152798.654821,104.699684883
334511,"Search, Detection, Navigation, Guidance, Aeronautical, and Nautical System and Instrument Manufacturing",0.000549657823001,-0.000114164531895,-0.171980547285,131415.984272,87.236975114
334512,"Automatic Environmental Control Manufacturing for Residential, Commercial, and Appliance Use",0,0,0,0,0
334513,"Instruments and Related Products Manufacturing for Measuring, Displaying, and Controlling Industrial Process Variables",0.000540137663855,-0.000115606233736,-0.176297841521,89033.1428068,58.3830116638
334514,"Totalizing Fluid Meter and Counting Device Manufacturing",0,0,0,0,0
334515,"Instrument Manufacturing for Measuring and Testing Electricity and Electrical Signals",0.000530184787251,-0.00011528948058,-0.17861204749,152476.325991,100.300884158
334516,"Analytical Laboratory Instrument Manufacturing",0.000519874865882,-0.000220900529184,-0.298201763524,101664.071866,75.3103353401
334517,"Irradiation Apparatus Manufacturing",0.000542385191342,-0.000279814147583,-0.340323975386,184458.973987,151.662232428
334519,"Other Measuring and Controlling Device Manufacturing",0.00065446785903,-0.000205977521703,-0.239384772486,102601.417836,93.2004789392
334610,"Manufacturing and Reproducing Magnetic and Optical Media",0,0,0,0,0
335131,"Residential Electric Lighting Fixture Manufacturing",0.000704898609954,-0.000158881443315,-0.183937383959,82676.9626041,72.5407901635
335132,"Commercial, Industrial, and Institutional Electric Lighting Fixture Manufacturing",0.000724153827118,-0.000144450848169,-0.166302176674,87542.8512901,76.056690143
335139,"Electric Lamp Bulb and Other Lighting Equipment Manufacturing",0,0,0,0,0
335210,"Small Electrical Appliance Manufacturing",0,0,0,0,0
335220,"Major Household Appliance Manufacturing",0,0,0,0,0
335311,"Power, Distribution, and Specialty Transformer Manufacturing",0,0,0,0,0
335312,"Motor and Generator Manufacturing",0.000727524648839,-0.000135729510989,-0.157230068855,89977.4617422,78.3465590797
335313,"Switchgear and Switchboard Apparatus Manufacturing",0.00072270782017,-0.00012957334928,-0.152031223879,83481.9955653,72.1937938448
335314,"Relay and Industrial Control Manufacturing",0.000713600260604,-0.000125582716559,-0.14964878933,130904.898192,109.853296884
335910,"Battery Manufacturing",0.000702195440101,-0.000122597954717,-0.148640805671,40471.7390001,33.3808639332
335921,"Fiber Optic Cable Manufacturing",0,0,0,0,0
335929,"Other Communication and Energy Wire Manufacturing",0,0,0,0,0
335931,"Current-Carrying Wiring Device Manufacturing",0,0,0,0,0
335932,"Noncurrent-Carrying Wiring Device Manufacturing",0.000689530604978,-0.000114206756478,-0.142094621894,62932.1134755,50.5809528543
335991,"Carbon and Graphite Product Manufacturing",0.000676159391736,-0.000118251873768,-0.14885472916,91427.4193822,72.631060988
335999,"All Other Miscellaneous Electrical Equipment and Component Manufacturing",0.000662387229196,-0.000114242540186,-0.147100387714,145591.225859,120.737639157
336110,"Automobile and Light Duty Motor Vehicle Manufacturing",0,0,0,0,0
336120,"Heavy Duty Truck Manufacturing",0.000648388187042,-0.000114168671941,-0.149718241461,73811.2183429,56.5947759072
336211,"Motor Vehicle Body Manufacturing",0.000634262765561,-0.000112507649897,-0.150658954303,67244.5850882,50.9554821897
336212,"Truck Trailer Manufacturing",0,0,0,0,0
336213,"Motor Home Manufacturing",0,0,0,0,0
336214,"Travel Trailer and Camper Manufacturing",0.000620066352155,-0.00011063877653,-0.151413712846,31647.9581461,23.1253536844
336310,"Motor Vehicle Gasoline Engine and Engine Parts Manufacturing",0.000605823402805,-0.000121399977133,-0.166936295617,57520.2874981,41.8301491784
336320,"Motor Vehicle Electrical and Electronic Equipment Manufacturing",0.000616025922744,-0.000130815649195,-0.17515849962,65589.715469,48.9851862658
336330,"Motor Vehicle Steering and Suspension Components (except Spring) Manufacturing",0,0,0,0,0
336340,"Motor Vehicle Brake System Manufacturing",0,0,0,0,0
336350,"Motor Vehicle Transmission and Power Train Parts Manufacturing",0,0,0,0,0
336360,"Motor Vehicle Seating and Interior Trim Manufacturing",0,0,0,0,0
336370,"Motor Vehicle Metal Stamping",0,0,0,0,0
336390,"Other Motor Vehicle Parts Manufacturing",0.0006352637595,-0.000129872639558,-0.169737892117,47340.3767451,36.2218898053
336411,"Aircraft Manufacturing",0.000653420744384,-0.000128998707097,-0.164871549209,168724.913818,132.026395767
336412,"Aircraft Engine and Engine Parts Manufacturing",0.0006703923188,-0.000127828845929,-0.160142140521,72100.8684629,58.0117939886
336413,"Other Aircraft Parts and Auxiliary Equipment Manufacturing",0.000686083093137,-0.000126409795755,-0.155582648763,103846.46455,84.4078002939
336414,"Guided Missile and Space Vehicle Manufacturing",0,0,0,0,0
336415,"Guided Missile and Space Vehicle Propulsion Unit and Propulsion Unit Parts Manufacturing",0,0,0,0,0
336419,"Other Guided Missile and Space Vehicle Parts and Auxiliary Equipment Manufacturing",0,0,0,0,0
336510,"Railroad Rolling Stock Manufacturing",0,0,0,0,0
336611,"Ship Building and Repairing",0,0,0,0,0
336612,"Boat Building",0,0,0,0,0
336991,"Motorcycle, Bicycle, and Parts Manufacturing",0,0,0,0,0
336992,"Military Armored Vehicle, Tank, and Tank Component Manufacturing",0,0,0,0,0
336999,"All Other Transportation Equipment Manufacturing",0.000700409426152,-0.000123670082966,-0.150070571586,57020.8236385,46.9897499688
337110,"Wood Kitchen Cabinet and Countertop Manufacturing",0.000713301741567,-0.000122948890538,-0.147023973217,60217.0437748,50.3566026637
337121,"Upholstered Household Furniture Manufacturing",0.00072470660873,-0.00012047497402,-0.142543302503,46959.1155356,39.6890282566
337122,"Nonupholstered Wood Household Furniture Manufacturing",0.000734588317291,-0.000118623541459,-0.139031754238,59910.7797937,51.4190677181
337126,"Household Furniture (except Wood and Upholstered) Manufacturing",0,0,0,0,0
337127,"Institutional Furniture Manufacturing",0.000742929900718,-0.000116031225582,-0.135083209273,50671.0343623,43.5245021131
337211,"Wood Office Furniture Manufacturing",0.000749733316154,-0.000113748237743,-0.131732099232,55130.5824469,47.6042993673
337212,"Custom Architectural Woodwork and Millwork Manufacturing",0.000755018724465,-0.000103349105386,-0.120401885756,41989.8493983,36.0500063107
337214,"Office Furniture (except Wood) Manufacturing",0,0,0,0,0
337215,"Showcase, Partition, Shelving, and Locker Manufacturing",0.000758822827634,-0.000108544908394,-0.125142893707,57244.0022774,49.6516615357
337910,"Mattress Manufacturing",0,0,0,0,0
337920,"Blind and Shade Manufacturing",0,0,0,0,0
339112,"Surgical and Medical Instrument Manufacturing",0.000761196276966,-9.05624824535E-5,-0.106324098757,141951.128804,122.218498198
339113,"Surgical Appliance and Supplies Manufacturing",0.000762200351192,-0.000103028856221,-0.119076951331,66437.5842442,57.8816676173
339114,"Dental Equipment and Supplies Manufacturing",0,0,0,0,0
339115,"Ophthalmic Goods Manufacturing",0,0,0,0,0
339116,"Dental Laboratories",0.000761903150592,-0.000100185210247,-0.116212229277,59088.1912347,50.9581799064
339910,"Jewelry and Silverware Manufacturing",0.000760375642222,-9.00314087397E-5,-0.105868605673,34224.7199961,29.1049788882
339920,"Sporting and Athletic Goods Manufacturing",0.000757687923636,-9.41594681801E-5,-0.110535606594,65948.3536693,58.4240600299
339930,"Doll, Toy, and Game Manufacturing",0.000753906058527,-9.09827079563E-5,-0.107686019232,78952.939521,66.8360534759
339940,"Office Supplies (except Paper) Manufacturing",0.000749089804126,-8.14584571355E-5,-0.0980779334988,44735.0623345,37.1546737956
339950,"Sign Manufacturing",0.000743291362131,-8.48195202496E-5,-0.102425317737,68319.7717097,56.5845541315
339991,"Gasket, Packing, and Sealing Device Manufacturing",0.000736555284268,-8.06567961404E-5,-0.0986975083629,61926.4610902,50.6071141505
339992,"Musical Instrument Manufacturing",0.000728919413318,-7.81732294361E-5,-0.0968578144504,55123.1980749,44.9446915796
339993,"Fastener, Button, Needle, and Pin Manufacturing",0.00072041670177,-6.35582359218E-5,-0.0810717701116,37173.7795628,29.1433472499
339994,"Broom, Brush, and Mop Manufacturing",0,0,0,0,0
339995,"Burial Casket Manufacturing",0,0,0,0,0
339999,"All Other Miscellaneous Manufacturing",0.000711077563411,-7.12246846965E-5,-0.0910449699829,47503.2550571,37.2340325098
423110,"Automobile and Other Motor Vehicle Merchant Wholesalers",0,0,0,0,0
423120,"Motor Vehicle Supplies and New Parts Merchant Wholesalers",0,0,0,0,0
423130,"Tire and Tube Merchant Wholesalers",0,0,0,0,0
423140,"Motor Vehicle Parts (Used) Merchant Wholesalers",0,0,0,0,0
423210,"Furniture Merchant Wholesalers",0,0,0,0,0
423220,"Home Furnishing Merchant Wholesalers",0,0,0,0,0
423310,"Lumber, Plywood, Millwork, and Wood Panel Merchant Wholesalers",0,0,0,0,0
423320,"Brick, Stone, and Related Construction Material Merchant Wholesalers",0,0,0,0,0
423330,"Roofing, Siding, and Insulation Material Merchant Wholesalers",0,0,0,0,0
423390,"Other Construction Material Merchant Wholesalers",0,0,0,0,0
423410,"Photographic Equipment and Supplies Merchant Wholesalers",0,0,0,0,0
423420,"Office Equipment Merchant Wholesalers",0,0,0,0,0
423430,"Computer and Computer Peripheral Equipment and Software Merchant Wholesalers",0,0,0,0,0
423440,"Other Commercial Equipment Merchant Wholesalers",0,0,0,0,0
423450,"Medical, Dental, and Hospital Equipment and Supplies Merchant Wholesalers",0,0,0,0,0
423460,"Ophthalmic Goods Merchant Wholesalers",0,0,0,0,0
423490,"Other Professional Equipment and Supplies Merchant Wholesalers",0,0,0,0,0
423510,"Metal Service Centers and Other Metal Merchant Wholesalers",0,0,0,0,0
423520,"Coal and Other Mineral and Ore Merchant Wholesalers",0,0,0,0,0
423610,"Electrical Apparatus and Equipment, Wiring Supplies, and Related Equipment Merchant Wholesalers",0,0,0,0,0
423620,"Household Appliances, Electric Housewares, and Consumer Electronics Merchant Wholesalers",0,0,0,0,0
423690,"Other Electronic Parts and Equipment Merchant Wholesalers",0,0,0,0,0
423710,"Hardware Merchant Wholesalers",0,0,0,0,0
423720,"Plumbing and Heating Equipment and Supplies (Hydronics) Merchant Wholesalers",0,0,0,0,0
423730,"Warm Air Heating and Air-Conditioning Equipment and Supplies Merchant Wholesalers",0,0,0,0,0
423740,"Refrigeration Equipment and Supplies Merchant Wholesalers",0,0,0,0,0
423810,"Construction and Mining (except Oil Well) Machinery and Equipment Merchant Wholesalers",0,0,0,0,0
423820,"Farm and Garden Machinery and Equipment Merchant Wholesalers",0,0,0,0,0
423830,"Industrial Machinery and Equipment Merchant Wholesalers",0,0,0,0,0
423840,"Industrial Supplies Merchant Wholesalers",0,0,0,0,0
423850,"Service Establishment Equipment and Supplies Merchant Wholesalers",0,0,0,0,0
423860,"Transportation Equipment and Supplies (except Motor Vehicle) Merchant Wholesalers",0,0,0,0,0
423910,"Sporting and Recreational Goods and Supplies Merchant Wholesalers",0,0,0,0,0
423920,"Toy and Hobby Goods and Supplies Merchant Wholesalers",0,0,0,0,0
423930,"Recyclable Material Merchant Wholesalers",0,0,0,0,0
423940,"Jewelry, Watch, Precious Stone, and Precious Metal Merchant Wholesalers",0,0,0,0,0
423990,"Other Miscellaneous Durable Goods Merchant Wholesalers",0,0,0,0,0
424110,"Printing and Writing Paper Merchant Wholesalers",0,0,0,0,0
424120,"Stationery and Office Supplies Merchant Wholesalers",0,0,0,0,0
424130,"Industrial and Personal Service Paper Merchant Wholesalers",0,0,0,0,0
424210,"Drugs and Druggists' Sundries Merchant Wholesalers",0,0,0,0,0
424310,"Piece Goods, Notions, and Other Dry Goods Merchant Wholesalers",0,0,0,0,0
424340,"Footwear Merchant Wholesalers",0,0,0,0,0
424350,"Clothing and Clothing Accessories Merchant Wholesalers",0,0,0,0,0
424410,"General Line Grocery Merchant Wholesalers",0,0,0,0,0
424420,"Packaged Frozen Food Merchant Wholesalers",0,0,0,0,0
424430,"Dairy Product (except Dried or Canned) Merchant Wholesalers",0,0,0,0,0
424440,"Poultry and Poultry Product Merchant Wholesalers",0,0,0,0,0
424450,"Confectionery Merchant Wholesalers",0,0,0,0,0
424460,"Fish and Seafood Merchant Wholesalers",0,0,0,0,0
424470,"Meat and Meat Product Merchant Wholesalers",0,0,0,0,0
424480,"Fresh Fruit and Vegetable Merchant Wholesalers",0,0,0,0,0
424490,"Other Grocery and Related Products Merchant Wholesalers",0,0,0,0,0
424510,"Grain and Field Bean Merchant Wholesalers",0,0,0,0,0
424520,"Livestock Merchant Wholesalers",0,0,0,0,0
424590,"Other Farm Product Raw Material Merchant Wholesalers",0,0,0,0,0
424610,"Plastics Materials and Basic Forms and Shapes Merchant Wholesalers",0,0,0,0,0
424690,"Other Chemical and Allied Products Merchant Wholesalers",0,0,0,0,0
424710,"Petroleum Bulk Stations and Terminals",0,0,0,0,0
424720,"Petroleum and Petroleum Products Merchant Wholesalers (except Bulk Stations and Terminals)",0,0,0,0,0
424810,"Beer and Ale Merchant Wholesalers",0,0,0,0,0
424820,"Wine and Distilled Alcoholic Beverage Merchant Wholesalers",0,0,0,0,0
424910,"Farm Supplies Merchant Wholesalers",0,0,0,0,0
424920,"Book, Periodical, and Newspaper Merchant Wholesalers",0,0,0,0,0
424930,"Flower, Nursery Stock, and Florists' Supplies Merchant Wholesalers",0,0,0,0,0
424940,"Tobacco and Tobacco Product Merchant Wholesalers",0,0,0,0,0
424950,"Paint, Varnish, and Supplies Merchant Wholesalers",0,0,0,0,0
424990,"Other Miscellaneous Nondurable Goods Merchant Wholesalers",0,0,0,0,0
425120,"Wholesale Trade Agents and Brokers",0,0,0,0,0
441110,"New Car Dealers",0,0,0,0,0
441120,"Used Car Dealers",0,0,0,0,0
441210,"Recreational Vehicle Dealers",0,0,0,0,0
441222,"Boat Dealers",0,0,0,0,0
441227,"Motorcycle, ATV, and All Other Motor Vehicle Dealers",0,0,0,0,0
441330,"Automotive Parts and Accessories Retailers",0,0,0,0,0
441340,"Tire Dealers",0,0,0,0,0
444110,"Home Centers",0,0,0,0,0
444120,"Paint and Wallpaper Stores",0,0,0,0,0
444140,"Hardware Retailers",0,0,0,0,0
444180,"Other Building Material Dealers",0,0,0,0,0
444230,"Outdoor Power Equipment Retailers",0,0,0,0,0
444240,"Nursery, Garden Center, and Farm Supply Retailers",0,0,0,0,0
445110,"Supermarkets and Other Grocery (except Convenience) Stores",0,0,0,0,0
445131,"Convenience Retailers",0,0,0,0,0
445132,"Vending Machine Operators",0,0,0,0,0
445230,"Fruit and Vegetable Markets",0,0,0,0,0
445240,"Meat Retailers",0,0,0,0,0
445250,"Fish and Seafood Retailers",0,0,0,0,0
445291,"Baked Goods Stores",0,0,0,0,0
445292,"Confectionery and Nut Stores",0,0,0,0,0
445298,"All Other Specialty Food Retailers",0,0,0,0,0
445320,"Beer, Wine, and Liquor Retailers",0,0,0,0,0
449110,"Furniture Retailers",0,0,0,0,0
449121,"Floor Covering Retailers",0,0,0,0,0
449122,"Window Treatment Retailers",0,0,0,0,0
449129,"All Other Home Furnishings Retailers",0,0,0,0,0
449210,"Electronics and Appliance Retailers",0,0,0,0,0
455110,"Department Stores",0,0,0,0,0
455211,"Warehouse Clubs and Supercenters",0,0,0,0,0
455219,"All Other General Merchandise Retailers",0,0,0,0,0
456110,"Pharmacies and Drug Retailers",0,0,0,0,0
456120,"Cosmetics, Beauty Supplies, and Perfume Retailers",0,0,0,0,0
456130,"Optical Goods Retailers",0,0,0,0,0
456191,"Food (Health) Supplement Retailers",0,0,0,0,0
456199,"All Other Health and Personal Care Retailers",0,0,0,0,0
457110,"Gasoline Stations with Convenience Stores",0,0,0,0,0
457120,"Other Gasoline Stations",0,0,0,0,0
457210,"Fuel Dealers",0,0,0,0,0
458110,"Clothing and Clothing Accessories Retailers",0,0,0,0,0
458210,"Shoe Retailers",0,0,0,0,0
458310,"Jewelry Retailers",0,0,0,0,0
458320,"Luggage and Leather Goods Retailers",0,0,0,0,0
459110,"Sporting Goods Retailers",0,0,0,0,0
459120,"Hobby, Toy, and Game Retailers",0,0,0,0,0
459130,"Sewing, Needlework, and Piece Goods Retailers",0,0,0,0,0
459140,"Musical Instrument and Supplies Retailers",0,0,0,0,0
459210,"Book Retailers and News Dealers",0,0,0,0,0
459310,Florists,0,0,0,0,0
459410,"Office Supplies and Stationery Retailers",0,0,0,0,0
459420,"Gift, Novelty, and Souvenir Retailers",0,0,0,0,0
459510,"Used Merchandise Retailers",0,0,0,0,0
459910,"Pet and Pet Supplies Retailers",0,0,0,0,0
459920,"Art Dealers",0,0,0,0,0
459930,"Manufactured (Mobile) Home Dealers",0,0,0,0,0
459991,"Tobacco, Electronic Cigarette, and Other Smoking Supplies Retailers",0,0,0,0,0
459999,"All Other Miscellaneous Retailers",0,0,0,0,0
481111,"Scheduled Passenger Air Transportation",5.77115573411E-5,5.85880411975E-7,0.0102559907115,67698.8109378,3.86734537319
481112,"Scheduled Freight Air Transportation",0,0,0,0,0
481211,"Nonscheduled Chartered Passenger Air Transportation",2.0339330472E-5,8.0413689531E-7,0.0411634976716,107157.788056,2.44262446249
481212,"Nonscheduled Chartered Freight Air Transportation",1.13435198092E-5,1.13435198092E-5,,0,0
481219,"Other Nonscheduled Air Transportation",0,0,0,0,0
482110,"Rail transportation",1.05945898438,0.0214017832477,0.0206171521419,82278.4099961,85409.6959941
483111,"Deep Sea Freight Transportation",0,0,0,0,0
483112,"Deep Sea Passenger Transportation",0,0,0,0,0
483113,"Coastal and Great Lakes Freight Transportation",0,0,0,0,0
483114,"Coastal and Great Lakes Passenger Transportation",0,0,0,0,0
483211,"Inland Water Freight Transportation",0,0,0,0,0
483212,"Inland Water Passenger Transportation",0,0,0,0,0
484110,"General Freight Trucking, Local",0,0,0,0,0
484121,"General Freight Trucking, Long-Distance, Truckload",0,-1.05738160334E-5,-1,90821.4271664,0.968182011625
484122,"General Freight Trucking, Long-Distance, Less Than Truckload",0,-1.03619566852E-5,-1,93995.5513514,0.975948586089
484210,"Used Household and Office Goods Moving",0,0,0,0,0
484220,"Specialized Freight (except Used Goods) Trucking, Local",0,0,0,0,0
484230,"Specialized Freight (except Used Goods) Trucking, Long-Distance",0,0,0,0,0
485111,"Mixed Mode Transit Systems",0,0,0,0,0
485112,"Commuter Rail Systems",0,0,0,0,0
485113,"Bus and Other Motor Vehicle Transit Systems",0,0,0,0,0
485119,"Other Urban Transit Systems",0,0,0,0,0
485210,"Interurban and Rural Bus Transportation",0,0,0,0,0
485310,"Taxi Service",0,0,0,0,0
485320,"Limousine Service",0,0,0,0,0
485410,"School and Employee Bus Transportation",0,0,0,0,0
485510,"Charter Bus Industry",0,0,0,0,0
485991,"Special Needs Transportation",0,0,0,0,0
485999,"All Other Transit and Ground Passenger Transportation",0,0,0,0,0
486110,"Pipeline Transportation of Crude Oil",0,0,0,0,0
486210,"Pipeline Transportation of Natural Gas",0,0,0,0,0
486910,"Pipeline Transportation of Refined Petroleum Products",0,0,0,0,0
486990,"All Other Pipeline Transportation",0,0,0,0,0
487110,"Scenic and Sightseeing Transportation, Land",0.00179946633062,0.000100075269974,0.0588888998484,36079.856713,116.927957121
487210,"Scenic and Sightseeing Transportation, Water",0.000622185746682,-1.40164696531E-5,-0.022031469387,38263.7574891,89.8388142079
487990,"Scenic and Sightseeing Transportation, Other",0,0,0,0,0
488111,"Air Traffic Control",0,0,0,0,0
488119,"Other Airport Operations",0,0,0,0,0
488190,"Other Support Activities for Air Transportation",0,0,0,0,0
488210,"Support Activities for Rail Transportation",0,0,0,0,0
488310,"Port and Harbor Operations",0,0,0,0,0
488320,"Marine Cargo Handling",0,0,0,0,0
488330,"Navigational Services to Shipping",0,0,0,0,0
488390,"Other Support Activities for Water Transportation",0,0,0,0,0
488410,"Motor Vehicle Towing",0,0,0,0,0
488490,"Other Support Activities for Road Transportation",0,0,0,0,0
488510,"Freight Transportation Arrangement",0,0,0,0,0
488991,"Packing and Crating",0,0,0,0,0
488999,"All Other Support Activities for Transportation",0,0,0,0,0
491110,"Postal Service",0.251025929095,0.0170810661054,0.0730132129733,39239.8111424,9179.95224143
492110,"Couriers and Express Delivery Services",0,0,0,0,0
492210,"Local Messengers and Local Delivery",0,0,0,0,0
493110,"General Warehousing and Storage",0,0,0,0,0
493120,"Refrigerated Warehousing and Storage",0,0,0,0,0
493130,"Farm Product Warehousing and Storage",0,0,0,0,0
493190,"Other Warehousing and Storage",0,0,0,0,0
512110,"Motion Picture and Video Production",0,0,0,0,0
512120,"Motion Picture and Video Distribution",0,0,0,0,0
512131,"Motion Picture Theaters (except Drive-Ins)",0,0,0,0,0
512132,"Drive-In Motion Picture Theaters",0,0,0,0,0
512191,"Teleproduction and Other Postproduction Services",0,0,0,0,0
512199,"Other Motion Picture and Video Industries",0,0,0,0,0
512230,"Music Publishers",0,0,0,0,0
512240,"Sound Recording Studios",0,0,0,0,0
512250,"Record Production and Distribution",0,0,0,0,0
512290,"Other Sound Recording Industries",0,0,0,0,0
513110,"Newspaper Publishers",0,0,0,0,0
513120,"Periodical Publishers",0,0,0,0,0
513130,"Book Publishers",0,0,0,0,0
513140,"Directory and Mailing List Publishers",0,0,0,0,0
513191,"Greeting Card Publishers",0,0,0,0,0
513199,"All Other Publishers",0,0,0,0,0
513210,"Software Publishers",0,0,0,0,0
