NAICS,Description,"2023 Jobs","2022 - 2023 Change","2022 - 2023 % Change","Avg. Earnings Per Job","2022 GRP Earnings"
111000,"Crop Production",19.9540291382,0.18561304071,0.00938937342248,20067.8614755,3904263.13399
112000,"Animal Production",5.35162476229,-0.262328800669,-0.0467279961843,138629.254769,1182686.58368
113110,"Timber Tract Operations",0.493065809558,-0.0261439740335,-0.0503533925202,30986.2334505,16088.3555642
113210,"Forest Nurseries and Gathering of Forest Products",0,0,0,0,20365.6972861
113310,Logging,18.9190633395,-0.728132498247,-0.0370603776874,59643.6346499,1198506.63919
114111,"Finfish Fishing",0.546580205042,-0.0397062400875,-0.0677249839518,69001.8875553,65129.7692087
114112,"Shellfish Fishing",0.470703370765,-0.018048588829,-0.0369279109265,69001.8875553,55680.037918
114119,"Other Marine Fishing",0,0,0,0,0
114210,"Hunting and Trapping",0,0,0,0,0
115111,"Cotton Ginning",0,0,0,0,0
115112,"Soil Preparation, Planting, and Cultivating",0.607410585824,0.00305373980928,0.0050528753491,60989.2660144,40483.9355138
115113,"Crop Harvesting, Primarily by Machine",0,0,0,0,654.756616693
115114,"Postharvest Crop Activities (except Cotton Ginning)",0,0,0,0,743.840481036
115115,"Farm Labor Contractors and Crew Leaders",0,0,0,0,848.877271633
115116,"Farm Management Services",0,0,0,0,0
115210,"Support Activities for Animal Production",7.04164349666,0.877757497651,0.142403266023,100664.834977,782570.259001
115310,"Support Activities for Forestry",2.07506482019,-0.45442812356,-0.179651864491,177700.952048,874089.869538
211120,"Crude Petroleum Extraction",0,0,0,0,0
211130,"Natural Gas Extraction",0,0,0,0,0
212114,"Surface Coal Mining",0,0,0,0,0
212115,"Underground Coal Mining",0,0,0,0,0
212210,"Iron Ore Mining",0,0,0,0,0
212220,"Gold Ore and Silver Ore Mining",0,0,0,0,0
212230,"Copper, Nickel, Lead, and Zinc Mining",0.0203562425376,-0.00210019880055,-0.0935232243133,165781.928624,3722.87215507
212290,"Other Metal Ore Mining",0,0,0,0,0
212311,"Dimension Stone Mining and Quarrying",0,0,0,0,0
212312,"Crushed and Broken Limestone Mining and Quarrying",0,0,0,0,0
212313,"Crushed and Broken Granite Mining and Quarrying",0,0,0,0,0
212319,"Other Crushed and Broken Stone Mining and Quarrying",0.0204568060335,-0.00203933029822,-0.0906524688575,96043.5991205,2160.6098996
212321,"Construction Sand and Gravel Mining",0,0,0,0,0
212322,"Industrial Sand Mining",0,0,0,0,0
212323,"Kaolin, Clay, and Ceramic and Refractory Minerals Mining",0,0,0,0,0
212390,"Other Nonmetallic Mineral Mining and Quarrying",0,0,0,0,0
213111,"Drilling Oil and Gas Wells",0,0,0,0,0
213112,"Support Activities for Oil and Gas Operations",0,0,0,0,0
213113,"Support Activities for Coal Mining",0,0,0,0,0
213114,"Support Activities for Metal Mining",0,0,0,0,0
213115,"Support Activities for Nonmetallic Minerals (except Fuels) Mining",0,0,0,0,0
221111,"Hydroelectric Power Generation",0,0,0,0,0
221112,"Fossil Fuel Electric Power Generation",0,0,0,0,0
221113,"Nuclear Electric Power Generation",0,0,0,0,0
221114,"Solar Electric Power Generation",0,0,0,0,0
221115,"Wind Electric Power Generation",0,0,0,0,0
221116,"Geothermal Electric Power Generation",0,0,0,0,0
221117,"Biomass Electric Power Generation",0,0,0,0,0
221118,"Other Electric Power Generation",0,0,0,0,0
221121,"Electric Bulk Power Transmission and Control",0,0,0,0,0
221122,"Electric Power Distribution",0,0,0,0,85204.1477548
221210,"Natural Gas Distribution",0,0,0,0,0
221310,"Water Supply and Irrigation Systems",0,0,0,0,31786.5901933
221320,"Sewage Treatment Facilities",0,0,0,0,0
221330,"Steam and Air-Conditioning Supply",0,0,0,0,0
236115,"New Single-Family Housing Construction (except For-Sale Builders)",28.1034005382,0.373436312258,0.0134668876316,45011.0693378,1406064.19409
236116,"New Multifamily Housing Construction (except For-Sale Builders)",0,0,0,0,0
236117,"New Housing For-Sale Builders",0.924671673581,-0.00497266714335,-0.00534899953188,49267.4261186,45801.1838732
236118,"Residential Remodelers",38.2323023675,2.17167754344,0.0602229593646,45877.3421796,1981406.4586
236210,"Industrial Building Construction",0,0,0,0,0
236220,"Commercial and Institutional Building Construction",11.1001086059,0.0235203772298,0.00212343157877,75052.9109057,854391.8906
237110,"Water and Sewer Line and Related Structures Construction",10.1578886731,1.56725317919,0.182437397128,79528.6598213,698352.680695
237120,"Oil and Gas Pipeline and Related Structures Construction",0,0,0,0,0
237130,"Power and Communication Line and Related Structures Construction",0,0,0,0,0
237210,"Land Subdivision",1.46416183581,-0.104610173459,-0.0666828403625,72372.1456547,230738.46812
237310,"Highway, Street, and Bridge Construction",0.191665617477,-0.0591984658273,-0.235978243866,100357.723944,31195.2209101
237990,"Other Heavy and Civil Engineering Construction",0,0,0,0,75439.1884574
238110,"Poured Concrete Foundation and Structure Contractors",7.5743588369,0.401225838198,0.0559345321314,46349.9536278,365164.884865
238120,"Structural Steel and Precast Concrete Contractors",0,0,0,0,0
238130,"Framing Contractors",2.79046731256,0.27221098023,0.108095024615,42427.8460309,160659.522838
238140,"Masonry Contractors",2.27263927929,0.257321640252,0.127682919688,45196.9096061,137121.214368
238150,"Glass and Glazing Contractors",0,0,0,0,0
238160,"Roofing Contractors",1.41979561391,-0.231364612455,-0.140122447695,41264.7945262,114365.980879
238170,"Siding Contractors",0,0,0,0,61358.3437306
238190,"Other Foundation, Structure, and Building Exterior Contractors",0,0,0,0,0
238210,"Electrical Contractors and Other Wiring Installation Contractors",14.3393024291,-0.233937805283,-0.0160525594528,49351.2718614,872491.397225
238220,"Plumbing, Heating, and Air-Conditioning Contractors",4.81562073499,-0.368914135901,-0.0711566505171,51048.6855414,265164.765172
238290,"Other Building Equipment Contractors",3.62083518753,0.572426516626,0.187778798194,58956.3220219,180106.407168
238310,"Drywall and Insulation Contractors",18.8310205023,-0.885877473071,-0.0449298603755,39114.2417513,1123792.5475
238320,"Painting and Wall Covering Contractors",11.9938478536,0.98649075263,0.0896210365108,36440.1839689,642650.863024
238330,"Flooring Contractors",2.32551879796,-0.0272534203764,-0.0115835354413,44235.9581716,201149.42518
238340,"Tile and Terrazzo Contractors",0.936744331651,0.00591386197249,0.00635331799413,49267.4261186,97120.5953202
238350,"Finish Carpentry Contractors",6.42801052372,0.0535611700768,0.00840247794049,45945.9253965,547520.310504
238390,"Other Building Finishing Contractors",0,0,0,0,0
238910,"Site Preparation Contractors",40.8541951039,1.52016074587,0.0386474657552,59701.4246238,3036690.53847
238990,"All Other Specialty Trade Contractors",10.9917111802,0.240771470761,0.0223953884282,48599.5195927,697950.415447
311111,"Dog and Cat Food Manufacturing",0,0,0,0,0
311119,"Other Animal Food Manufacturing",0,0,0,0,0
311211,"Flour Milling",0,0,0,0,0
311212,"Rice Milling",0,0,0,0,0
311213,"Malt Manufacturing",0,0,0,0,0
311221,"Wet Corn Milling",0,0,0,0,0
311224,"Soybean and Other Oilseed Processing",0,0,0,0,0
311225,"Fats and Oils Refining and Blending",0,0,0,0,0
311230,"Breakfast Cereal Manufacturing",0,0,0,0,0
311313,"Beet Sugar Manufacturing",0,0,0,0,0
311314,"Cane Sugar Manufacturing",0,0,0,0,0
311340,"Nonchocolate Confectionery Manufacturing",0,0,0,0,0
311351,"Chocolate and Confectionery Manufacturing from Cacao Beans",0,0,0,0,0
311352,"Confectionery Manufacturing from Purchased Chocolate",0,0,0,0,0
311411,"Frozen Fruit, Juice, and Vegetable Manufacturing",0,0,0,0,0
311412,"Frozen Specialty Food Manufacturing",0,0,0,0,0
311421,"Fruit and Vegetable Canning",0,0,0,0,0
311422,"Specialty Canning",0,0,0,0,0
311423,"Dried and Dehydrated Food Manufacturing",0,0,0,0,0
311511,"Fluid Milk Manufacturing",0,0,0,0,0
311512,"Creamery Butter Manufacturing",0,0,0,0,0
311513,"Cheese Manufacturing",0,0,0,0,0
311514,"Dry, Condensed, and Evaporated Dairy Product Manufacturing",0,0,0,0,0
311520,"Ice Cream and Frozen Dessert Manufacturing",0,0,0,0,0
311611,"Animal (except Poultry) Slaughtering",0,0,0,0,0
311612,"Meat Processed from Carcasses",0,0,0,0,0
311613,"Rendering and Meat Byproduct Processing",0,0,0,0,0
311615,"Poultry Processing",0,0,0,0,0
311710,"Seafood Product Preparation and Packaging",0,0,0,0,0
311811,"Retail Bakeries",8.0979305391,1.89997766635,0.306549227682,77792.5071397,484627.225082
311812,"Commercial Bakeries",0,0,0,0,0
311813,"Frozen Cakes, Pies, and Other Pastries Manufacturing",0,0,0,0,0
311821,"Cookie and Cracker Manufacturing",0,0,0,0,0
311824,"Dry Pasta, Dough, and Flour Mixes Manufacturing from Purchased Flour",0,0,0,0,0
311830,"Tortilla Manufacturing",0,0,0,0,0
311911,"Roasted Nuts and Peanut Butter Manufacturing",0,0,0,0,0
311919,"Other Snack Food Manufacturing",0,0,0,0,0
311920,"Coffee and Tea Manufacturing",0,0,0,0,0
311930,"Flavoring Syrup and Concentrate Manufacturing",0,0,0,0,0
311941,"Mayonnaise, Dressing, and Other Prepared Sauce Manufacturing",0,0,0,0,0
311942,"Spice and Extract Manufacturing",0,0,0,0,0
311991,"Perishable Prepared Food Manufacturing",0,0,0,0,0
311999,"All Other Miscellaneous Food Manufacturing",0,0,0,0,0
312111,"Soft Drink Manufacturing",0,0,0,0,0
312112,"Bottled Water Manufacturing",0,0,0,0,0
312113,"Ice Manufacturing",0,0,0,0,0
312120,Breweries,0,0,0,0,40536.7269914
312130,Wineries,0,0,0,0,91088.1953006
312140,Distilleries,0,0,0,0,0
312230,"Tobacco Manufacturing",0,0,0,0,0
313110,"Fiber, Yarn, and Thread Mills",0,0,0,0,0
313210,"Broadwoven Fabric Mills",0,0,0,0,0
313220,"Narrow Fabric Mills and Schiffli Machine Embroidery",0,0,0,0,0
313230,"Nonwoven Fabric Mills",0,0,0,0,0
313240,"Knit Fabric Mills",0,0,0,0,0
313310,"Textile and Fabric Finishing Mills",0,0,0,0,0
313320,"Fabric Coating Mills",0,0,0,0,0
314110,"Carpet and Rug Mills",0,0,0,0,0
314120,"Curtain and Linen Mills",0,0,0,0,0
314910,"Textile Bag and Canvas Mills",0,0,0,0,0
314994,"Rope, Cordage, Twine, Tire Cord, and Tire Fabric Mills",0,0,0,0,0
314999,"All Other Miscellaneous Textile Product Mills",0,0,0,0,0
315120,"Apparel Knitting Mills",0,0,0,0,0
315210,"Cut and Sew Apparel Contractors",0,0,0,0,0
315250,"Cut and Sew Apparel Manufacturing (except Contractors)",0,0,0,0,0
315990,"Apparel Accessories and Other Apparel Manufacturing",0,0,0,0,0
316110,"Leather and Hide Tanning and Finishing",0,0,0,0,0
316210,"Footwear Manufacturing",0,0,0,0,0
316990,"Other Leather and Allied Product Manufacturing",0,0,0,0,3800.44507903
321113,Sawmills,3.97671466193,-0.918748276581,-0.187673420905,96012.6432731,548715.059056
321114,"Wood Preservation",0,0,0,0,0
321211,"Hardwood Veneer and Plywood Manufacturing",0,0,0,0,0
321212,"Softwood Veneer and Plywood Manufacturing",0,0,0,0,0
321215,"Engineered Wood Member Manufacturing",0,0,0,0,0
321219,"Reconstituted Wood Product Manufacturing",0,0,0,0,0
321911,"Wood Window and Door Manufacturing",0,0,0,0,0
321912,"Cut Stock, Resawing Lumber, and Planing",0,0,0,0,32566.0205002
321918,"Other Millwork (including Flooring)",0,0,0,0,0
321920,"Wood Container and Pallet Manufacturing",0,0,0,0,0
321991,"Manufactured Home (Mobile Home) Manufacturing",0,0,0,0,0
321992,"Prefabricated Wood Building Manufacturing",0,0,0,0,0
321999,"All Other Miscellaneous Wood Product Manufacturing",0.964963593839,-0.00185105711464,-0.00191459357056,38225.7628165,36957.2275349
322110,"Pulp Mills",0,0,0,0,0
322120,"Paper Mills",0.613338425766,0.0319502069852,0.0549550299663,141408.012417,82234.3902942
322130,"Paperboard Mills",0,0,0,0,0
322211,"Corrugated and Solid Fiber Box Manufacturing",0,0,0,0,0
322212,"Folding Paperboard Box Manufacturing",0,0,0,0,0
322219,"Other Paperboard Container Manufacturing",0,0,0,0,0
322220,"Paper Bag and Coated and Treated Paper Manufacturing",0,0,0,0,0
322230,"Stationery Product Manufacturing",0,0,0,0,0
322291,"Sanitary Paper Product Manufacturing",0,0,0,0,0
322299,"All Other Converted Paper Product Manufacturing",0,0,0,0,0
323111,"Commercial Printing (except Screen and Books)",0.0784503756168,-0.0111913137195,-0.124844966693,86572.6765776,51801.6503257
323113,"Commercial Screen Printing",0,0,0,0,7601.13498568
323117,"Books Printing",0,0,0,0,0
323120,"Support Activities for Printing",0,0,0,0,0
324110,"Petroleum Refineries",0,0,0,0,0
324121,"Asphalt Paving Mixture and Block Manufacturing",0,0,0,0,79233.5455426
324122,"Asphalt Shingle and Coating Materials Manufacturing",0,0,0,0,0
324191,"Petroleum Lubricating Oil and Grease Manufacturing",0,0,0,0,0
324199,"All Other Petroleum and Coal Products Manufacturing",0,0,0,0,0
325110,"Petrochemical Manufacturing",0,0,0,0,0
325120,"Industrial Gas Manufacturing",0,0,0,0,0
325130,"Synthetic Dye and Pigment Manufacturing",0,0,0,0,0
325180,"Other Basic Inorganic Chemical Manufacturing",0,0,0,0,0
325193,"Ethyl Alcohol Manufacturing",0,0,0,0,0
325194,"Cyclic Crude, Intermediate, and Gum and Wood Chemical Manufacturing",0,0,0,0,0
325199,"All Other Basic Organic Chemical Manufacturing",0,0,0,0,0
325211,"Plastics Material and Resin Manufacturing",0,0,0,0,0
325212,"Synthetic Rubber Manufacturing",0,0,0,0,0
325220,"Artificial and Synthetic Fibers and Filaments Manufacturing",0,0,0,0,0
325311,"Nitrogenous Fertilizer Manufacturing",0,0,0,0,0
325312,"Phosphatic Fertilizer Manufacturing",0,0,0,0,0
325314,"Fertilizer (Mixing Only) Manufacturing",0,0,0,0,0
325315,"Compost Manufacturing",0,0,0,0,0
325320,"Pesticide and Other Agricultural Chemical Manufacturing",0,0,0,0,0
325411,"Medicinal and Botanical Manufacturing",0,0,0,0,0
325412,"Pharmaceutical Preparation Manufacturing",0,0,0,0,0
325413,"In-Vitro Diagnostic Substance Manufacturing",0,0,0,0,0
325414,"Biological Product (except Diagnostic) Manufacturing",0,0,0,0,0
325510,"Paint and Coating Manufacturing",0,0,0,0,0
325520,"Adhesive Manufacturing",0,0,0,0,0
325611,"Soap and Other Detergent Manufacturing",0,0,0,0,41899.483497
325612,"Polish and Other Sanitation Good Manufacturing",0,0,0,0,0
325613,"Surface Active Agent Manufacturing",0,0,0,0,0
325620,"Toilet Preparation Manufacturing",0,0,0,0,0
325910,"Printing Ink Manufacturing",0,0,0,0,0
325920,"Explosives Manufacturing",0,0,0,0,0
325991,"Custom Compounding of Purchased Resins",0,0,0,0,0
325992,"Photographic Film, Paper, Plate, and Chemical Manufacturing",0,0,0,0,0
325998,"All Other Miscellaneous Chemical Product and Preparation Manufacturing",0,0,0,0,0
326111,"Plastics Bag and Pouch Manufacturing",0,0,0,0,0
326112,"Plastics Packaging Film and Sheet (including Laminated) Manufacturing",0,0,0,0,0
326113,"Unlaminated Plastics Film and Sheet (except Packaging) Manufacturing",0,0,0,0,0
326121,"Unlaminated Plastics Profile Shape Manufacturing",0,0,0,0,0
326122,"Plastics Pipe and Pipe Fitting Manufacturing",0,0,0,0,0
326130,"Laminated Plastics Plate, Sheet (except Packaging), and Shape Manufacturing",0,0,0,0,0
326140,"Polystyrene Foam Product Manufacturing",0,0,0,0,0
326150,"Urethane and Other Foam Product (except Polystyrene) Manufacturing",0,0,0,0,0
326160,"Plastics Bottle Manufacturing",0,0,0,0,0
326191,"Plastics Plumbing Fixture Manufacturing",0,0,0,0,0
326199,"All Other Plastics Product Manufacturing",0,0,0,0,16171.8743833
326211,"Tire Manufacturing (except Retreading)",0,0,0,0,0
326212,"Tire Retreading",0,0,0,0,0
326220,"Rubber and Plastics Hoses and Belting Manufacturing",0,0,0,0,0
326291,"Rubber Product Manufacturing for Mechanical Use",0,0,0,0,0
326299,"All Other Rubber Product Manufacturing",0,0,0,0,0
327110,"Pottery, Ceramics, and Plumbing Fixture Manufacturing",0,0,0,0,0
327120,"Clay Building Material and Refractories Manufacturing",0,0,0,0,0
327211,"Flat Glass Manufacturing",0,0,0,0,0
327212,"Other Pressed and Blown Glass and Glassware Manufacturing",0,0,0,0,0
327213,"Glass Container Manufacturing",0,0,0,0,0
327215,"Glass Product Manufacturing Made of Purchased Glass",0,0,0,0,18920.3592028
327310,"Cement Manufacturing",0,0,0,0,0
327320,"Ready-Mix Concrete Manufacturing",0.79423124682,0.229481012514,0.406340712361,124166.556421,70123.091832
327331,"Concrete Block and Brick Manufacturing",0,0,0,0,0
327332,"Concrete Pipe Manufacturing",0,0,0,0,0
327390,"Other Concrete Product Manufacturing",0.0251237324823,0.00560434983835,0.287117166591,121848.38588,2378.40526854
327410,"Lime Manufacturing",0,0,0,0,0
327420,"Gypsum Product Manufacturing",0,0,0,0,0
327910,"Abrasive Product Manufacturing",0,0,0,0,0
327991,"Cut Stone and Stone Product Manufacturing",0,0,0,0,0
327992,"Ground or Treated Mineral and Earth Manufacturing",0,0,0,0,0
327993,"Mineral Wool Manufacturing",0,0,0,0,0
327999,"All Other Miscellaneous Nonmetallic Mineral Product Manufacturing",0,0,0,0,0
331110,"Iron and Steel Mills and Ferroalloy Manufacturing",0,0,0,0,0
331210,"Iron and Steel Pipe and Tube Manufacturing from Purchased Steel",0,0,0,0,0
331221,"Rolled Steel Shape Manufacturing",0,0,0,0,0
331222,"Steel Wire Drawing",0,0,0,0,0
331313,"Alumina Refining and Primary Aluminum Production",0,0,0,0,0
331314,"Secondary Smelting and Alloying of Aluminum",0,0,0,0,0
331315,"Aluminum Sheet, Plate, and Foil Manufacturing",0,0,0,0,0
331318,"Other Aluminum Rolling, Drawing, and Extruding",0,0,0,0,0
331410,"Nonferrous Metal (except Aluminum) Smelting and Refining",0,0,0,0,0
331420,"Copper Rolling, Drawing, Extruding, and Alloying",0,0,0,0,0
331491,"Nonferrous Metal (except Copper and Aluminum) Rolling, Drawing, and Extruding",0,0,0,0,0
331492,"Secondary Smelting, Refining, and Alloying of Nonferrous Metal (except Copper and Aluminum)",0,0,0,0,0
331511,"Iron Foundries",0,0,0,0,0
331512,"Steel Investment Foundries",0,0,0,0,0
331513,"Steel Foundries (except Investment)",0,0,0,0,0
331523,"Nonferrous Metal Die-Casting Foundries",0,0,0,0,0
331524,"Aluminum Foundries (except Die-Casting)",0,0,0,0,0
331529,"Other Nonferrous Metal Foundries (except Die-Casting)",0,0,0,0,0
332111,"Iron and Steel Forging",0,0,0,0,0
332112,"Nonferrous Forging",0,0,0,0,0
332114,"Custom Roll Forming",0,0,0,0,0
332117,"Powder Metallurgy Part Manufacturing",0,0,0,0,0
332119,"Metal Crown, Closure, and Other Metal Stamping (except Automotive)",0,0,0,0,0
332215,"Metal Kitchen Cookware, Utensil, Cutlery, and Flatware (except Precious) Manufacturing",0,0,0,0,0
332216,"Saw Blade and Handtool Manufacturing",0,0,0,0,0
332311,"Prefabricated Metal Building and Component Manufacturing",0,0,0,0,0
332312,"Fabricated Structural Metal Manufacturing",4.2348429887,0.22224393181,0.0553865284467,59888.3824688,243712.721005
332313,"Plate Work Manufacturing",0,0,0,0,0
332321,"Metal Window and Door Manufacturing",0,0,0,0,0
332322,"Sheet Metal Work Manufacturing",0,0,0,0,0
332323,"Ornamental and Architectural Metal Work Manufacturing",0,0,0,0,7766.08576884
332410,"Power Boiler and Heat Exchanger Manufacturing",0,0,0,0,0
332420,"Metal Tank (Heavy Gauge) Manufacturing",0,0,0,0,0
332431,"Metal Can Manufacturing",0,0,0,0,0
332439,"Other Metal Container Manufacturing",0,0,0,0,0
332510,"Hardware Manufacturing",0,0,0,0,0
332613,"Spring Manufacturing",0,0,0,0,0
332618,"Other Fabricated Wire Product Manufacturing",0,0,0,0,0
332710,"Machine Shops",1.54482866847,0.237185386089,0.181383860021,70091.093663,133395.180011
332721,"Precision Turned Product Manufacturing",0,0,0,0,0
332722,"Bolt, Nut, Screw, Rivet, and Washer Manufacturing",0,0,0,0,0
332811,"Metal Heat Treating",0,0,0,0,0
332812,"Metal Coating, Engraving (except Jewelry and Silverware), and Allied Services to Manufacturers",0,0,0,0,0
332813,"Electroplating, Plating, Polishing, Anodizing, and Coloring",0,0,0,0,0
332911,"Industrial Valve Manufacturing",0,0,0,0,0
332912,"Fluid Power Valve and Hose Fitting Manufacturing",0,0,0,0,0
332913,"Plumbing Fixture Fitting and Trim Manufacturing",0,0,0,0,0
332919,"Other Metal Valve and Pipe Fitting Manufacturing",0,0,0,0,0
332991,"Ball and Roller Bearing Manufacturing",0,0,0,0,0
332992,"Small Arms Ammunition Manufacturing",0,0,0,0,0
332993,"Ammunition (except Small Arms) Manufacturing",0,0,0,0,0
332994,"Small Arms, Ordnance, and Ordnance Accessories Manufacturing",0,0,0,0,0
332996,"Fabricated Pipe and Pipe Fitting Manufacturing",0,0,0,0,0
332999,"All Other Miscellaneous Fabricated Metal Product Manufacturing",0,0,0,0,0
333111,"Farm Machinery and Equipment Manufacturing",0,0,0,0,11809.2665373
333112,"Lawn and Garden Tractor and Home Lawn and Garden Equipment Manufacturing",0,0,0,0,0
333120,"Construction Machinery Manufacturing",0,0,0,0,0
333131,"Mining Machinery and Equipment Manufacturing",0,0,0,0,0
333132,"Oil and Gas Field Machinery and Equipment Manufacturing",0,0,0,0,0
333241,"Food Product Machinery Manufacturing",0,0,0,0,0
333242,"Semiconductor Machinery Manufacturing",0,0,0,0,0
333243,"Sawmill, Woodworking, and Paper Machinery Manufacturing",0,0,0,0,0
333248,"All Other Industrial Machinery Manufacturing",0,0,0,0,11777.4748442
333310,"Commercial and Service Industry Machinery Manufacturing",0,0,0,0,7837.33478061
333413,"Industrial and Commercial Fan and Blower and Air Purification Equipment Manufacturing",0,0,0,0,0
333414,"Heating Equipment (except Warm Air Furnaces) Manufacturing",0,0,0,0,0
333415,"Air-Conditioning and Warm Air Heating Equipment and Commercial and Industrial Refrigeration Equipment Manufacturing",0,0,0,0,0
333511,"Industrial Mold Manufacturing",0,0,0,0,8231.75830549
333514,"Special Die and Tool, Die Set, Jig, and Fixture Manufacturing",0,0,0,0,12244.5531721
333515,"Cutting Tool and Machine Tool Accessory Manufacturing",0,0,0,0,0
333517,"Machine Tool Manufacturing",0,0,0,0,0
333519,"Rolling Mill and Other Metalworking Machinery Manufacturing",0,0,0,0,0
333611,"Turbine and Turbine Generator Set Units Manufacturing",0,0,0,0,0
333612,"Speed Changer, Industrial High-Speed Drive, and Gear Manufacturing",0,0,0,0,0
333613,"Mechanical Power Transmission Equipment Manufacturing",0,0,0,0,0
333618,"Other Engine Equipment Manufacturing",0,0,0,0,0
333912,"Air and Gas Compressor Manufacturing",0,0,0,0,0
333914,"Measuring, Dispensing, and Other Pumping Equipment Manufacturing",0,0,0,0,0
333921,"Elevator and Moving Stairway Manufacturing",0,0,0,0,0
333922,"Conveyor and Conveying Equipment Manufacturing",0,0,0,0,0
333923,"Overhead Traveling Crane, Hoist, and Monorail System Manufacturing",0,0,0,0,0
333924,"Industrial Truck, Tractor, Trailer, and Stacker Machinery Manufacturing",0,0,0,0,0
333991,"Power-Driven Handtool Manufacturing",0,0,0,0,0
333992,"Welding and Soldering Equipment Manufacturing",0,0,0,0,0
333993,"Packaging Machinery Manufacturing",0,0,0,0,0
333994,"Industrial Process Furnace and Oven Manufacturing",0,0,0,0,0
333995,"Fluid Power Cylinder and Actuator Manufacturing",0,0,0,0,0
333996,"Fluid Power Pump and Motor Manufacturing",0,0,0,0,0
333998,"All Other Miscellaneous General Purpose Machinery Manufacturing",0,0,0,0,14752.7632572
334111,"Electronic Computer Manufacturing",0,0,0,0,0
334112,"Computer Storage Device Manufacturing",0,0,0,0,0
334118,"Computer Terminal and Other Computer Peripheral Equipment Manufacturing",0,0,0,0,0
334210,"Telephone Apparatus Manufacturing",0,0,0,0,0
334220,"Radio and Television Broadcasting and Wireless Communications Equipment Manufacturing",0,0,0,0,0
334290,"Other Communications Equipment Manufacturing",0,0,0,0,0
334310,"Audio and Video Equipment Manufacturing",0,0,0,0,0
334412,"Bare Printed Circuit Board Manufacturing",0,0,0,0,0
334413,"Semiconductor and Related Device Manufacturing",0,0,0,0,0
334416,"Capacitor, Resistor, Coil, Transformer, and Other Inductor Manufacturing",0,0,0,0,0
334417,"Electronic Connector Manufacturing",0,0,0,0,0
334418,"Printed Circuit Assembly (Electronic Assembly) Manufacturing",0,0,0,0,0
334419,"Other Electronic Component Manufacturing",0,0,0,0,0
334510,"Electromedical and Electrotherapeutic Apparatus Manufacturing",0,0,0,0,0
334511,"Search, Detection, Navigation, Guidance, Aeronautical, and Nautical System and Instrument Manufacturing",0,0,0,0,0
334512,"Automatic Environmental Control Manufacturing for Residential, Commercial, and Appliance Use",0,0,0,0,0
334513,"Instruments and Related Products Manufacturing for Measuring, Displaying, and Controlling Industrial Process Variables",0,0,0,0,0
334514,"Totalizing Fluid Meter and Counting Device Manufacturing",0,0,0,0,0
334515,"Instrument Manufacturing for Measuring and Testing Electricity and Electrical Signals",0,0,0,0,0
334516,"Analytical Laboratory Instrument Manufacturing",0,0,0,0,0
334517,"Irradiation Apparatus Manufacturing",0,0,0,0,0
334519,"Other Measuring and Controlling Device Manufacturing",0,0,0,0,0
334610,"Manufacturing and Reproducing Magnetic and Optical Media",0,0,0,0,0
335131,"Residential Electric Lighting Fixture Manufacturing",0,0,0,0,46624.807957
335132,"Commercial, Industrial, and Institutional Electric Lighting Fixture Manufacturing",0,0,0,0,0
335139,"Electric Lamp Bulb and Other Lighting Equipment Manufacturing",0.0215936571322,0.00585475625254,0.371992701225,192790.779184,3034.31496409
335210,"Small Electrical Appliance Manufacturing",0,0,0,0,0
335220,"Major Household Appliance Manufacturing",0,0,0,0,0
335311,"Power, Distribution, and Specialty Transformer Manufacturing",0,0,0,0,0
335312,"Motor and Generator Manufacturing",0,0,0,0,0
335313,"Switchgear and Switchboard Apparatus Manufacturing",0,0,0,0,45996.176489
335314,"Relay and Industrial Control Manufacturing",0,0,0,0,0
335910,"Battery Manufacturing",0,0,0,0,0
335921,"Fiber Optic Cable Manufacturing",0,0,0,0,0
335929,"Other Communication and Energy Wire Manufacturing",0,0,0,0,0
335931,"Current-Carrying Wiring Device Manufacturing",0,0,0,0,0
335932,"Noncurrent-Carrying Wiring Device Manufacturing",0,0,0,0,0
335991,"Carbon and Graphite Product Manufacturing",0,0,0,0,0
335999,"All Other Miscellaneous Electrical Equipment and Component Manufacturing",0,0,0,0,0
336110,"Automobile and Light Duty Motor Vehicle Manufacturing",0,0,0,0,0
336120,"Heavy Duty Truck Manufacturing",0,0,0,0,0
336211,"Motor Vehicle Body Manufacturing",0,0,0,0,0
336212,"Truck Trailer Manufacturing",0,0,0,0,0
336213,"Motor Home Manufacturing",0,0,0,0,0
336214,"Travel Trailer and Camper Manufacturing",0,0,0,0,0
