NAICS,Description,"2023 Jobs","2022 - 2023 Change","2022 - 2023 % Change","Avg. Earnings Per Job","2022 GRP Earnings"
111000,"Crop Production",0.092471446015,0.00587542549624,0.067848677815,56713.6548969,29479.8108821
112000,"Animal Production",0.000226400660964,7.97686735312E-5,0.544005949368,22785.2447195,3.3618123036
113110,"Timber Tract Operations",0,0,0,0,0
113210,"Forest Nurseries and Gathering of Forest Products",0,0,0,0,0
113310,Logging,0.000243365946274,4.56954356432E-5,0.231169715186,69979.3534389,13.837133493
114111,"Finfish Fishing",0.000244350442351,2.46842924246E-5,0.112371853528,170115.992047,37.4114624631
114112,"Shellfish Fishing",0,0,0,0,0
114119,"Other Marine Fishing",0,0,0,0,0
114210,"Hunting and Trapping",0.000237119562421,1.13048229268E-5,0.0500623783555,56210.5694279,12.6931906556
115111,"Cotton Ginning",0,0,0,0,0
115112,"Soil Preparation, Planting, and Cultivating",0.000225810617697,2.77076566919E-6,0.0124227381071,33747.0849358,7.53419530654
115113,"Crop Harvesting, Primarily by Machine",0,0,0,0,0
115114,"Postharvest Crop Activities (except Cotton Ginning)",0.000212428107644,-2.66076260111E-6,-0.0123705266483,28843.653868,6.20395653103
115115,"Farm Labor Contractors and Crew Leaders",0.000197732362521,-6.23373820016E-6,-0.0305626188769,26042.1890119,5.31400520777
115116,"Farm Management Services",0.000181821790176,-8.83932112352E-6,-0.0463614266344,22309.9382848,4.28402946164
115210,"Support Activities for Animal Production",0.000164522492756,-1.1067587049E-5,-0.0630308219081,16084.7934897,2.87750315958
115310,"Support Activities for Forestry",0.000151959448172,-6.92654134639E-6,-0.0435944123669,154105.677688,24.9575140612
211120,"Crude Petroleum Extraction",0,0,0,0,0
211130,"Natural Gas Extraction",0,0,0,0,0
212114,"Surface Coal Mining",0,0,0,0,0
212115,"Underground Coal Mining",0,0,0,0,0
212210,"Iron Ore Mining",0,0,0,0,0
212220,"Gold Ore and Silver Ore Mining",0,0,0,0,0
212230,"Copper, Nickel, Lead, and Zinc Mining",0,0,0,0,0
212290,"Other Metal Ore Mining",0,0,0,0,0
212311,"Dimension Stone Mining and Quarrying",0,0,0,0,0
212312,"Crushed and Broken Limestone Mining and Quarrying",0,0,0,0,0
212313,"Crushed and Broken Granite Mining and Quarrying",0,0,0,0,0
212319,"Other Crushed and Broken Stone Mining and Quarrying",0,0,0,0,0
212321,"Construction Sand and Gravel Mining",0,0,0,0,0
212322,"Industrial Sand Mining",0,0,0,0,0
212323,"Kaolin, Clay, and Ceramic and Refractory Minerals Mining",0,0,0,0,0
212390,"Other Nonmetallic Mineral Mining and Quarrying",0,0,0,0,0
213111,"Drilling Oil and Gas Wells",0,0,0,0,0
213112,"Support Activities for Oil and Gas Operations",0,0,0,0,0
213113,"Support Activities for Coal Mining",0,0,0,0,0
213114,"Support Activities for Metal Mining",0,0,0,0,0
213115,"Support Activities for Nonmetallic Minerals (except Fuels) Mining",0,0,0,0,0
221111,"Hydroelectric Power Generation",0,0,0,0,0
221112,"Fossil Fuel Electric Power Generation",0,0,0,0,0
221113,"Nuclear Electric Power Generation",0,0,0,0,0
221114,"Solar Electric Power Generation",0,0,0,0,0
221115,"Wind Electric Power Generation",0,0,0,0,0
221116,"Geothermal Electric Power Generation",0,0,0,0,0
221117,"Biomass Electric Power Generation",0,0,0,0,0
221118,"Other Electric Power Generation",0,0,0,0,0
221121,"Electric Bulk Power Transmission and Control",0,0,0,0,0
221122,"Electric Power Distribution",0,0,0,0,0
221210,"Natural Gas Distribution",0,0,0,0,0
221310,"Water Supply and Irrigation Systems",0,0,0,0,0
221320,"Sewage Treatment Facilities",0,0,0,0,0
221330,"Steam and Air-Conditioning Supply",0,0,0,0,0
236115,"New Single-Family Housing Construction (except For-Sale Builders)",3.32376505255,0.334530845095,0.111911888423,62631.7888097,191745.432148
236116,"New Multifamily Housing Construction (except For-Sale Builders)",0.0181232429411,0.000196326500606,0.0109514930388,52941.8420165,1021.66755504
236117,"New Housing For-Sale Builders",0.0841662326904,0.000780787687251,0.00936359681503,50440.2409667,4836.90296004
236118,"Residential Remodelers",0.000212902828565,0.000140699176114,1.94864347353,53049.1670611,3.83589724608
236210,"Industrial Building Construction",4.37182005175E-5,1.06751352956E-5,0.323067343298,113849.611924,3.81575127146
236220,"Commercial and Institutional Building Construction",0,-1.38494537763E-5,-1,84920.8575076,1.18117108347
237110,"Water and Sewer Line and Related Structures Construction",0,0,0,0,0
237120,"Oil and Gas Pipeline and Related Structures Construction",1.09765092693E-5,-9.16402578417E-7,-0.0770545170226,102708.185163,1.22596855212
237130,"Power and Communication Line and Related Structures Construction",1.46667385579E-5,2.17489325062E-8,0.00148507667554,117806.131806,1.74838509794
237210,"Land Subdivision",1.71753827136E-5,5.6645870379E-7,0.0341056833937,99357.6695645,1.6502271136
237310,"Highway, Street, and Bridge Construction",1.85020118193E-5,8.20581300606E-7,0.0464092144433,107205.565128,1.89951493059
237990,"Other Heavy and Civil Engineering Construction",1.8862847452E-5,8.74362992007E-7,0.0486068180981,117850.871025,2.12773448248
238110,"Poured Concrete Foundation and Structure Contractors",6.97900146671E-5,5.20418796613E-5,2.93224497358,59476.8518587,1.05744974823
238120,"Structural Steel and Precast Concrete Contractors",0.000164656055781,0.000147487408212,8.59050822867,85099.3605229,1.46286504125
238130,"Framing Contractors",0.000224697565188,0.000208300543166,12.7035593957,66335.2273197,1.09151667093
238140,"Masonry Contractors",0.000256781048451,0.00024127383657,15.5588147259,61643.7011893,0.957798275808
238150,"Glass and Glazing Contractors",0.000270117342932,0.000255604814158,17.6126999045,62112.5798645,0.903789202876
238160,"Roofing Contractors",0.000271439784399,0.000258050915689,19.2735414222,82789.3067409,1.10982100253
238170,"Siding Contractors",0.000263980888801,0.000251881635183,20.8179482081,57737.6577354,0.700911383091
238190,"Other Foundation, Structure, and Building Exterior Contractors",0.000248494199816,0.000223495447806,8.94026420663,61562.3046946,1.5418482236
238210,"Electrical Contractors and Other Wiring Installation Contractors",0.000226400402345,0.000170106588359,3.02176342859,78634.4217736,4.49501101216
238220,"Plumbing, Heating, and Air-Conditioning Contractors",0.000198355481165,0.000135184297203,2.13996776261,77484.9853687,4.9052366474
238290,"Other Building Equipment Contractors",0.000165739356961,9.26326216171E-5,1.26708737822,111480.896674,8.16740315044
238310,"Drywall and Insulation Contractors",0.000868459508429,0.000787546712955,9.73327776341,65941.0513139,5.34178572215
238320,"Painting and Wall Covering Contractors",0.00213333358725,0.00204878780397,24.2328798027,52925.8554994,4.47716176116
238330,"Flooring Contractors",0.00217394397147,0.00208868065038,24.4968249387,56140.8133478,4.80119478069
238340,"Tile and Terrazzo Contractors",0.00175167723195,0.00166812488346,19.965026881,63460.6228531,5.30590443421
238350,"Finish Carpentry Contractors",0.00129398624011,0.00121428489142,15.2354371835,62101.6558106,4.9750347529
238390,"Other Building Finishing Contractors",0.00089008948209,0.000816073763631,11.0256818502,54000.3636289,4.03320437613
238910,"Site Preparation Contractors",0.000480704128844,0.000413726278497,6.17706116805,73874.8325784,4.95110393411
238990,"All Other Specialty Trade Contractors",6.40201807094E-5,4.91729347573E-6,0.083198870747,70981.0353592,4.21110542108
311111,"Dog and Cat Food Manufacturing",0,0,0,0,0
311119,"Other Animal Food Manufacturing",0,0,0,0,0
311211,"Flour Milling",0,0,0,0,0
311212,"Rice Milling",0,0,0,0,0
311213,"Malt Manufacturing",0,0,0,0,0
311221,"Wet Corn Milling",0,0,0,0,0
311224,"Soybean and Other Oilseed Processing",0,0,0,0,0
311225,"Fats and Oils Refining and Blending",0,0,0,0,0
311230,"Breakfast Cereal Manufacturing",0,0,0,0,0
311313,"Beet Sugar Manufacturing",0,0,0,0,0
311314,"Cane Sugar Manufacturing",0,0,0,0,0
311340,"Nonchocolate Confectionery Manufacturing",0,0,0,0,0
311351,"Chocolate and Confectionery Manufacturing from Cacao Beans",0,0,0,0,0
311352,"Confectionery Manufacturing from Purchased Chocolate",0,0,0,0,0
311411,"Frozen Fruit, Juice, and Vegetable Manufacturing",0,0,0,0,0
311412,"Frozen Specialty Food Manufacturing",0,0,0,0,0
311421,"Fruit and Vegetable Canning",0,0,0,0,0
311422,"Specialty Canning",0,0,0,0,0
311423,"Dried and Dehydrated Food Manufacturing",0,0,0,0,0
311511,"Fluid Milk Manufacturing",0,0,0,0,0
311512,"Creamery Butter Manufacturing",0,0,0,0,0
311513,"Cheese Manufacturing",0,0,0,0,0
311514,"Dry, Condensed, and Evaporated Dairy Product Manufacturing",0,0,0,0,0
311520,"Ice Cream and Frozen Dessert Manufacturing",0,0,0,0,0
311611,"Animal (except Poultry) Slaughtering",0,0,0,0,0
311612,"Meat Processed from Carcasses",0,0,0,0,0
311613,"Rendering and Meat Byproduct Processing",0,0,0,0,0
311615,"Poultry Processing",0,0,0,0,0
311710,"Seafood Product Preparation and Packaging",0,0,0,0,0
311811,"Retail Bakeries",0,0,0,0,0
311812,"Commercial Bakeries",0,0,0,0,0
311813,"Frozen Cakes, Pies, and Other Pastries Manufacturing",0,0,0,0,0
311821,"Cookie and Cracker Manufacturing",0,0,0,0,0
311824,"Dry Pasta, Dough, and Flour Mixes Manufacturing from Purchased Flour",0,0,0,0,0
311830,"Tortilla Manufacturing",0,0,0,0,0
311911,"Roasted Nuts and Peanut Butter Manufacturing",0,0,0,0,0
311919,"Other Snack Food Manufacturing",0,0,0,0,0
311920,"Coffee and Tea Manufacturing",0,0,0,0,0
311930,"Flavoring Syrup and Concentrate Manufacturing",0,0,0,0,0
311941,"Mayonnaise, Dressing, and Other Prepared Sauce Manufacturing",0,0,0,0,0
311942,"Spice and Extract Manufacturing",0,0,0,0,0
311991,"Perishable Prepared Food Manufacturing",0,0,0,0,0
311999,"All Other Miscellaneous Food Manufacturing",0,0,0,0,0
312111,"Soft Drink Manufacturing",0,0,0,0,0
312112,"Bottled Water Manufacturing",0,0,0,0,0
312113,"Ice Manufacturing",0,0,0,0,0
312120,Breweries,0,0,0,0,0
312130,Wineries,0,0,0,0,0
312140,Distilleries,0,0,0,0,0
312230,"Tobacco Manufacturing",0,0,0,0,0
313110,"Fiber, Yarn, and Thread Mills",0,0,0,0,0
313210,"Broadwoven Fabric Mills",0,0,0,0,0
313220,"Narrow Fabric Mills and Schiffli Machine Embroidery",0,0,0,0,0
313230,"Nonwoven Fabric Mills",0,0,0,0,0
313240,"Knit Fabric Mills",0,0,0,0,0
313310,"Textile and Fabric Finishing Mills",0,0,0,0,0
313320,"Fabric Coating Mills",0,0,0,0,0
314110,"Carpet and Rug Mills",0,0,0,0,0
314120,"Curtain and Linen Mills",0,0,0,0,0
314910,"Textile Bag and Canvas Mills",0,0,0,0,0
314994,"Rope, Cordage, Twine, Tire Cord, and Tire Fabric Mills",0,0,0,0,0
314999,"All Other Miscellaneous Textile Product Mills",0,0,0,0,0
315120,"Apparel Knitting Mills",0,0,0,0,0
315210,"Cut and Sew Apparel Contractors",0,0,0,0,0
315250,"Cut and Sew Apparel Manufacturing (except Contractors)",0,0,0,0,0
315990,"Apparel Accessories and Other Apparel Manufacturing",0,0,0,0,0
316110,"Leather and Hide Tanning and Finishing",0,0,0,0,0
316210,"Footwear Manufacturing",0,0,0,0,0
316990,"Other Leather and Allied Product Manufacturing",0,0,0,0,0
321113,Sawmills,0,0,0,0,0
321114,"Wood Preservation",0,0,0,0,0
321211,"Hardwood Veneer and Plywood Manufacturing",0,0,0,0,0
321212,"Softwood Veneer and Plywood Manufacturing",0,0,0,0,0
321215,"Engineered Wood Member Manufacturing",0,0,0,0,0
321219,"Reconstituted Wood Product Manufacturing",0,0,0,0,0
321911,"Wood Window and Door Manufacturing",0,0,0,0,0
321912,"Cut Stock, Resawing Lumber, and Planing",0,0,0,0,0
321918,"Other Millwork (including Flooring)",0,0,0,0,0
321920,"Wood Container and Pallet Manufacturing",0,0,0,0,0
321991,"Manufactured Home (Mobile Home) Manufacturing",0,0,0,0,0
321992,"Prefabricated Wood Building Manufacturing",0,0,0,0,0
321999,"All Other Miscellaneous Wood Product Manufacturing",0,0,0,0,0
322110,"Pulp Mills",0,0,0,0,0
322120,"Paper Mills",0,0,0,0,0
322130,"Paperboard Mills",0,0,0,0,0
322211,"Corrugated and Solid Fiber Box Manufacturing",0,0,0,0,0
322212,"Folding Paperboard Box Manufacturing",0,0,0,0,0
322219,"Other Paperboard Container Manufacturing",0,0,0,0,0
322220,"Paper Bag and Coated and Treated Paper Manufacturing",0,0,0,0,0
322230,"Stationery Product Manufacturing",0,0,0,0,0
322291,"Sanitary Paper Product Manufacturing",0,0,0,0,0
322299,"All Other Converted Paper Product Manufacturing",0,0,0,0,0
323111,"Commercial Printing (except Screen and Books)",0,0,0,0,0
323113,"Commercial Screen Printing",0,0,0,0,0
323117,"Books Printing",0,0,0,0,0
323120,"Support Activities for Printing",0,0,0,0,0
324110,"Petroleum Refineries",0,0,0,0,0
324121,"Asphalt Paving Mixture and Block Manufacturing",0,0,0,0,0
324122,"Asphalt Shingle and Coating Materials Manufacturing",0,0,0,0,0
324191,"Petroleum Lubricating Oil and Grease Manufacturing",0,0,0,0,0
324199,"All Other Petroleum and Coal Products Manufacturing",0,0,0,0,0
325110,"Petrochemical Manufacturing",0,0,0,0,0
325120,"Industrial Gas Manufacturing",0,0,0,0,0
325130,"Synthetic Dye and Pigment Manufacturing",0,0,0,0,0
325180,"Other Basic Inorganic Chemical Manufacturing",0,0,0,0,0
325193,"Ethyl Alcohol Manufacturing",0,0,0,0,0
325194,"Cyclic Crude, Intermediate, and Gum and Wood Chemical Manufacturing",0,0,0,0,0
325199,"All Other Basic Organic Chemical Manufacturing",0,0,0,0,0
325211,"Plastics Material and Resin Manufacturing",0,0,0,0,0
325212,"Synthetic Rubber Manufacturing",0,0,0,0,0
325220,"Artificial and Synthetic Fibers and Filaments Manufacturing",0,0,0,0,0
325311,"Nitrogenous Fertilizer Manufacturing",0,0,0,0,0
325312,"Phosphatic Fertilizer Manufacturing",0,0,0,0,0
325314,"Fertilizer (Mixing Only) Manufacturing",0,0,0,0,0
325315,"Compost Manufacturing",0,0,0,0,0
325320,"Pesticide and Other Agricultural Chemical Manufacturing",0,0,0,0,0
325411,"Medicinal and Botanical Manufacturing",0,0,0,0,0
325412,"Pharmaceutical Preparation Manufacturing",0,0,0,0,0
325413,"In-Vitro Diagnostic Substance Manufacturing",0,0,0,0,0
325414,"Biological Product (except Diagnostic) Manufacturing",0,0,0,0,0
325510,"Paint and Coating Manufacturing",0,0,0,0,0
325520,"Adhesive Manufacturing",0,0,0,0,0
325611,"Soap and Other Detergent Manufacturing",0,0,0,0,0
325612,"Polish and Other Sanitation Good Manufacturing",0,0,0,0,0
325613,"Surface Active Agent Manufacturing",0,0,0,0,0
325620,"Toilet Preparation Manufacturing",0,0,0,0,0
325910,"Printing Ink Manufacturing",0,0,0,0,0
325920,"Explosives Manufacturing",0,0,0,0,0
325991,"Custom Compounding of Purchased Resins",0,0,0,0,0
325992,"Photographic Film, Paper, Plate, and Chemical Manufacturing",0,0,0,0,0
325998,"All Other Miscellaneous Chemical Product and Preparation Manufacturing",0,0,0,0,0
326111,"Plastics Bag and Pouch Manufacturing",0,0,0,0,0
326112,"Plastics Packaging Film and Sheet (including Laminated) Manufacturing",0,0,0,0,0
326113,"Unlaminated Plastics Film and Sheet (except Packaging) Manufacturing",0,0,0,0,0
326121,"Unlaminated Plastics Profile Shape Manufacturing",0,0,0,0,0
326122,"Plastics Pipe and Pipe Fitting Manufacturing",0,0,0,0,0
326130,"Laminated Plastics Plate, Sheet (except Packaging), and Shape Manufacturing",0,0,0,0,0
326140,"Polystyrene Foam Product Manufacturing",0,0,0,0,0
326150,"Urethane and Other Foam Product (except Polystyrene) Manufacturing",0,0,0,0,0
326160,"Plastics Bottle Manufacturing",0,0,0,0,0
326191,"Plastics Plumbing Fixture Manufacturing",0,0,0,0,0
326199,"All Other Plastics Product Manufacturing",0,0,0,0,0
326211,"Tire Manufacturing (except Retreading)",0,0,0,0,0
326212,"Tire Retreading",0,0,0,0,0
326220,"Rubber and Plastics Hoses and Belting Manufacturing",0,0,0,0,0
326291,"Rubber Product Manufacturing for Mechanical Use",0,0,0,0,0
326299,"All Other Rubber Product Manufacturing",0,0,0,0,0
327110,"Pottery, Ceramics, and Plumbing Fixture Manufacturing",0,0,0,0,0
327120,"Clay Building Material and Refractories Manufacturing",0,0,0,0,0
327211,"Flat Glass Manufacturing",0,0,0,0,0
327212,"Other Pressed and Blown Glass and Glassware Manufacturing",0,0,0,0,0
327213,"Glass Container Manufacturing",0,0,0,0,0
327215,"Glass Product Manufacturing Made of Purchased Glass",0,0,0,0,0
327310,"Cement Manufacturing",0,0,0,0,0
327320,"Ready-Mix Concrete Manufacturing",0,0,0,0,0
327331,"Concrete Block and Brick Manufacturing",0,0,0,0,0
327332,"Concrete Pipe Manufacturing",0,0,0,0,0
327390,"Other Concrete Product Manufacturing",0,0,0,0,0
327410,"Lime Manufacturing",0,0,0,0,0
327420,"Gypsum Product Manufacturing",0,0,0,0,0
327910,"Abrasive Product Manufacturing",0,0,0,0,0
327991,"Cut Stone and Stone Product Manufacturing",0,0,0,0,0
327992,"Ground or Treated Mineral and Earth Manufacturing",0,0,0,0,0
327993,"Mineral Wool Manufacturing",0,0,0,0,0
327999,"All Other Miscellaneous Nonmetallic Mineral Product Manufacturing",0,0,0,0,0
331110,"Iron and Steel Mills and Ferroalloy Manufacturing",0,0,0,0,0
331210,"Iron and Steel Pipe and Tube Manufacturing from Purchased Steel",0,0,0,0,0
331221,"Rolled Steel Shape Manufacturing",0,0,0,0,0
331222,"Steel Wire Drawing",0,0,0,0,0
331313,"Alumina Refining and Primary Aluminum Production",0,0,0,0,0
331314,"Secondary Smelting and Alloying of Aluminum",0,0,0,0,0
331315,"Aluminum Sheet, Plate, and Foil Manufacturing",0,0,0,0,0
331318,"Other Aluminum Rolling, Drawing, and Extruding",0,0,0,0,0
331410,"Nonferrous Metal (except Aluminum) Smelting and Refining",0,0,0,0,0
331420,"Copper Rolling, Drawing, Extruding, and Alloying",0,0,0,0,0
331491,"Nonferrous Metal (except Copper and Aluminum) Rolling, Drawing, and Extruding",0,0,0,0,0
331492,"Secondary Smelting, Refining, and Alloying of Nonferrous Metal (except Copper and Aluminum)",0,0,0,0,0
331511,"Iron Foundries",0,0,0,0,0
331512,"Steel Investment Foundries",0,0,0,0,0
331513,"Steel Foundries (except Investment)",0,0,0,0,0
331523,"Nonferrous Metal Die-Casting Foundries",0,0,0,0,0
331524,"Aluminum Foundries (except Die-Casting)",0,0,0,0,0
331529,"Other Nonferrous Metal Foundries (except Die-Casting)",0,0,0,0,0
332111,"Iron and Steel Forging",0,0,0,0,0
332112,"Nonferrous Forging",0,0,0,0,0
332114,"Custom Roll Forming",0,0,0,0,0
332117,"Powder Metallurgy Part Manufacturing",0,0,0,0,0
332119,"Metal Crown, Closure, and Other Metal Stamping (except Automotive)",0,0,0,0,0
332215,"Metal Kitchen Cookware, Utensil, Cutlery, and Flatware (except Precious) Manufacturing",0,0,0,0,0
332216,"Saw Blade and Handtool Manufacturing",0,0,0,0,0
332311,"Prefabricated Metal Building and Component Manufacturing",0,0,0,0,0
332312,"Fabricated Structural Metal Manufacturing",0,0,0,0,0
332313,"Plate Work Manufacturing",0,0,0,0,0
332321,"Metal Window and Door Manufacturing",0,0,0,0,0
332322,"Sheet Metal Work Manufacturing",0,0,0,0,0
332323,"Ornamental and Architectural Metal Work Manufacturing",0,0,0,0,0
332410,"Power Boiler and Heat Exchanger Manufacturing",0,0,0,0,0
332420,"Metal Tank (Heavy Gauge) Manufacturing",0,0,0,0,0
332431,"Metal Can Manufacturing",0,0,0,0,0
332439,"Other Metal Container Manufacturing",0,0,0,0,0
332510,"Hardware Manufacturing",0,0,0,0,0
332613,"Spring Manufacturing",0,0,0,0,0
332618,"Other Fabricated Wire Product Manufacturing",0,0,0,0,0
332710,"Machine Shops",0,0,0,0,0
332721,"Precision Turned Product Manufacturing",0,0,0,0,0
332722,"Bolt, Nut, Screw, Rivet, and Washer Manufacturing",0,0,0,0,0
332811,"Metal Heat Treating",0,0,0,0,0
332812,"Metal Coating, Engraving (except Jewelry and Silverware), and Allied Services to Manufacturers",0,0,0,0,0
332813,"Electroplating, Plating, Polishing, Anodizing, and Coloring",0,0,0,0,0
332911,"Industrial Valve Manufacturing",0,0,0,0,0
332912,"Fluid Power Valve and Hose Fitting Manufacturing",0,0,0,0,0
332913,"Plumbing Fixture Fitting and Trim Manufacturing",0,0,0,0,0
332919,"Other Metal Valve and Pipe Fitting Manufacturing",0,0,0,0,0
332991,"Ball and Roller Bearing Manufacturing",0,0,0,0,0
332992,"Small Arms Ammunition Manufacturing",0,0,0,0,0
332993,"Ammunition (except Small Arms) Manufacturing",0,0,0,0,0
332994,"Small Arms, Ordnance, and Ordnance Accessories Manufacturing",0,0,0,0,0
332996,"Fabricated Pipe and Pipe Fitting Manufacturing",0,0,0,0,0
332999,"All Other Miscellaneous Fabricated Metal Product Manufacturing",0,0,0,0,0
333111,"Farm Machinery and Equipment Manufacturing",0,0,0,0,0
333112,"Lawn and Garden Tractor and Home Lawn and Garden Equipment Manufacturing",0,0,0,0,0
333120,"Construction Machinery Manufacturing",0,0,0,0,0
333131,"Mining Machinery and Equipment Manufacturing",0,0,0,0,0
333132,"Oil and Gas Field Machinery and Equipment Manufacturing",0,0,0,0,0
333241,"Food Product Machinery Manufacturing",0,0,0,0,0
333242,"Semiconductor Machinery Manufacturing",0,0,0,0,0
333243,"Sawmill, Woodworking, and Paper Machinery Manufacturing",0,0,0,0,0
333248,"All Other Industrial Machinery Manufacturing",0,0,0,0,0
333310,"Commercial and Service Industry Machinery Manufacturing",0,0,0,0,0
333413,"Industrial and Commercial Fan and Blower and Air Purification Equipment Manufacturing",0,0,0,0,0
333414,"Heating Equipment (except Warm Air Furnaces) Manufacturing",0,0,0,0,0
333415,"Air-Conditioning and Warm Air Heating Equipment and Commercial and Industrial Refrigeration Equipment Manufacturing",0,0,0,0,0
333511,"Industrial Mold Manufacturing",0,0,0,0,0
333514,"Special Die and Tool, Die Set, Jig, and Fixture Manufacturing",0,0,0,0,0
333515,"Cutting Tool and Machine Tool Accessory Manufacturing",0,0,0,0,0
333517,"Machine Tool Manufacturing",0,0,0,0,0
333519,"Rolling Mill and Other Metalworking Machinery Manufacturing",0,0,0,0,0
333611,"Turbine and Turbine Generator Set Units Manufacturing",0,0,0,0,0
333612,"Speed Changer, Industrial High-Speed Drive, and Gear Manufacturing",0,0,0,0,0
333613,"Mechanical Power Transmission Equipment Manufacturing",0,0,0,0,0
333618,"Other Engine Equipment Manufacturing",0,0,0,0,0
333912,"Air and Gas Compressor Manufacturing",0,0,0,0,0
333914,"Measuring, Dispensing, and Other Pumping Equipment Manufacturing",0,0,0,0,0
333921,"Elevator and Moving Stairway Manufacturing",0,0,0,0,0
333922,"Conveyor and Conveying Equipment Manufacturing",0,0,0,0,0
333923,"Overhead Traveling Crane, Hoist, and Monorail System Manufacturing",0,0,0,0,0
333924,"Industrial Truck, Tractor, Trailer, and Stacker Machinery Manufacturing",0,0,0,0,0
333991,"Power-Driven Handtool Manufacturing",0,0,0,0,0
333992,"Welding and Soldering Equipment Manufacturing",0,0,0,0,0
333993,"Packaging Machinery Manufacturing",0,0,0,0,0
333994,"Industrial Process Furnace and Oven Manufacturing",0,0,0,0,0
333995,"Fluid Power Cylinder and Actuator Manufacturing",0,0,0,0,0
333996,"Fluid Power Pump and Motor Manufacturing",0,0,0,0,0
333998,"All Other Miscellaneous General Purpose Machinery Manufacturing",0,0,0,0,0
334111,"Electronic Computer Manufacturing",0,0,0,0,0
334112,"Computer Storage Device Manufacturing",0,0,0,0,0
334118,"Computer Terminal and Other Computer Peripheral Equipment Manufacturing",0,0,0,0,0
334210,"Telephone Apparatus Manufacturing",0,0,0,0,0
334220,"Radio and Television Broadcasting and Wireless Communications Equipment Manufacturing",0,0,0,0,0
334290,"Other Communications Equipment Manufacturing",0,0,0,0,0
334310,"Audio and Video Equipment Manufacturing",0,0,0,0,0
334412,"Bare Printed Circuit Board Manufacturing",0,0,0,0,0
334413,"Semiconductor and Related Device Manufacturing",0,0,0,0,0
334416,"Capacitor, Resistor, Coil, Transformer, and Other Inductor Manufacturing",0,0,0,0,0
334417,"Electronic Connector Manufacturing",0,0,0,0,0
334418,"Printed Circuit Assembly (Electronic Assembly) Manufacturing",0,0,0,0,0
334419,"Other Electronic Component Manufacturing",0,0,0,0,0
334510,"Electromedical and Electrotherapeutic Apparatus Manufacturing",0,0,0,0,0
334511,"Search, Detection, Navigation, Guidance, Aeronautical, and Nautical System and Instrument Manufacturing",0,0,0,0,0
334512,"Automatic Environmental Control Manufacturing for Residential, Commercial, and Appliance Use",0,0,0,0,0
334513,"Instruments and Related Products Manufacturing for Measuring, Displaying, and Controlling Industrial Process Variables",0,0,0,0,0
334514,"Totalizing Fluid Meter and Counting Device Manufacturing",0,0,0,0,0
334515,"Instrument Manufacturing for Measuring and Testing Electricity and Electrical Signals",0,0,0,0,0
334516,"Analytical Laboratory Instrument Manufacturing",0,0,0,0,0
334517,"Irradiation Apparatus Manufacturing",0,0,0,0,0
334519,"Other Measuring and Controlling Device Manufacturing",0,0,0,0,0
334610,"Manufacturing and Reproducing Magnetic and Optical Media",0,0,0,0,0
335131,"Residential Electric Lighting Fixture Manufacturing",0,0,0,0,0
335132,"Commercial, Industrial, and Institutional Electric Lighting Fixture Manufacturing",0,0,0,0,0
335139,"Electric Lamp Bulb and Other Lighting Equipment Manufacturing",0,0,0,0,0
335210,"Small Electrical Appliance Manufacturing",0,0,0,0,0
335220,"Major Household Appliance Manufacturing",0,0,0,0,0
335311,"Power, Distribution, and Specialty Transformer Manufacturing",0,0,0,0,0
335312,"Motor and Generator Manufacturing",0,0,0,0,0
335313,"Switchgear and Switchboard Apparatus Manufacturing",0,0,0,0,0
335314,"Relay and Industrial Control Manufacturing",0,0,0,0,0
335910,"Battery Manufacturing",0,0,0,0,0
335921,"Fiber Optic Cable Manufacturing",0,0,0,0,0
335929,"Other Communication and Energy Wire Manufacturing",0,0,0,0,0
335931,"Current-Carrying Wiring Device Manufacturing",0,0,0,0,0
335932,"Noncurrent-Carrying Wiring Device Manufacturing",0,0,0,0,0
335991,"Carbon and Graphite Product Manufacturing",0,0,0,0,0
335999,"All Other Miscellaneous Electrical Equipment and Component Manufacturing",0,0,0,0,0
336110,"Automobile and Light Duty Motor Vehicle Manufacturing",0,0,0,0,0
336120,"Heavy Duty Truck Manufacturing",0,0,0,0,0
336211,"Motor Vehicle Body Manufacturing",0,0,0,0,0
336212,"Truck Trailer Manufacturing",0,0,0,0,0
336213,"Motor Home Manufacturing",0,0,0,0,0
336214,"Travel Trailer and Camper Manufacturing",0,0,0,0,0
336310,"Motor Vehicle Gasoline Engine and Engine Parts Manufacturing",0,0,0,0,0
336320,"Motor Vehicle Electrical and Electronic Equipment Manufacturing",0,0,0,0,0
336330,"Motor Vehicle Steering and Suspension Components (except Spring) Manufacturing",0,0,0,0,0
